"#","No","Issue Title","Issue Details","State","Labels","User name","created","Updated"
"","1012","ask me before using sms fallback abroad","Hi folks,  I love your app and I think that I can convince many of the people surrounding me to use it. Also I'd love to use it as a replacement of the stock sms app, but there is one open problem for me:  Since I have friends abroad, sending sms to them is quite expensive. So I'd suggest to check and compare country codes of the telephone numbers and whenever they don't match textsecure should ask the user before using sms fallback...  Despite of this issue, I have to say I'm impressed of your work and I highly appreciate it... (and sorry for my first post being a feature request -_-)","closed","","zaibotw","2014-03-04T15:37:50Z","2014-03-14T12:45:04Z"
"","1207","'Tap for SMS fallback' apparently has a malfunction","Hi Everybody! Apparently, the recently implemented 'Tap for SMS fallback' function is not working correctly. Try yourselves:  Consider that everybody is a TextSecure user with 'Push messages' setted and all of them have an encrypted session established with Alice (me). I (Alice) am with all the following options setted:  [v] Push messages [v] Receive all SMS [v] SMS delivery reports [v] Complete key exchanges Allow ougoing SMS to:     [v] TextSecure users     [v] Ask before sending SMS     [v] Non-TextSecure users  Step 1. Alice (online) send the message 01 to Bob, which seems to have been delivered (blue balloon, locked).  Step 2. Alice (offline) send the message 02 to Bob, which is not sent; instead, appears the 'Tap for SMS fallback' tab, and Alice clicks 'Yes' in the box 'Fallback to SMS?', so the message is sent via SMS (green balloon, locked), as expected.  Step 3. Alice (online) send the message 03 to Bob, which seems to have been delivered (blue balloon, locked).  Step 4. Alice (offline) send the message 04 to Bob, which is not sent; instead, appears the 'Tap for SMS fallback' tab (dark green balloon, locked), and Alice clicks 'No' in the box 'Fallback to SMS?', so appears the red triangle with an exclamation mark inside icon ('Error sending message' at footnote, green balloon, locked).  Observation A: I imagine that the correct reaction should be this message remain in the queue to be sent via PUSH later when the phone is online again, instead of being dismissed as a permanent error.  Step 5. Alice (online) send the message 05 to Bob, which seems to have been delivered (blue balloon, locked).  Step 6. Alice (offline) send the message 06 to Bob, which is not sent; unlike other times, the 'Tap for SMS fallback' tab appeared no more; instead, the message stayed in a sort of pending status (dark blue balloon, reticence ... and locked at footnote); however, the message details advises the following: 'Transport: PUSH'.  Observation B: as we all know, the messages sent correctly, instead of dark blue and exhibit reticence and locked, are normal blue and reports the time and locked.  Observation C: the great crash happens from now on, because the 'Tap for SMS fallback' tab will appear nevermore in the session (window) established with Bob.  Observation D: the 'Tap for SMS fallback' keeps appearing to other contacts, but if the chosen option is 'Yes', unlike other times, when the message was sent via SMS, now the message stayed in another sort of pending status (dark green balloon, reticence ... and locked at footnote); however, this time (different of the step 6) the message details advises the following: 'Transport: PENDING'.  If you thought that this was a problem, you have not seen anything. The terror begins now.  Step 7. Alice, hungry for try to make her TextSecure return to normal, have an insight which will make her to repent forever. She goes to Settings and unselect the option '[  ] TextSecure users'. So, Alice performs other tests sending messages, go back to Settings again, and reset (selecting again) the option '[v] TextSecure users': hell begins!  Observation E: from now on, an instability appears in her contact list; when she clicks Bob, opens Joshua; when clicks Joshua, open Darwin; when clicks Charlie, open Charlie himself (correctly); when clicks Bob another time, open Bob himself, or not, or even not open! Alice already restarted the TextSecure, but the bug continues. It seems to have provoked an inconsistency in some index, do not know.  Buddies, that's my 2 cents for now, ok? I believe it is important to say that my friends who are coming to TextSecure as a client of SMS mainly (for now), are having a bad experience because it is absolutely not clear how to send a simple SMS, you know.  Thank you in advance for all the attention and hard work! =)","closed","","oiceberg","2014-03-19T23:09:46Z","2015-03-16T19:11:13Z"
"","442","Feature Request: Show total sum of sent texts / reset monthly","Hi devs!  I really like your texting app, but I'm missing a key feature:   My mobile contracts allows to send 200 texts/month for free. More texting costs extra money. Could TextSecure show the total of all texts sent und issue a warning, when the limit has been reached?  The counters/quota should be reset once a month or by user-defined date.  Would be cool to get that onto the next release! Thanks a lot!","closed","feature,","kerlerm","2013-12-01T15:08:11Z","2018-01-31T19:39:36Z"
"","371","Can not log out of Text Secure on Samsung Galaxy 2 Unless turn phone off then on again","Hi All,  Using text secure have found a bug when sending or receiving text have to put pass word in no problem after reading my text or sending text there is no log out. The phone just goes back to normal mode 5 hours later clicked on the Secure text Icon and did not need to log in again shows up every text with out logging is a Security risk.  I don't knows does any one else have this problem with there own mobile phone.  I think a log out button would be a good thing or log out timer that switches you out when you have not used Secure text for some time.  Apart form the bug the program is excellent.  Regards Anthony","closed","","anthonydacko51","2013-10-12T11:05:52Z","2013-10-23T00:17:55Z"
"","1062","""Add to contacts""-option for messages from unknown users","Hi all!  After testing TextSecure for a while, i miss the opprtunity to add unknown numbers to my phonebook like i could do with the default android messaing app.  Thanks and greetings Alex","closed","","flipreverse","2014-03-06T08:52:27Z","2014-03-07T06:32:20Z"
"","522","Protected messages","Hey. Sorry for the offtopic. I am writing here to clarify some points : 1. If I should TextSecure application, but the person to whom I am sending sms has no application TextSecure and doesn't has Cyanogenmod, he will not Encrypted message, a simple sms ? 2. Can I use this app as a replacement for stock sms app ? Can I disable the encryption of messages? Disabling encryption is still a text message will go through your servers ? Is not that dangerous ? 3. Not working correctly notified LED indicator. When setting the frequency of blinking notification is not blinking, steady ( Acer Liquid E (message icon on top of the phone). Thank you for the program. P.S. Sorry for my English language.","closed","","FrodoBegins","2014-01-02T07:26:00Z","2014-01-06T22:00:58Z"
"","1156","Wrong version number in Play Store changelog","Hey, the new version of TS (presumably 2.0.5) changelog headline says ""Changes in 2.0.4"", but the changes seem to be for the latest version (i.e. it's not possible in 2.0.4 to choose no led color).","closed","","generalmanager","2014-03-14T19:47:05Z","2014-03-14T20:10:22Z"
"","963","Adding  per group notification preference","Hey, I think it's a must to have some notification preferences as Whatsapp has. You don't want a group to vibrate every 3 seconds when you have 12 people in it for exemple.","closed","","jocelynthode","2014-03-03T16:45:29Z","2014-03-03T17:05:38Z"
"","338","Some mesages are not getting encrypted when arriving","Hey,  on my Samsung Galaxy S3 with Jelly Beans, some messages (like 10-20%) are not received by TextSecure but by the normal message-Android-app.  Those messages won't show up in TextSecure at all.  TextSecure is running in the background and this happens if the encryption key is stored in the ram or not.  Did someone else experience that?  Cheers, Kim","closed","","wuestkamp","2013-09-04T22:25:19Z","2013-09-09T15:35:19Z"
"","959","Not recieving any PUSH messages, SMS transport works","Hey,  I've the problem that I do not recieve andy PUSH messages at all, however can write to everybody via push and the messages are delivered without any error. If I disable networking textsecure works without any problems via SMS.   I'm using CM 7.2 for GT5830i, which does not contain whisperpush (as long as I know).  Could it be, that the following caused this error: Installed textsecure, registered at the server for PUSH, deinstalled it 5 minutes later as there was no contact from me with textsecure, without desubscribing from push. Two days later I reinstalled textsecure, multiple times registering and deregistering at the server doesn't help, also deinstallation and reinstallation of textpush while deleting cache, and data doesn't work.   If it helps I can send my mobile phone number (privately) to a dev, maybe this helps to track the issue down (if someone has access to the server).","closed","","winnieXY","2014-03-03T13:16:46Z","2015-03-16T19:41:48Z"
"","1006","Disable SMS fallback on 4.3","Hey,  I'm on 2.0.4, on JB/4.3, and the ""Disable SMS fallback"" option is always grayed out. As I've found no definitive answer on how to change the default messaging app in 4.3 I've tried toggling SMS in Hangouts, installing other SMS apps such as EvolveSMS (which says it overwrites the default behaviour), reinstalling TextSecure - all to no avail.  How am I supposed to achieve being able to turn SMS fallback off?","closed","","pannal","2014-03-04T14:54:07Z","2014-03-14T04:04:54Z"
"","1197","MMS Preferences not saved?","Hey,  first of all thank you very much for your effort of developing such a great app!  For my installation of TextSecure (2.0.5 on Android 4.3) it seems that the on/off-Switch to override system MMS settings does not work. Speaking for my particular case: if I enter the ""MMS Preferences"" Section the checkbox is checked. I may uncheck the box and return to the main menu. If I then go to ""MMS Preferences"" again, the checkbox is still checked (so it seems as if the change was not saved). In addition, I may not uncheck the checkbox again but reveice the following notification instead: ""Manual MMS settings are required for your phone."" If I return to the main menu AGAIN and go to the ""MMS Preferences"" Section again, I may uncheck the checkbox... still, it does not seem to be the case that my changes are saved.  Sidenote: changing the MMSC URL, MMS Proxy Host and MMS Proxy Port seems to work - at least the values entered are still there once I re-enter the section.  Thanks for your support - I hope my description is precise enough to be of help.","closed","mms,","hynz","2014-03-18T13:58:32Z","2014-10-14T04:10:08Z"
"","1235","Opens links even on long hold","Hey there, I just noticed that I cannot copy links or open the context menu  (""copy text| delete message| message details|forward..."") when the message consists of a url. The url will always be opened in the browser. This might be problematic.  Sorry if the is a duplicate issue.  greetings Hoodie","closed","","hoodie","2014-03-25T13:41:44Z","2014-03-27T22:58:42Z"
"","1108","Can't receive any SMS","Hey there,  I've installed TextSecure, I am able to send messages (via Push) but I didn't receive any. I've set TextSecure as standard messaging app and the phone is running 4.4.2. What else do you need to know?  Since I changed back to standard messaging app everything works fine...","closed","","Progstep","2014-03-10T08:51:51Z","2014-03-11T20:54:25Z"
"","1158","Android Compatibility issue","Hey moxie,  since approximately one week the Android Play Store says, that Redphone and Text Secure is no more compatible with my phone. Could you fix that issue? It is running very well on my phone. Maybe it has to do something with my update to the latest cm11 build.   HTC Desire Z CM 11 (latest)  Thanks in Advance,  Deccoy","closed","","Deccoy","2014-03-14T20:29:42Z","2014-05-09T00:14:08Z"
"","303","Push library","Hey @moxie0  These are fixes so that this can be built easily under AOSP as a library. The res/raw bit was annoying to work around, because AOSP JAVA_LIBRARY stuff doesn't support AAPT.","closed","","koush","2013-08-09T23:19:09Z","2014-06-21T08:52:16Z"
"","897","TextSecure wants decrypt a not enctypted message","Hello. I am experiencing some trouble. I habe received a SMS from a contact that has not even a smartphone. TS only shows rhat decryption ia in progress and I cannot read it therefore. See below my debuglog pasted. Running in Nexus5 with newest KitKat and TS is standard APP for SMS  http://hastebin.com/ripufefeti  Hopefully that can be resolved, otherwise TS is not an Option anymore and I will habe to Fall back to Hamgouts.....","closed","","flautze","2014-03-01T08:08:22Z","2014-03-02T10:47:52Z"
"","840","Wrong image in chat preview","Hello,   when I send an image, in the chat there is shown an image I sent before instead of the right one I just have sent. When it is clicked, the right one is shown in full screen.  Even when I delete the conversation and I send a new image, the old wrong picture is shown in chat. (Fullscreen shows the right image). Does Deletion of conversation not delete data of the conversation?  Greets","closed","","yendar28","2014-02-27T17:58:07Z","2015-05-20T20:38:45Z"
"","866","Add status symbols for messages","Hello,   if i send a message, i can´t see status of this message like ""send"", ""receive"" and ""read"". Can you at this feature in a future release?  Best regards from germany, Florian","closed","","floville","2014-02-28T09:48:22Z","2016-02-17T13:02:19Z"
"","755","Can't use service, because unable to unregister from WhisperPush (CM11)","Hello, this is not a real bug. But maybe you can add support in how someone can unregister from WhisperPush. TextSecure tells me that my phone number is allready registered, so i am unable to use this application. Greetings","closed","","Ring000","2014-02-26T09:34:17Z","2014-12-20T19:09:44Z"
"","311","Some messages not displaying, stuck on ""Decrypting, please wait""","Hello, I've got this problem regularly and the only way to view the message is to force close the app via the app manager and relaunch it. It's becoming very frustrating, please address the issue ASAP.","closed","","psicheng","2013-08-17T15:53:27Z","2013-08-31T19:08:32Z"
"","369","Can't send an MMS with an attachment.","Hello, I'm having an issue while attempting to send an MMS with an attachment (a picture from the camera). Text only SMS works great. It's possible to send pictures with the stock MMS application, it only fails with Text Secure.  aLogcat file: http://pastebin.com/DUJ7gNXs  A screenshot of the error: http://i.imgur.com/oDokv4a.jpg  Thank you for this application which worked great with my previous phone, and please forgive my bad english. Regards.  edit: Xperia Play r800i with Android GB 2.3.7","closed","","lincruste","2013-10-10T10:35:25Z","2013-10-27T12:00:53Z"
"","710","Forgetting password","Hello, I have TextSecure installed on a Nexus S with Cyanogenmod 10.2.1 When the phone falls in standby (a few minutes after turn of the display) TextSecure forgets the password and I have to enter it. The setting to forget it after a certain time is deactivated.","closed","","grundrauschen","2014-02-25T18:12:29Z","2015-02-16T05:23:11Z"
"","1210","Lost/broken phone - cannot use same number","Hello, I have broken my old phone and now want to use textsecure with the new one but it won't let me, saying that my number is already in use with the broken phone, and asks to uninstall (which is impossible, as the phone is broken). FAQ says that I could generate new keys, but it was a no go. What can I do?","closed","","ufa","2014-03-20T12:55:02Z","2014-03-20T16:35:17Z"
"","424","Backing up SMS in TextSecure","Hello, I have a problem with TextSecure. I want to export my messages to the SD Card in order to have a backup of my data. I want to export the messages in plaintext, but unfortunately I have no idea where to find it on the SD-Card or how to open it. I could’t find any plaintext data in /storage/sdcard0/TextSecure Export. I hope you can help me with this problem. Greetings,","closed","","docanonymous","2013-11-13T09:16:05Z","2015-02-07T08:38:39Z"
"","1078","Password is not accepted after reboot","Hello, after rebooting my smartphone, i can´t open textsecure because my password is not accepted.  At last time, i type the password was probably before update to 2.0.4","closed","","sardello","2014-03-07T12:00:11Z","2014-03-07T12:24:46Z"
"","999","Easy choice between SMS and PUSH","Hello,  thanks for your great work. I am please you take that effort to make communication more secure to us.  One enhancement (if I did not oversee the functionality) I deeply miss is the possibility to chose whether the message should be sent via mobile network or via SMS. Sometimes I do not have a data connection (or the person I communicate with) and in this case I would be happy if I could either re-send the message via SMS or if the system gave me the option to define a timer like ""if the message cannot be sent via data within 10 minutes do it via SMS"".  Thanks a lot!","closed","","ghost","2014-03-04T11:58:34Z","2014-04-16T10:09:30Z"
"","641","It is not possible to set a group avatar","Hello,  thanks for your great work.  On my CM11 phone it is not possible to set a group avatar. Clicking on the empty group avatar wil open the ""image selecting form"", but whatever i choose, the group avatar stays empty after selection.  Bedt regards, Deccoy","closed","","Deccoy","2014-02-25T00:51:00Z","2014-03-17T16:18:19Z"
"","330",".apk not available outside of the Google Play Store.","Hello,  TextSecure is an amazing app but it's only available on the Play Store (except if you compile the source, but not everyone know how to do this). It would be very nice if TextSecure can be available on the Fdroid repository. At least can you put an .apk on github so everyone can download it without use a Google service ?  Have a nice day.  KaitoKito.  Edit : I think the same about the redphone app but I don't think it's necessary to create a new issue on the redphone project to copy-paste this message...","closed","","KaitoKito","2013-08-29T09:11:33Z","2013-08-29T16:56:26Z"
"","1137","Fail to build since 1ddc45fd9","Hello,  Seems 1ddc45fd9 introduces some duplicated files for the packaging:  ``` Error: duplicate files during packaging of APK /home/cedric/android/TextSecure/build/apk/TextSecure-debug-unaligned.apk     Path in archive: lib/armeabi/libcurve25519.so     Origin 1: /TextSecure/build/exploded-aar/org.whispersystems.textsecure/library/0.1/libs/armeabi.jar     Origin 2: TextSecure/build/exploded-aar/org.whispersystems.textsecure/library/0.1/jni/armeabi/libcurve25519.so You can ignore those files in your build.gradle:     android {       packagingOptions {         exclude 'lib/armeabi/libcurve25519.so'       }     }  FAILURE: Build failed with an exception.  * What went wrong: Execution failed for task ':packageDebug'. > Duplicate files copied in APK lib/armeabi/libcurve25519.so     File 1: TextSecure/build/exploded-aar/org.whispersystems.textsecure/library/0.1/libs/armeabi.jar     File 2: TextSecure/build/exploded-aar/org.whispersystems.textsecure/library/0.1/libs/armeabi.jar  ```  Thank you !  Cheers,  C.","closed","","cjeanneret","2014-03-12T19:18:26Z","2014-03-12T19:39:34Z"
"","1243","MMS not working on S4 (Android 4.4.2, Proximus Belgium)","Hello,  MMS in TextSecure is not working for me. I'm using a Belgian provider, Proximus. I've tried the manual settings as well (according to page http://www.nowsms.com/mobile-operator-mmsc-settings).  Debug logs: http://hastebin.com/fupusuciti","closed","mms,","lvets","2014-03-26T09:57:32Z","2014-09-08T01:40:15Z"
"","1058","Deactivating all notifications","Hello,  I'm using Textsecure on Android and got some notification issues.  For app notifications I'm using Lightflow which allows me, to set up detailled notification seeting for every single apps like color of LED, sound, vibration patterns etc. These app needs turning off every notification in a certain app except the symbol in the notification bar. And this is where my problems with Textsecure began. Textsecure doesn't allows it to turn off the LED, neither the sound, but this is neccesary for apps like Lightflow. I can choose ""none"" for the sound, but it turns to ""default"".  So it would be really nice if you can make it possible to disable every single kind of notification in Textsecure.","closed","","Mettwurscht","2014-03-06T08:09:38Z","2014-05-09T03:09:26Z"
"","718","Simplified protocol implementation?","Hello,  I was wondering; is there a -pure java- simplified implementation of the ProtocolV2 (with Axolotl Ratchet) available? I would love to incorporate this security protocol in one of my projects, but at this point, it is too complex to grasp.  Maybe a unittest for the protocol or something similar?  Thanks in advance!","closed","","dirkmoors","2014-02-25T19:58:57Z","2014-02-25T22:18:16Z"
"","1279","TextSecure does not receive SMS at all","Hello,  I have an issue with TextSecure. It seems to send messages fine, but no texts I receive are loaded into the database.   I also had this problem with the SMS verification when I registered my phone number, the text was received, but TextSecture didn't recognise it. I had the same issue with RedPhone.  Now when I receive a text, to load it into TextSecure I have to import it from the database, but Go SMS Pro and stock Messaging receive messages just fine. Not sure if I can receive encrypted messages yet since I don't know if I have any contacts who also use it.  Not sure what I can do to test this... but I am happy to help test it out.  Phone: Samsung Galaxy GT-I9305 Android: CyanogenMod-10.1.3-i9305","closed","","obrasier","2014-04-02T05:57:32Z","2014-04-02T16:15:57Z"
"","1170","Unable to install v.2.0.5 - ""not enough disk space""","Hello,  i am unable to install the new version due to the error ""nicht genügend speicherplatz"" (german) or ""not enough disk space"". The older version was deinstalled correctly.  I then tried to manually delete the deposits, but cant find any Textsecure related data in RootExplorer.   Greetings  Nexus 5, CM 11","closed","","Ring000","2014-03-15T11:20:12Z","2014-03-19T00:14:50Z"
"","307","Does security flaw of SecureRandom effect TextSecure?","Hello,  As you have probably heard, a major security flaw in the default SecureRandom implementation on Android has been reported yesterday[1]. This has left many BitCoin wallets vulnerable, but sounds like it will effect other cryptographic apps that use SecureRandom as well.  If I have seen correctly, TextSecure also uses the java SecureRandom class and the ECDSA signature, so I am wondering, is TextSecure also vulnerable to this security flaw? If yes, what exactly would be effected?  [1] http://bitcoin.org/en/alert/2013-08-11-android","closed","","apmon","2013-08-13T00:21:59Z","2013-08-17T19:47:42Z"
"","1151","After upgrading S4 to 4.4.2 messages appear in both Messaging app and TextSecure","Hello,  After upgrading my Samsung S4 to 4.4.2, all encrypted messages are also shown in the default Messaging app. - TextSecure is not my default SMS app. - SMS Fallback & SMS delivery reports are both enabled.","closed","","lvets","2014-03-14T00:10:49Z","2014-03-14T19:35:27Z"
"","1092","connect? bithub to bountysource.com","Hello! I wrote this already in the bithub comment but i thought it might be better to post it here. I hope this is okay.  I like you great approach to give developer a tribute by paying them. But for me ""as a supporter"" it would be cooler if I could decide for what bug/issue/feature I like to give the coins. Sure there should always be a little split (lets say for example 2% of the donation) which goes into commits for generally issues. Elementary.os, for example, took a nicer way. They choose bountysource.com (opensource) to do that (http://elementaryos.org/journal/fix-bugs-get-paid)  however... everyone could decide by themselves which bug or feature are more important. Bugs which are very difficult to solve could be made more interesting for developer because of the raising money.  On the other side the developer could also say an amount what he want to have to solve an issue.","closed","","ghost","2014-03-08T15:19:47Z","2014-03-08T17:21:01Z"
"","1133","Deletion of contact keys","Hello moxie,  could you please let us delete the contact keys?  Several of my friends changed their number or uninstalled TextSecure, I'm not liking to scroll threw their contact keys whenever I check them. Let us long press them for deleting, add a warning and everything would be fine.","closed","feature,","Waboru","2014-03-12T15:52:17Z","2015-12-19T01:54:21Z"
"","525","feature request: direct download / alternatives to google play","hello everyone!  i want to request a direct download link of this great software from here and/or the whispersystems website, maybe even from the f-droid store. from my perspective, it doesn't make any sense to make it mandatory to use google play store to download the software, as i'd have to trust google.  best regards","closed","","rmader","2014-01-03T20:09:55Z","2014-01-03T20:14:01Z"
