"#","No","Issue Title","Issue Details","State","Labels","User name","created","Updated"
"","1175","Update arrays.xml","~~Added English names for some languages and~~ Fixed a few native names of languages. Checked correctness using Wikipedia.","closed","","ghost","2014-03-15T16:06:41Z","2014-07-31T16:24:02Z"
"","682","Cannot delete contact key","You can only confirm the key, you cannot remove it currently.","closed","","ghost","2014-02-25T13:03:55Z","2015-01-05T16:07:13Z"
"","818","Ancient unsent messages sent after update","Yesterday morning my phone auto-updated TextSecure. I noticed the icon had just changed to the circular one, so clicked it, and authenticated. I followed the one-time process of registering on the server, and all seemed normal.  Later, i found out that a message I'd sent on the 18th december (to two recipients) had just been received by them. I presume it had failed to send back in december due to bad signal or some such, and the software update had just tried it again (I know where I was when I sent the message has little or no signal a lot of the time).  Seeing as the message was ""I'm in the pub"" and was sent at 8.15am, it lead to a few probing questions about my drinking habits ;-)  Anyway, I doubt this is the sort of thing we can track down and ""fix"", but I thought I'd mention it and see if anyone else was affected.  TextSecure is showing version 2.0.2 right now, although I think it updated again during the night, so I'm not sure exactly which version sent the ancient unsent messages.","closed","","coofercat","2014-02-27T10:00:37Z","2015-03-16T20:02:52Z"
"","867","Take Photo Button: Ability to take photo saved to encrypted storage","Would like the ability to take a photo that is stored to encrypted storage within the app, as opposed to adding an existing unencrypted photo from device.  Thank you and keep up the great work! =)","closed","","phrag","2014-02-28T09:54:17Z","2014-02-28T21:32:57Z"
"","462","Feature Request: Dark Theme - Passphrase Screen","Would it be possible to have the initial passphrase screen be inverted to white letters on black background screen when the user has chosen to use the Dark Theme?","closed","","JayTaylor515","2013-12-05T16:27:10Z","2013-12-09T05:37:15Z"
"","1065","Ask for desired behaviour on first start","Would it be possible to ask the user during the first start of the app (right before/after setting the passphrase), to specify the desired behaviour: - only use push - use SMS fallback - use as default SMS/MMS-App  Probably even add a ""what does that mean?"" button which opens a pop-up that explains (in simple words) what every mode does.  This would go a long way in making the app more friendly for the less tech-enthusiastic users and those, who don't want to crawl through the settings-menu.  edit: corrected formatting.","closed","ux,","GraphZal","2014-03-06T12:47:16Z","2015-11-24T18:46:26Z"
"","900","Feature request: Message self destruct","Would it be possible to add a self destruct element to secure messages? So that you can set them to remove themselves from a recipients phone after X number of minutes/hours/days? Perhaps this could be either after it is read or after it is received. Perhaps local deletion of messages in a conversation could ask if you want the remote version removed as well.","closed","","mattdale77","2014-03-01T09:49:43Z","2014-09-04T21:31:47Z"
"","922","[Feature Request] vCard Support","Would be nice if TextSecure could support sending/receiving vCards for exchanging contact information. This isn't even in Hangouts as far as I know, but would be a killer feature regardless.  Thank you!","closed","","okiedude","2014-03-02T02:15:55Z","2014-03-02T07:05:12Z"
"","1109","Update to newest gradle version, needed for Android Studio 0.5.0+.","Won't work with the newest Android Studio (0.5.0+) otherwise:  ``` Failed to refresh Gradle project 'TextSecure'          The project is using an unsupported version of the Android Gradle plug-in (0.8.3).          Version 0.9.0 introduced incompatible changes in the build language.          Please read the migration guide to learn how to update your project.          Open migration guide, fix plug-in version and re-import project (http://tools.android.com/tech-docs/new-build-system/migrating_to_09) ```","closed","","eikowagenknecht","2014-03-10T09:10:51Z","2014-06-16T18:43:26Z"
"","967","Misleading SMS fallback disabled reason","With the new PUSH Protocol, I believe the string: preferences__allow_sms_fallback_disabled_reason in https://github.com/WhisperSystems/TextSecure/blob/master/res/values/strings.xml might be misleading.  If you are not registered for push, it says TS is configured as default SMS app and this is the reason you can't disable SMS fallback. However I think the reason is because I'm not registered for push. So there could be two reasons why one can't disable SMS fallback: not registered for push or default SMS app.  Maybe the string should be updated.","closed","","JavaJens","2014-03-03T17:13:54Z","2014-03-04T14:58:38Z"
"","831","Cannot establish a secure SMS session anymore","With the latest update, I cannot start a secure SMS session with someone I previously had one with.  I also haven't been able to use the Push service, even after updating the Push Directory several times.  This is on a Samsung Galaxy S3 Mini, Android 4.1.2. I can reproduce this on another device which also is a S3 Mini with 4.1.2, so may be that's related in any way.","closed","","chiiph","2014-02-27T14:40:23Z","2014-05-29T04:55:35Z"
"","478","Group MMS not sending","With TextSecure 1.0.6 on Nexus 4 w/ 4.3.0 cannot reply to group messages (MMS) once I have replied once. After my first reply, the group conversation recipients are listed with the expected recipients as well as my phone number. aLogCat logs remain clear despite getting a send error. Successfully able to send picture MMS.","closed","","concussion962","2013-12-12T21:54:59Z","2014-09-08T01:31:24Z"
"","819","Long Term Financing","With increasing popularity of the TextSecure-app, questions about financing the server costs arise. While developing is funded via BitHub, I would be interested in getting to know the long term financing concept.  Thank you very much!","closed","","phime42","2014-02-27T10:51:08Z","2016-09-02T16:29:45Z"
"","1224","display error with samsung galaxy s4 mini","with galaxy samsung s4 mini display error will occur. The 3 dots on the right in top line are not visible.  As result I can't attach files.","closed","","georg2","2014-03-23T18:02:22Z","2014-05-08T23:55:53Z"
"","1267","MMS doesn't follow 302 redirects","will not receive any mms messages or pictures","closed","mms,","golfn4funin13","2014-03-29T05:18:50Z","2014-09-30T02:27:01Z"
"","643","Support animated gifs","Will be added? By now if i send a gif it arrives as a static image (first frames)","closed","feature,","Azertooth","2014-02-25T01:11:28Z","2015-08-17T15:44:30Z"
"","1017","Push message and play store","Why is google playstore mandatory for ""push"" message ? I am a cyanogenmod user (without any google component), is there any way to avoid relying on google play ?","closed","","ghost","2014-03-04T17:19:59Z","2014-05-11T08:21:32Z"
"","322","Enable PlayStore Access for Iran","WhisperSystems Apps should be authorized under General License D. https://plus.google.com/+AndroidDevelopers/posts/YCHtLJMXkYo","closed","","collina","2013-08-26T18:24:43Z","2013-08-26T19:27:58Z"
"","725","WhisperPush without Gapps Cyanagenmod","WhisperPush for Cyanagenmod does not work without Google Apps installed.  ""Sorry, this device is not supported for data massaging. Devices running versions of Android older then 4.0 must have a registered Google Account. Devices running Android 4.0 or newer do not require a Google Account, but must have the Play Store app installed.""","closed","","ghost","2014-02-25T22:10:12Z","2014-02-26T11:23:10Z"
"","605","Add old design as optional","While the new design is very modern, it also is very bright and hard to focus on. I do not feel that rounded contact pictures add any benefit, and the white in green for sent messages is actually unpleasant. If possible, make the old design with all the corners and black / white scheme available for selection through the Option menu.","closed","","codelix","2014-02-24T19:10:28Z","2014-02-25T00:27:00Z"
"","505","AES-CBC$ ?","While reading [ProtocolV2 wiki page](https://github.com/WhisperSystems/TextSecure/wiki/ProtocolV2) I've noticed you use ""AES-CBC$"" in two places:  > using AES-CBC$ with HMAC-SHA1  and  > the ciphertext of AES-CBC$(plaintext)   What does dollar sign (`$`) mean? Quick Google search didn't help. Is this a typo?","closed","","shamrin","2013-12-24T12:51:25Z","2013-12-26T17:46:50Z"
"","1292","has leaked ServiceConnection Exception - relevant?","While playing with themes I reproducibly encounter the exception after changing themes in settings and returning to the conversation list. (latest master branch - no modifications) This happens on the Emulator (4.4.2) and Android x86 in a VM but not on my CM11 phone (at least it is not logged there) Nothing bad is happening in the UI but exceptions always make me nervous...  ``` W/ConversationListActivity( 1699): onDestroy... E/ActivityThread( 1699): Activity org.thoughtcrime.securesms.ConversationListActivity has leaked ServiceConnection org.thoughtcrime.securesms.PassphraseRequiredMixin$KeyCachingServiceConnection@b3ff2b48 that was originally bound here E/ActivityThread( 1699): android.app.ServiceConnectionLeaked: Activity org.thoughtcrime.securesms.ConversationListActivity has leaked ServiceConnection org.thoughtcrime.securesms.PassphraseRequiredMixin$KeyCachingServiceConnection@b3ff2b48 that was originally bound here E/ActivityThread( 1699):    at android.app.LoadedApk$ServiceDispatcher.(LoadedApk.java:979) E/ActivityThread( 1699):    at android.app.LoadedApk.getServiceDispatcher(LoadedApk.java:873) E/ActivityThread( 1699):    at android.app.ContextImpl.bindServiceCommon(ContextImpl.java:1561) E/ActivityThread( 1699):    at android.app.ContextImpl.bindService(ContextImpl.java:1544) E/ActivityThread( 1699):    at android.content.ContextWrapper.bindService(ContextWrapper.java:517) E/ActivityThread( 1699):    at org.thoughtcrime.securesms.PassphraseRequiredMixin.initializeServiceConnection(PassphraseRequiredMixin.java:72) E/ActivityThread( 1699):    at org.thoughtcrime.securesms.PassphraseRequiredMixin.onResume(PassphraseRequiredMixin.java:27) E/ActivityThread( 1699):    at org.thoughtcrime.securesms.PassphraseRequiredSherlockFragmentActivity.onResume(PassphraseRequiredSherlockFragmentActivity.java:22) E/ActivityThread( 1699):    at org.thoughtcrime.securesms.ConversationListActivity.onResume(ConversationListActivity.java:85) E/ActivityThread( 1699):    at android.app.Instrumentation.callActivityOnResume(Instrumentation.java:1192) E/ActivityThread( 1699):    at android.app.Activity.performResume(Activity.java:5310) E/ActivityThread( 1699):    at android.app.ActivityThread.performNewIntents(ActivityThread.java:2329) E/ActivityThread( 1699):    at android.app.ActivityThread.handleNewIntent(ActivityThread.java:2336) E/ActivityThread( 1699):    at android.app.ActivityThread.access$1600(ActivityThread.java:135) E/ActivityThread( 1699):    at android.app.ActivityThread$H.handleMessage(ActivityThread.java:1267) E/ActivityThread( 1699):    at android.os.Handler.dispatchMessage(Handler.java:102) E/ActivityThread( 1699):    at android.os.Looper.loop(Looper.java:136) E/ActivityThread( 1699):    at android.app.ActivityThread.main(ActivityThread.java:5017) E/ActivityThread( 1699):    at java.lang.reflect.Method.invokeNative(Native Method) E/ActivityThread( 1699):    at java.lang.reflect.Method.invoke(Method.java:515) E/ActivityThread( 1699):    at com.android.internal.os.ZygoteInit$MethodAndArgsCaller.run(ZygoteInit.java:779) E/ActivityThread( 1699):    at com.android.internal.os.ZygoteInit.main(ZygoteInit.java:595) E/ActivityThread( 1699):    at dalvik.system.NativeStart.main(Native Method) ```","closed","","McLoo","2014-04-04T05:40:48Z","2014-05-21T15:36:43Z"
"","750","Sent Data Messages Appear Green Before Turning Blue","While pending data messages are being sent, they appear green before switching to blue. This causes ambiguity for the sender who isn't sure whether the last sent message was actually transmitted over data or SMS.","closed","","b1narybob","2014-02-26T07:59:44Z","2014-03-25T10:06:17Z"
"","523","IllegalArgumentException when sending SMS / CM11 / Android 4.4.2","While it doesn't seem to impact SMS transmission, the following exception occurs when sending SMS:  W/SmsSender(25588): java.lang.IllegalArgumentException: Receiver not registered: org.thoughtcrime.securesms.service.SystemStateListener@41f2c898 W/SmsSender(25588):     at android.app.LoadedApk.forgetReceiverDispatcher(LoadedApk.java:667) W/SmsSender(25588):     at android.app.ContextImpl.unregisterReceiver(ContextImpl.java:1492) W/SmsSender(25588):     at android.content.ContextWrapper.unregisterReceiver(ContextWrapper.java:489) W/SmsSender(25588):     at org.thoughtcrime.securesms.service.SmsSender.unregisterForRadioChanges(SmsSender.java:133) W/SmsSender(25588):     at org.thoughtcrime.securesms.service.SmsSender.handleSentMessage(SmsSender.java:94) W/SmsSender(25588):     at org.thoughtcrime.securesms.service.SmsSender.process(SmsSender.java:52) W/SmsSender(25588):     at org.thoughtcrime.securesms.service.SendReceiveService$SendReceiveWorkItem.run(SendReceiveService.java:224) W/SmsSender(25588):     at org.thoughtcrime.securesms.util.WorkerThread.run(WorkerThread.java:46)","closed","","thoughtbox","2014-01-02T08:42:13Z","2014-12-03T23:54:23Z"
"","298","contacts mix up","While initiating a text message conversation with someone with a U.S. number, whom I don't have listed in my address book, instead of that person's number coming up in the top of the screen, another person who I do have in my address book appears (meaning their name and address book picture).  This other person is a contact in a different country, who happens to share the exact last same 8 digits as the person whom I sent a text message to in the United States. Obviously their country code differs, as well as the first two digits after the country code.","closed","","vermem","2013-08-08T07:02:53Z","2013-10-02T03:37:40Z"
"","1206","Can't (long tap) delete received key message","While cleaning up Test messages i was mit alle to delete the message eich the key icon i received.  Long tap is not working here.   Same was for the sended key icon message until i reopened the thread","closed","","McLoo","2014-03-19T22:14:40Z","2015-03-16T19:13:39Z"
"","1277","Group MMS ordering while DB is locked","While at the gym I silenced my phone and left it (the DB is password locked, and set to lock after 1 hour of inactivity), when I got back there were 40 new messages.  39 of them were from a Group MMS Session (I'm the only one in the group with Text Secure this is a standard MMS Group Message).  The notification listed several messages from people in that group I assumed it was from the group message (although technically the notification was from the individual people) I only saw 3-4 new messages in the group.  I later noticed all the other messages came through the message thread for the individual users that sent the specific message.  They were listed as ""MMS Message click to download"", I had to go through the threads for 4 people and click ""download message"" for each one, and then as they downloaded they were moved into the MMS group message thread.  The bigger issue, is they were moved into the MMS group thread using the date stamp of the time I hit ""download message"", so the MMS Group thread shows them in the order I downloaded them, not in the order they were sent causing the conversation to be jumbled  (I don't know anything about the MMS spec, perhaps time stamps aren't part of it, and are created when received?).  This was on a Nexus 4, Over the Air Official Google ROM, non-rooted. on T-mobile, Wi-Fi was not on.  If it makes any difference 2 of the people in the group were on iPhones, one was on another Android phone, and I'm not sure what the fourth person was on.  I'm assuming the few new messages in the group thread showed up before the DB was locked, and the rest came through after, but I don't know for sure.  That's all I can think of at the moment that might be relevant.  Let me know if there is any other information I might be able to provide.","closed","mms,","Vadoola","2014-04-01T14:36:12Z","2015-05-30T00:05:51Z"
"","1038","Encrypted messages are not received by others","Whenever I try to write an encrypted message (push) to somebody else, they don't receive anything at all. Normal sms work just fine, and I receive their encrypted messages just fine, too.  The registration for the service worked without problems.   Nexus 5 Android 4.4.2","closed","","rbieb","2014-03-05T14:18:00Z","2018-06-10T19:50:13Z"
"","499","receiving iPhone contact slows down/crashes TextSecure","Whenever an iPhone user attempts to text me a contact from their phone (a ""vcard"" I believe) TextSecure grinds to a halt and invariably crashes. In order to resolve this, I have to delete the message thread that contains the contact. The contact comes in as a huge block of text. It might just be more data in one message than TextSecure expects.  Currently running on a Galaxy SG3 with Cyanogenmod 10.2","closed","","malbin","2013-12-20T22:32:36Z","2015-04-24T20:02:00Z"
"","1010","Open keyboard in recipient field when sharing something","When you want to share something (e.g. a tweet out of twitter app) a new message is created where you need to insert an recipient.  Because everyone would need to enter an recipient here it would be good to start with opened keyboard here.","closed","","cygairko","2014-03-04T15:16:26Z","2014-04-16T10:01:14Z"
"","1222","suggest number when contact is invited to group","When you want to invite a contact, which has more than one mobile number to a group, you have to select one of his numbers, but there is no hint, which of the contacts numbers is registered with TextSecure. There is only a warning (MMS-group), if the other number is selected.  TextSecure should give a hint, maybe a little lock symbol, to show which of the contacts numbers supports push messages.","closed","","Turbokiwi","2014-03-23T16:15:42Z","2014-03-24T07:33:12Z"
"","864","Add a help button to explain why you should set a passphrase","When you first start up TextSecure it wants you to choose a passphrase. There should be a help button which explains what it is and why it is needed. Why it is a bad idea to go without one ...","closed","ux,","cryptomilk","2014-02-28T09:16:30Z","2015-03-10T19:35:11Z"
"","414","Heap corruption (and crash) when image should be displayed in message list","When viewing a conversation history with a user, and an image is visible in the listing (or more accurately, when there should be an image visible) then heap corruption occurs.  Sony Xperia Z running PABX's Android 4.4 build with GApps, (build 3.2).  Example errors (each from a different crash) 11-08 22:31:24.878: A/libc(13885): Fatal signal 11 (SIGSEGV) at 0x75282000 (code=1), thread 13903 (pool-1-thread-1)  11-08 22:39:48.720: A/libc(20017): Fatal signal 11 (SIGSEGV) at 0x737d5000 (code=1), thread 20048 (pool-1-thread-1)  11-08 22:41:58.737: A/libc(20544): heap corruption detected by dlmalloc 11-08 22:41:58.737: A/libc(20544): Fatal signal 6 (SIGABRT) at 0x00005040 (code=-6), thread 20636 (AsyncTask #5) 11-08 22:41:58.737: A/libc(20544): Fatal signal 11 (SIGSEGV) at 0x7ede9000 (code=1), thread 20561 (pool-1-thread-1)  More complete content from LogCat: 11-08 22:41:58.597: W/MmsCommunication(20544):  at android.os.Parcel.readException(Parcel.java:1461) 11-08 22:41:58.597: W/MmsCommunication(20544):  at android.database.DatabaseUtils.readExceptionFromParcel(DatabaseUtils.java:185) 11-08 22:41:58.597: W/MmsCommunication(20544):  at android.database.DatabaseUtils.readExceptionFromParcel(DatabaseUtils.java:137) 11-08 22:41:58.597: W/MmsCommunication(20544):  at android.content.ContentProviderProxy.query(ContentProviderNative.java:413) 11-08 22:41:58.597: W/MmsCommunication(20544):  at android.content.ContentResolver.query(ContentResolver.java:461) 11-08 22:41:58.597: W/MmsCommunication(20544):  at android.content.ContentResolver.query(ContentResolver.java:404) 11-08 22:41:58.597: W/MmsCommunication(20544):  at org.thoughtcrime.securesms.database.MmsDatabase.getCarrierMmsInformation(MmsDatabase.java:598) 11-08 22:41:58.597: W/MmsCommunication(20544):  at org.thoughtcrime.securesms.mms.MmsCommunication.getMmsConnectionParameters(MmsCommunication.java:95) 11-08 22:41:58.597: W/MmsCommunication(20544):  at org.thoughtcrime.securesms.mms.MmsSendHelper.hasNecessaryApnDetails(MmsSendHelper.java:119) 11-08 22:41:58.597: W/MmsCommunication(20544):  at org.thoughtcrime.securesms.ConversationActivity$7.doInBackground(ConversationActivity.java:591) 11-08 22:41:58.597: W/MmsCommunication(20544):  at org.thoughtcrime.securesms.ConversationActivity$7.doInBackground(ConversationActivity.java:588) 11-08 22:41:58.597: W/MmsCommunication(20544):  at android.os.AsyncTask$2.call(AsyncTask.java:288) 11-08 22:41:58.597: W/MmsCommunication(20544):  at java.util.concurrent.FutureTask.run(FutureTask.java:237) 11-08 22:41:58.597: W/MmsCommunication(20544):  at android.os.AsyncTask$SerialExecutor$1.run(AsyncTask.java:231) 11-08 22:41:58.597: W/MmsCommunication(20544):  at java.util.concurrent.ThreadPoolExecutor.runWorker(ThreadPoolExecutor.java:1112) 11-08 22:41:58.597: W/MmsCommunication(20544):  at java.util.concurrent.ThreadPoolExecutor$Worker.run(ThreadPoolExecutor.java:587) 11-08 22:41:58.597: W/MmsCommunication(20544):  at java.lang.Thread.run(Thread.java:841) 11-08 22:41:58.677: W/ImageSlide(20544): Got soft reference: null 11-08 22:41:58.677: E/SpannableStringBuilder(20544): SPAN_EXCLUSIVE_EXCLUSIVE spans cannot have a zero length 11-08 22:41:58.677: E/SpannableStringBuilder(20544): SPAN_EXCLUSIVE_EXCLUSIVE spans cannot have a zero length 11-08 22:41:58.687: W/ImageSlide(20544): Got soft reference: null 11-08 22:41:58.687: W/Slide(20544): Loading Part URI: content://org.thoughtcrime.provider.securesms/part/18 11-08 22:41:58.687: W/PartDatabase(20544): Getting part at ID: 18 11-08 22:41:58.707: W/EncryptingPartDatabase(20544): Getting part at: /data/data/org.thoughtcrime.securesms/app_parts/part-1763669776.mms 11-08 22:41:58.717: W/Slide(20544): Loading Part URI: content://org.thoughtcrime.provider.securesms/part/18 11-08 22:41:58.717: W/PartDatabase(20544): Getting part at ID: 18 11-08 22:41:58.727: W/EncryptingPartDatabase(20544): Getting part at: /data/data/org.thoughtcrime.securesms/app_parts/part-1763669776.mms 11-08 22:41:58.727: W/MmsSmsDatabase(20544): Executing query: SELECT _id, body, read, type, address, subject, thread_id, status, date_sent, date_received, m_type, msg_box, part_count, ct_l, tr_id, m_size, exp, st, transport_type FROM (SELECT DISTINCT date_sent \* 1 AS date_sent, date \* 1 AS date_received, _id, body, read, thread_id, type, address, subject, NULL AS m_type, NULL AS msg_box, status, NULL AS part_count, NULL AS ct_l, NULL AS tr_id, NULL AS m_size, NULL AS exp, NULL AS st, 'sms' AS transport_type FROM sms WHERE (read = 0) UNION ALL SELECT DISTINCT date \* 1000 AS date_sent, date_received \* 1000 AS date_received, _id, body, read, thread_id, NULL AS type, address, NULL AS subject, m_type, msg_box, NULL AS status, part_count, ct_l, tr_id, m_size, exp, st, 'mms' AS transport_type FROM mms WHERE (read = 0) ORDER BY date_received ASC) 11-08 22:41:58.737: A/libc(20544): heap corruption detected by dlmalloc 11-08 22:41:58.737: A/libc(20544): Fatal signal 6 (SIGABRT) at 0x00005040 (code=-6), thread 20636 (AsyncTask #5) 11-08 22:41:58.737: A/libc(20544): Fatal signal 11 (SIGSEGV) at 0x7ede9000 (code=1), thread 20561 (pool-1-thread-1) 11-08 22:41:58.847: I/DEBUG(19828): **\* **\* **\* **\* **\* **\* **\* **\* **\* **\* **\* **\* **\* **\* **\* *** 11-08 22:41:58.847: I/DEBUG(19828): Build fingerprint: 'Sony/full_c6603/c6603:4.4/KRT16M/eng.adrian.20131104.182437:userdebug/test-keys' 11-08 22:41:58.847: I/DEBUG(19828): Revision: '0' 11-08 22:41:58.847: I/DEBUG(19828): pid: 20544, tid: 20636, name: AsyncTask #5  >>> org.thoughtcrime.securesms","closed","","wsot","2013-11-08T11:51:18Z","2013-11-09T02:58:13Z"
"","470","Manually Rescan for SMS/MMS","When using the SELinux feature default deny, TextSecure is not allowed to read SMS. In order to import the messages, this permission has to be requested/manually given of course. But when a user forgets to set the permission before starting TextSecure for the first time, it is not possible to import the messages except if the app is un- and reinstalled. It would be great if the message import could be manually started at a later point.","closed","","zyrill","2013-12-10T12:24:19Z","2013-12-10T17:38:20Z"
"","503","Plaintext Export sets wrong ""status"" attribute in XML","When using the plaintext export and import the XML with ""SMS Backup And Restore"", all restored messages in the ""SMS/MMS"" app have the green tick icon which says that the receiver got the message (even the ones sent by oneself). This happens always, even if no delivery report has ever been requested for a particular SMS. This occurs because the exporter sets the attribute ""status"" to ""0"" instead of ""-1"", which seems to be the right one here.  [System: CyanogenMod 10.2.0 stable on I9505]","closed","","milux","2013-12-23T22:38:47Z","2018-04-02T21:18:01Z"
