"#","No","Issue Title","Issue Details","State","Labels","User name","created","Updated"
"","543","async loading of ConversationList items","There's a lot of choppiness in scrolling because we load the content as the scrolling happens, and much of the activity is on the UI thread. We should throw that work on a separate thread and use a library like https://github.com/lucasr/smoothie to populate the list items when the data is ready.","closed","","mcginty","2014-01-12T05:54:41Z","2014-05-15T02:21:28Z"
"","1057","writing message to multiple recipients isn't possible","there seems to be no possibility to send messages to more then one recipients. This is possible in the stock SMS App and with Messengers.","closed","","JayPiEs","2014-03-06T06:35:28Z","2014-04-12T14:17:40Z"
"","1066","Turn off Push without unregistering from server","There needs to be a way of turning off Push   without unregistering from server or turning mobile and WiFi off. For example, on a regular basis a use a corporate network and a university network. They are both heavily monitored and packets and protocols through them are managed and stay behind one or several proxies. This means that sometimes Push messages can't get through and I need to either go and switch off my network, which I use for other things, or switch off Push, which means I have to reregister again afterwards. I am sure there are other situations where you want to be able to just suspend Push functionality, not 'cripple' it completely.   So my idea is that switching off Push and unregistering from server should be put on different buttons and be kept relatively independent of each other.","closed","feature,","kgizdov","2014-03-06T17:02:15Z","2014-03-17T08:56:32Z"
"","785","Group chat display after entering from notification","There is one very confusing bug with groups:  If you enter a group using the conversation list it shows the group name on the top and chat bubbles have the contact name above them.  However, if you get a group message while the group is not displayed and enter it by pressing the system notification, the group will display as if it was a contact, e.g. it will show the name of the last person to talk inside the group as the group name and not show the contact names inside the chat window.  Going back to the conversations list and entering the group again makes it show up correctly again.","closed","","monreal","2014-02-26T17:53:12Z","2014-02-26T20:07:10Z"
"","1257","New line / linefeed","There is no possibility - tried it with different keyboards - to add a new line (paragraphs).","closed","","DayusRam","2014-03-27T21:07:01Z","2014-03-28T06:07:28Z"
"","909","Always warn before sending a picture via MMS","There is feedback in the Play Store that people are confused because they never know if the next message will be for free or not.  That is especially important for photos which i bet nobody ever wants to send via MMS and pay up to $1 for that.  So a dialog warning that the photo will be sent via MMS would be very helpful.","closed","","funk78","2014-03-01T17:00:57Z","2014-04-03T08:18:53Z"
"","579","Still some remaining black text in dark theme","There are still some areas in the dark theme which have hard-to-read black text (esp. in low light situations), specifically the ""Add attachment"" window[1] and the ""Batch Selection Mode"" header[2].  ![1](https://f.cloud.github.com/assets/6554270/2051054/4a781e6e-8a82-11e3-9ccd-9b3c855f7681.jpg) ![2](https://f.cloud.github.com/assets/6554270/2051058/572ed904-8a82-11e3-90cb-e0ee5f283768.jpg)","closed","","Real-XFaCE","2014-01-31T14:18:45Z","2014-02-02T20:18:20Z"
"","841","Missing and mixed up messages in group chat","There are some missing and mixed up messages. I have prepared two images of two phones of people in the group:  ![1](https://f.cloud.github.com/assets/6792072/2285805/8d5956f0-9fd9-11e3-913e-a8dca38bcbcb.jpg) ![2](https://f.cloud.github.com/assets/6792072/2285806/8d5dc19a-9fd9-11e3-9b9b-9ba8d6db5e9d.jpg)  You can see four people invloved in the conversation there (red user can be ignored). The left phone is the phone of the white user (thats me), the right one ins the green users phone. On picture 1, green user (right phone) recieves a blank message from me (white user, left phone), which I have never sent. Then, green user recives a message from blue user at 13:42, whicht never arrived at my phone (white user, left phone). Then green user sends with the right phone a message an 13:42, which is also not delivered to me (white user, left phone). Now green user (right phone) recieves an empty message from blue user, which I (white user, left phone) have also never received.  On picture two, you can see that the green user (right phone) received my messages from picture 1 (Test, Test 2) much later. She answered at 14:19 and this message arrived at my phone, but her message from 14:34 then again has never came through to me (left phone, white user).  While I can understand that messages in group chats can get mixed up, depending on the network availability of the receiver or depending on current server load, and so on, dropped messages are very bad. I don't really know how to reproduce this. It is hard to read the log files, because there are no timestamps. Also, I'd like to add that both phones users only used the mobile carriers network during this conversation, which is very stable here in the city, so network problems are unlikely.","closed","","sagischwarz","2014-02-27T18:19:59Z","2014-02-28T01:18:18Z"
"","450","Not working with KitKat - android 4.4","There are several issues after updating to the newest android - the 4.4.  1 - The software is not identified by the system. What I mean by that? From people list, when pressing the ""create message"" automatically is chosen the default Messaging and do not provide me with the possibility to choose the Text Secure as in android 4.3. As it was never installed.  2 - When I receive sms messages they are delivered both to the Text Secure and Messaging - the default one. Hence, I get too double notifications - which is annoying.  Can be solve these issues?","closed","","donmario","2013-12-03T12:16:14Z","2013-12-03T16:36:58Z"
"","1023","Register more than one number for push","There are a lot of phones with two or more sim cards and I use one of them. I'd like to use both my numbers in TS, but it allows me to be only in two states: registered and unregistered.  And it'd be good to have usual stuff default messaging application has (default sim card for sending texts or 'Always ask'). If we cannot just get it from system settings, internal option will do.","closed","","IvanAnishchuk","2014-03-04T21:17:00Z","2014-03-20T11:00:44Z"
"","509","Bad encrypted message when messaging self","The user is shown a ""Bad encrypted message..."" error when sending encrypted messages to themselves.  Steps to repro: 1. Open TextSecure 2. Send an unencrypted message to yourself 3. When prompted, initiate a key exchange with yourself 4. One the key exchange is complete, send an encrypted message to yourself 5. Notice the ""Bad encrypted message..."" error  Successfully reproduced 5/5 times with the following environment: - 32GB Nexus 5 - Android 4.4.2 - Unlocked bootloader with TWRP recovery.  A full system dump is available at https://gist.github.com/zachlatta/934897c7f0bf70f2495a","closed","","zachlatta","2013-12-25T23:28:34Z","2014-05-24T15:28:58Z"
"","651","[Suggestion] Change the ""unlocked"" Icon to something unique","The unlocked icon currently used by the app is an AOSP icon and thus makes it a little confusing identifying which notification is for TextSecure and for other apps that use the same icon.  For example: My Moto X uses the same icon to distinguish whether the device is connected to a trusted bluetooth device or not.  I propose that the ""unlocked"" status icon be changed to something unique that identifies the unlocked status, specifically to TextSecure.  Here is an example of a sample icon I whipped up that I think conveys the ""unlocked"" state of TextSecure, without drawing the same attention a user might have for a receieved message (the green icon). ![textsecure unlocked](https://f.cloud.github.com/assets/541127/2254274/4cb04a76-9dd3-11e3-85d2-c149734de092.png)  I have included a screenshot of my Moto X to show the similarity in icons and how this could be confusing for some users. ![screenshot_2014-02-24-20-00-14](https://f.cloud.github.com/assets/541127/2254273/49a0deb8-9dd3-11e3-8b42-3bfbe7b186d3.png)","closed","ux,","seattleandrew","2014-02-25T04:16:41Z","2014-05-16T15:30:31Z"
"","669","Typo in German translation: ""Meine Fingerabdruck""","The translation of ""My Fingerprint"" is mistakenly translated as ""Meine Fingerabdruck"". It should be ""Mein Fingerabdruck""","closed","","ppxl","2014-02-25T10:53:05Z","2014-03-06T23:58:00Z"
"","661","Time in message is blue and underlined (linked)","The time in all messages is blue and underlined (only the numbers / if there are numbers). Maybe it is linked because it thinks that's a callable number. I can't touch and interact with it. It's there with 24-hour format and 12-hour format.  I'm using the new TextSecure on Nexus 4.  Unfortunately screenshots are blocked.","closed","","Bastelbursche","2014-02-25T09:37:49Z","2014-02-26T17:46:42Z"
"","572","Use black theme without actionbar for RoutingActivity","The theme from the manifest is used for the startup animation. Previously light background with a dark actionbar and the green icon was displayed during the startup animation, then the theme switched to whatever is configured in settings. Now a black background without actionbar is used for the startup animation. This was chosen because a black ""flash"" when using the light theme is visually less distracting than a white flash when using the dark theme.","closed","","cketti","2014-01-26T05:27:44Z","2014-08-09T23:28:33Z"
"","773","Typo in German translation","The text for GroupCreateActivity_you_dont_own_this_group should start with ""Sie"" instead of ""Die"".","closed","","reschl","2014-02-26T15:17:12Z","2014-02-26T17:17:04Z"
"","1193","Change text for scan and get scanned","The text for get scanned and scan to compare is to long to be displayed on a smartphone. The text gets truncated and both options read the same. This is really confusing. This changes the text to be better distinguishable.","closed","","bachp","2014-03-17T20:39:15Z","2014-07-31T16:27:35Z"
"","566","Sending (I assume) garbled message","The symptoms are these. I send a message as follows (I'm not French so excuse any errors):  ""Je suis déjà chez moi, mais si tu es empêchée je peux aller voir si le carrefour a quelque chose?""  ...and my friend receives the following: ""Je suis déjà chez moi, mais si tu es empêchée je peux aller voir sécurité, donc j'espère que ça restera fixed!""  The ""second half"" of the message received isn't garbage, it seems to be something that occurred previously in our conversation. I'm using TextSecure but sending a plaintext message, and the recipient is using the vanilla messaging client.  Versions: me: Cyanogenmod / Android 4.3.1, TextSecure version I wish I knew, installed 2 weeks ago from google play store. them: Android 4.0.4  It's worth noting that this behaviour happened back when I was using the HTC stock OS, which was I believe Android 2.4 or something, again with the newest TextSecure. It doesn't happen all the time, but on about 10% of the messages, perhaps? We have a pretty big (±1000) thread going, that might be it, I haven't seen it with other people. It's not impossible that on their phone stuff is breaking, but they assure me it never happens with anyone else.  I'd like to help troubleshoot this because I like TextSecure a lot, so please ask away if by any chance I've forgotten something.","closed","","toothbrush","2014-01-21T13:14:34Z","2014-01-22T15:46:22Z"
"","715","[i18n] Recipients menu ""padlock"" text > ""Empfänger verifizieren"" > ...","The subpage then shows two keys. The German texts are not perfect #### Deren Identität (sie lesen)  .... #### Ihre Identität (Sie lesen)  ....  I suggest to change that to #### Fingerabdruck #### des Empfängerschlüssel  .... #### meines Schlüssels  ....","closed","","Wikinaut","2014-02-25T18:58:57Z","2014-02-25T19:11:04Z"
"","1160","GroupUtil.java misses localization","The strings in  / src / org / thoughtcrime / securesms / util / GroupUtil.java have no localization. I.e.   ``` ""Group updated."" "" Title is now '"" + title + ""'."" ```  also, this seems somewhat strange to me:  ``` description += org.whispersystems.textsecure.util.Util.join(members, "", "") + "" joined the group.""; ``` - there is no loop around it, so why use +=  ? - a fqn name is used to call the method, instead of using an import","closed","","PulsarFX","2014-03-14T20:40:38Z","2015-02-16T05:40:47Z"
"","1198","show message count next to contact name","The stock rom shows the number of messages per thread (user/group). This is a nice feature and should easily be integrated as the message count is passed to a variable in ConversationListItem.java already.  here my simple example:  ![count](https://f.cloud.github.com/assets/5326916/2448714/acf3230e-aea9-11e3-9567-3c6d5038165d.png)  not the nice light gray smaller number like the stock sms app...  Another wessenger shows the number of unread messages instead which also is a fine feature","closed","feature,","McLoo","2014-03-18T14:34:59Z","2017-11-14T17:36:31Z"
"","1060","function to re-notify on unread","the standard SMS App has the ability to notify again in a timed intervall in there are unread messages... it would be great if we have such option too ;-)","closed","","JayPiEs","2014-03-06T08:29:37Z","2015-02-16T05:36:46Z"
"","395","Wrong sender grouping for SMS","The sms senders are sometimes displayed wrong.  That is,  I know the sender of a message but that message is grouped with some one else's message  Here is an example, the top line says that the SMS is from ISBANK  (this is not a contact I have in my contact list, but its the name of my bank), but the message is from google's calendar application reminding me of an  appointment..  Another message's header says that the SMS was from IS BANKASI (again my  bank) but the message is actually a service message I received when I changed GSM providers informing me of that the settings have been sent to my phone.","closed","","tkalfaoglu","2013-10-29T04:04:36Z","2014-04-16T20:09:33Z"
"","1246","Recent smileys limited to 10","The smileys in the first tab (recent list) are limited to 10, the remaining space remains empty. I would assume the number of shown symbols to be limited by the remaining space though?","closed","ux,","prinz-z","2014-03-26T16:17:28Z","2014-10-28T02:18:54Z"
"","948","Sharing from other APPs to TextSecure group not possible.","The sharing of, e.g. Images, from another app or browser to a group in TextSecure is not possible. It is not possible, selecting the group.  Also in this dialoug select single users about the ""+"" is not possible. The user is still not selected. It is only possible to select individual user via search.   Workaround for sharing to a group would be: Images from other APPs save before in his gallery and then in TextSecure within the group insert the image about ""Attachment"". However, this is very uncomfortable","closed","","maboxx","2014-03-03T07:06:04Z","2014-03-03T09:17:48Z"
"","308","message notifications in the status bar should not show the sender..","The sender is confidential information. Not only the message content.   It should be possible to turn OFF the display of the sender in message notifications in the status bar.   Also, you could include a ""stealth"" notification mode where for instance, only a led would blink. Hide the sender is the priority though.","closed","feature,","rmourao","2013-08-13T16:52:51Z","2015-08-06T18:52:56Z"
"","1102","Reception of message often takes a very long time","The reception of messages often takes a very long time. Sometimes the message is received immediately after delivery but sometimes this takes 10 minutes. I have one contact which it takes hours until it receives the message from me. What can the be the reason for this? Is such a behavior already known?","closed","","maboxx","2014-03-09T14:08:11Z","2015-06-27T12:31:09Z"
"","1056","received time is only shown for received messages not for sent","the received timestamp is not shown for the sent messages, but for the received. the received icon is shown correctly.","closed","","JayPiEs","2014-03-06T06:31:01Z","2015-02-16T05:36:58Z"
"","621","Sent SMS is right aligned after sending","The received SMS messages are left aligned but the sent ones are right aligned. Checked in the options but couldn't find the required setting.","closed","","danstol","2014-02-24T21:16:38Z","2014-02-24T21:33:46Z"
"","707","Allow ignoring unencrypted messages on Android 4.4. (Issue #670)","The preference will only be shown on Android versions >= 4.4, and only be enabled when TextSecure is not the default message application.","closed","","lxgr","2014-02-25T17:28:35Z","2014-06-30T01:57:27Z"
"","1002","Play Store description violates policy","The Play Store description of the app includes a variety of keywords including the names of competing apps. This is against [store policies](https://support.google.com/googleplay/android-developer/answer/2985717?hl=en) and can lead to removal.","closed","","veeti","2014-03-04T13:08:02Z","2015-01-16T20:25:32Z"
"","1069","Moved colors to the right place.","The place of color definitions for the conversation_.xml files was mixed. Parts were *_redundantly*\* defined in those files, parts were already in colors.xml. So I moved the remaining ones there as well.","closed","","eikowagenknecht","2014-03-06T18:54:50Z","2014-07-24T18:06:29Z"
"","339","Feature request: Auto backup","The option to schedule backups to either the SD card or somthing like google drive/dropbox/etc would be great.  I lost all my texts due to a bad pushed rom update. An my TitaniumBackup backup had gone foobar and left me high and dry. I have a real bad need for some of the texts to be used in court so I am now left having to go to my phone provider and ask for a copy of the texts (fingers crossed)","closed","feature,","rbirtles","2013-09-06T22:12:41Z","2018-04-02T21:18:19Z"
"","399","[Feature]: Filter what Phone #s use TextSecure","The option to filter what phone #s use TextSecure would be great; while the all or nothing approach currently implemented is not bad, the extra flexibility would be perfect.","closed","","ghost","2013-10-31T22:39:59Z","2013-12-03T06:43:38Z"
"","639","Improve usability of enabling push only mode","The option in the configuration settings to disable SMS, and go push-only is currently greyed out on my phone. By tweeting at Moxie, I learned that the reason for this is that TextSecure is currently set to be the default SMS app.  Rather than greying out the option, and not letting the user turn Whisper's SMS feature off, perhaps it would be better to have a usable error message when the user clicks the greyed out checkbox. Telling them why it is greyed out, telling them how to remedy it, or perhaps even allowing them to make something other than Whisper the default SMS app from within the Whisper config would all be better.","closed","","csoghoian","2014-02-25T00:06:21Z","2014-02-25T09:24:28Z"
"","372","Upgrade notification KeyCachingService code to use NotificationCompat.Builder","The Notification constructor used on foregroundServiceModern is deprecated since android API level 11.","closed","","meskio","2013-10-12T13:08:58Z","2013-10-12T16:20:48Z"
"","604","Number registration (for push messaging) doesn't work with Google Voice","The new push based TextSecure doesn't seem to like using Google Voice numbers (which are then forwarded to my phone's real number via SMS). - Although there are of course privacy downsides associated with letting Google see all of your incoming/outgoing SMS data, there are also serious privacy harms associated with letting people know your actual phone number, rather than a number that will just forward texts to you*  The first step of the TextSecure number registration process (""Connecting"") works fine. An incoming text message with the verification code is received by the default Android SMS app, but TextSecure doesn't catch it.  Thankfully, after 2 minutes of waiting, I am given the opportunity verify by voice, which does work.","closed","feature,","csoghoian","2014-02-24T18:40:47Z","2016-05-11T21:42:39Z"
"","1143","SMS from my bank/provider/... shown as ""Anonymous""","The native SMS/MMS App and Hangouts are showing the senders name though they are not in my contact list.  Where my last banking mTAN I received with TextSecure was filed as Anonymous!","closed","","McLoo","2014-03-13T08:58:11Z","2014-12-16T14:24:20Z"
"","1126","Random force closes and unable to export plaintext backup","The MMS group fix has worked well.  However, I have discovered new issues on my xperia z1s with 4.3.  The app will randomly hang and force close.  I have tried to replicate the behaviour and have not found a single trigger.  It happens 3-4 times a day.  Additionally, with the force closes, I have to input my passphrase a lot more frequently.  A second issue I ran into is force closes when trying to export plaintext backups.  The process will begin, and roughly 2 seconds after initiation, the app stops responding and is force-closed.","closed","","birdbrain5381","2014-03-11T20:55:03Z","2014-07-17T21:18:42Z"
"","1055","drafts should be marked and moved to top of list","the message drafts should be automatically moved to the top of the message-list and be marked somehow, i.e. get another color or a text ""Draft""","closed","feature,","JayPiEs","2014-03-06T06:27:50Z","2015-04-09T18:30:45Z"
"","415","Lower priority of ""Passphrase Cached"" in notifications","The lock icon will always show up in the left upper-hand corner of the task bar. Threema had the same thing and it get's crowded with a few apps and there is now way to get rid of the icon when the app is running.  Threema solved this by lowering the priority of the task bar item. This way there is now small icon in the upper left corner, but when the notification bar is pulled down the Threema entry is still there.   I think this would be a good behaviour for TextSecure. Appear in the notification bar when pulled down, but don't stick in the upper left corner.","closed","","mackrauss","2013-11-08T17:09:59Z","2014-04-14T17:44:54Z"
"","986","Remove duplicate entries from contact list & Sort contact list","The list of contacts that you see when creating a new conversation is currently not sorted (at least the push-enabled contacts are somewhat randomly sorted, I think it's lexically by phone number, but spaces etc. disrupt this). Also, it contains duplicate entries, since the two cursors from the contact book and the push directory are just merged.  I will gladly fix this, but first I'd like to know whether we want #918 or not, because it makes a big difference as to how this fix looks. So I'll keep this issue here and start working on it as soon as we have a decision on #918.","closed","","tinloaf","2014-03-04T01:07:44Z","2014-07-24T19:07:58Z"
"","546","Remove unneeded intent-filter for SmsDeliveryListener receiver.","The intent filter is also not referenced elsewhere. Old code artifact?  (Encountered while reviewing security warnings from Lint).","closed","","santa4nt","2014-01-13T00:23:32Z","2014-06-14T15:04:35Z"
"","348","Feature request: Forward received texts to an email address.","The idea is to keep a mobile at a stationary place, thus not create any movement metadata, and still be able to receive texts on the road. (by using a wifi-only device)  Maybe it's even possible to extend to bidirectional operation, making textsecure a fully secure email  text proxy.","closed","feature,","matthiasscheer","2013-09-13T08:02:32Z","2014-04-22T08:39:53Z"
"","766","improve 'send encrypted' icon","The icon for indicating to the user that the message is going to be sent encrypted is the paper plane with a green lock icon overlaid. The lock is rotated 90deg.  Two issues: - Encrypted messages are colored blue, not green.   The overlaid lock icon should be blue, if any color. - The icon is rotated 90deg. The lock has rounded corners and and the arch of the lock is much smaller. All other lock icons used throughout TS do not have rounded corners and have a larger arch to be better recognizable. Accordingly, the lock on the paper plane should be a scaled version of `ic_menu_lock_...png` at the resp. size and same orientation.","closed","ux,","virtualritz","2014-02-26T13:19:28Z","2014-04-11T23:28:08Z"
"","731","Larger font sizes make the conversation list cluttered since the layouts don't scale","The heights of name/conversation should be relative to the system font size.","closed","","mcginty","2014-02-25T23:22:04Z","2014-03-25T07:59:37Z"
