"#","No","Issue Title","Issue Details","State","Labels","User name","created","Updated"
"","5035","KAFKA-5697: Revert streams wakeup","The wakeup-based strategy caused more problems than it solved, so we'll instead focus on KIP-266.  Revert commit 2d8049b.  Keep the metrics addition and the new test util.  Also keep the tests for shutdown, although they must be ignored until `poll(Duration)` is done in the scope of KIP-266.  ### Committer Checklist (excluded from commit message) - [ ] Verify design and implementation  - [ ] Verify test coverage and CI build status - [ ] Verify documentation (including upgrade notes)","closed","","vvcephei","2018-05-18T00:30:34Z","2018-05-18T16:08:02Z"
"","5019","Fix type inference on joins and aggregates on Scala API","The type inference doesn't currently work for the join functions in Scala as it doesn't know yet the types of the given `KStream[K, V]` or `KTable[K, V]`.  The fix here is to curry the joiner function. I personally prefer this notation but this also means it differs more from the Java API. I believe the diff with the Java API is worth in this case as it's not only solving the type inference but also fits better the Scala way of coding (ex: `fold`).  Moreover any Scala dev will bug and spend little time on these functions trying to understand why the type inference is not working and then get frustrated to be obliged to be explicit here where it's not harmful to be inferred.  The change is fairly straight forward but is also breaking, the good news is that we didn't release the Scala API yet, so this is perfect time to do this change.  This would also need some documentation update that I'm happy to do if there is positive feedback on this.  Thanks   ### Committer Checklist (excluded from commit message) - [ ] Verify design and implementation  - [ ] Verify test coverage and CI build status - [ ] Verify documentation (including upgrade notes)","closed","streams,","joan38","2018-05-15T15:33:05Z","2018-08-21T16:43:29Z"
"","4845","Make [Config]Resource.toString() consistent with existing code","The toString() for ConfigResource was using { } instead of ( ) which is inconsistent with the existing toStrings in the code, while toString for Resource was using a mix of ( and }.","closed","","edenhill","2018-04-10T08:11:10Z","2018-04-10T11:40:43Z"
"","4587","MINOR:Fix typo in the impl source","The static method `KStreamImpl.createReparitionedSource()` is missing a `t`.  This PR globally fixes the typo and keeps the code indentation consistent.  I have not yet run the unit tests, because `gradle` looks like it is going to take upwards of an hour to download :sleeping:   I did confirm that the misspelling `Reparitioned` does not occur anywhere else in the sources or tests. It seems that it would only break a dependent library if that library is using the implementation classes directly.","closed","streams,","blak3mill3r","2018-02-19T08:17:56Z","2018-02-26T20:26:16Z"
"","4767","MINOR: Fix flaky standby task test","The standby-task test failed due to standby task distribution not be exactly equal.  I think this will be the case from time to time, so I've updated test to make sure the standby task assignment count is not zero  I tested this by running the system test on branch builder 25 times all tests passed - http://confluent-kafka-branch-builder-system-test-results.s3-us-west-2.amazonaws.com/2018-03-23--001.1521845338--bbejeck--MINOR_fix_flaky_standy_task_test--c3054e9/report.html  ### Committer Checklist (excluded from commit message) - [ ] Verify design and implementation  - [ ] Verify test coverage and CI build status - [ ] Verify documentation (including upgrade notes)","closed","streams,","bbejeck","2018-03-23T23:06:01Z","2018-03-27T21:02:31Z"
"","5047","MINOR: Use reflection for signal handler and do not enable it for IBM JDK","The Signal classes are not available in the compile classpath if `--release` is used so we use reflection as a workaround. As part of that moved the code to Java and added a simple unit test.  Also disabled the signal handler if the IBM JDK is being used due to KAFKA-6918.  Manually tested shutdown via ctrl+c and verified that the message is printed.  ### Committer Checklist (excluded from commit message) - [ ] Verify design and implementation  - [ ] Verify test coverage and CI build status - [ ] Verify documentation (including upgrade notes)","closed","","ijuma","2018-05-20T05:34:55Z","2018-05-30T09:59:29Z"
"","4623","MINOR: Fix incorrect print in KafkaProducer","The print of timeout ms is not correctly formatted.","closed","producer,","wangshao","2018-02-27T08:05:50Z","2018-07-21T10:13:59Z"
"","4874","KAFKA-6790","The page here https://kafka.apache.org/11/documentation/streams/developer-guide/memory-mgmt.html talks about processor nodes and refers to non existing links.  Broken link (appears twice in the same document):  https://kafka.apache.org/11/documentation/streams/concepts.html#streams-concepts-processor  To find this search for the word ""processor node"" on the page memory-management , the ones which are links are broken.","closed","","ro7m","2018-04-15T06:37:19Z","2018-04-15T17:06:23Z"
"","5471","MINOR: Fix minikdc cleanup in system tests","The original way of stopping the minikdc process sometimes misfires because the process arg string is very long, and `ps` is not able to find the correct process. Using the `kill_java_processes` method is more reliable for finding and killing java processes.  Signed-off-by: Arjun Satish   ### Committer Checklist (excluded from commit message) - [ ] Verify design and implementation  - [ ] Verify test coverage and CI build status - [ ] Verify documentation (including upgrade notes)","closed","connect,","wicknicks","2018-08-07T17:20:58Z","2020-10-16T06:03:01Z"
"","5217","MINOR: use new API timeout config in test","The old timeout configs no longer take effect, as of 53ca52f855e903907378188d29224b3f9cefa6cb. They are replaced by the new one.  ### Committer Checklist (excluded from commit message) - [ ] Verify design and implementation  - [ ] Verify test coverage and CI build status - [ ] Verify documentation (including upgrade notes)","closed","streams,","vvcephei","2018-06-13T21:56:23Z","2018-06-13T22:05:27Z"
"","5242","KAFKA-7067:Include connector configs added in KIP-297 and KIP-298 in the system test assertion","The new connector configs added in  KIP-297 and KIP-298 would need to be updated in the connect_rest_test.py so that the expected results match the actual.  ### Committer Checklist (excluded from commit message) - [ ] Verify design and implementation  - [ ] Verify test coverage and CI build status - [ ] Verify documentation (including upgrade notes)","closed","","mageshn","2018-06-17T07:18:29Z","2018-06-18T22:37:27Z"
"","5316","MINOR: Change ""no such session ID"" log to debug","The metric will give us good information about the number of evictions per second, so we don't need the INFO log.","closed","","cmccabe","2018-07-01T20:46:54Z","2019-10-10T00:41:06Z"
"","4806","KAFKA-6732","The link to processor topology on write-streams.html is redirecting to 404 error. Links which result in 404 : referred from https://kafka.apache.org/11/documentation/streams/developer-guide/write-streams.html  Broken : https://kafka.apache.org/11/documentation/streams/concepts.html#streams-concepts   https://kafka.apache.org/documentation/streams/concepts.html#streams-concepts","closed","docs,","ro7m","2018-04-01T13:01:42Z","2018-04-02T16:54:22Z"
"","4967","KAFKA-6857: Leader must always reply with undefined offset if undefined leader epoch requested","The leader must explicitly check if requested leader epoch is undefined, and return undefined offset so that the follower can fall back to truncating to high watermark. Otherwise, if the leader also is not tracking leader epochs, it may return its LEO, which will the follower to truncate to the incorrect offset.   Added unit test to verify the behavior.  ### Committer Checklist (excluded from commit message) - [ ] Verify design and implementation  - [ ] Verify test coverage and CI build status - [ ] Verify documentation (including upgrade notes)","closed","","apovzner","2018-05-04T00:10:36Z","2018-05-04T06:06:34Z"
"","5003","Minor: Remove the unused declaration","The issue is reported by the code analysis (intellij). Just do some garden works.    ### Committer Checklist (excluded from commit message) - [ ] Verify design and implementation  - [ ] Verify test coverage and CI build status - [ ] Verify documentation (including upgrade notes)","closed","","chia7712","2018-05-11T07:26:59Z","2018-05-26T08:18:06Z"
"","4763","Minor: Don’t send the DeleteTopicsRequest for the invalid topic names","The invalid topic name is already handled locally so it is unnecessary to send the DeleteTopicsRequest. This PR adds a count to MockClient for testing.  ### Committer Checklist (excluded from commit message) - [ ] Verify design and implementation  - [ ] Verify test coverage and CI build status - [ ] Verify documentation (including upgrade notes)","closed","","chia7712","2018-03-23T09:36:31Z","2018-04-05T07:06:15Z"
"","4896","KAFKA-4682: Revise expiration semantics of consumer group offsets (KIP-211 - Part 1)","The implementation of [expiration semantics for unsubscribed topics](https://cwiki.apache.org/confluence/display/KAFKA/KIP-211%3A+Revise+Expiration+Semantics+of+Consumer+Group+Offsets#KIP-211:ReviseExpirationSemanticsofConsumerGroupOffsets-UnsubscribingfromaTopic) will be done in a separate PR.  ### Committer Checklist (excluded from commit message) - [ ] Verify design and implementation  - [ ] Verify test coverage and CI build status - [ ] Verify documentation (including upgrade notes)","closed","","vahidhashemian","2018-04-19T07:43:01Z","2018-06-29T07:23:55Z"
"","5295","MINOR: removed kafka-streams subproject .gitignore","the generated eclipse project gitignore would not be created if an existing gitignore was there  *More detailed description of your change, if necessary. The PR title and PR message become the squashed commit message, so use a separate comment to ping reviewers.*  *Summary of testing strategy (including rationale) for the feature or bug fix. Unit and/or integration tests are expected for any behaviour change and system tests should be considered for larger changes.*  ### Committer Checklist (excluded from commit message) - [ ] Verify design and implementation  - [ ] Verify test coverage and CI build status - [ ] Verify documentation (including upgrade notes)","closed","","edoardocomar","2018-06-26T13:43:43Z","2018-09-24T09:49:45Z"
"","5391","KAFKA-7182: SASL/OAUTHBEARER client response missing %x01 seps","The format of the SASL/OAUTHBEARER client response is defined in RFC 7628 Section 3.1 as follows:       kvsep          = %x01      key            = 1*(ALPHA)      value          = *(VCHAR / SP / HTAB / CR / LF )      kvpair         = key ""="" value kvsep      client-resp    = (gs2-header kvsep *kvpair kvsep) / kvsep  ;;gs2-header = See RFC 5801 (Section 4)  The SASL/OAUTHBEARER client response as currently implemented in OAuthBearerSaslClient sends the valid gs2-header ""n,,"" but then sends the ""auth"" key and value immediately after it, like this:  String.format(""n,,auth=Bearer %s"", callback.token().value())  This does not conform to the specification because there is no %x01 after the gs2-header, no %x01 after the auth value, and no terminating %x01. The code should instead be as follows:  String.format(""n,,\u0001auth=Bearer %s\u0001\u0001"", callback.token().value())  Similarly, the parsing of the client response in OAuthBearerSaslServer, which currently allows the malformed text, must also change.  This should be fixed prior to the initial release of the SASL/OAUTHBEARER code in 2.0.0 to prevent compatibility problems.  Signed-off-by: Ron Dagostino   *More detailed description of your change, if necessary. The PR title and PR message become the squashed commit message, so use a separate comment to ping reviewers.*  *Summary of testing strategy (including rationale) for the feature or bug fix. Unit and/or integration tests are expected for any behaviour change and system tests should be considered for larger changes.*  ### Committer Checklist (excluded from commit message) - [ ] Verify design and implementation  - [ ] Verify test coverage and CI build status - [ ] Verify documentation (including upgrade notes)","closed","","rondagostino","2018-07-18T21:03:07Z","2018-07-19T16:53:48Z"
"","4544","KAFKA-6534: Enforce a rebalance in the next poll call when encounter task migration","The fix is in two folds:  1) For tasks that's closed in `closeZombieTask`, their corresponding partitions are still in `runningByPartition` so those closed tasks may still be returned in `activeTasks` and `standbyTasks`. Adding guards on the returned tasks and if they are closed notify the thread to trigger rebalance immediately.  2) When triggering a rebalance, un-subscribe and re-subscribe immediately to make sure we are not dependent on the background heartbeat thread timing.  3) Some minor changes on log4j. More specifically, I moved the log entry of `closeZombieTask` to its callers with more context information and the action going to take.  I can re-produce the issue with EosIntegrationTest may hand-code the heartbeat thread to GC, and confirmed this patch fixed the issue. Unfortunately this test cannot be added to AK since currently we do not have ways to manipulate the heartbeat thread in unit tests.  ### Committer Checklist (excluded from commit message) - [ ] Verify design and implementation  - [ ] Verify test coverage and CI build status - [ ] Verify documentation (including upgrade notes)","closed","streams,","guozhangwang","2018-02-08T00:53:42Z","2020-04-24T23:56:44Z"
"","4827","KAFKA-6748: double check before scheduling a new task after the punctuate call","The first commit is a new test, illustrating the problem. The second commit fixes the problem.  ### Committer Checklist (excluded from commit message) - [ ] Verify design and implementation  - [ ] Verify test coverage and CI build status - [ ] Verify documentation (including upgrade notes)","closed","streams,","fredfp","2018-04-05T10:13:37Z","2018-04-05T21:06:43Z"
"","5359","MINOR: clean up window store interface to avoid confusion","The existing interface and javadoc on window store are confusing and slightly misleading about the roles of the `windowSize` parameter to the store and the `timestamp` parameter of `WindowStore#put`.  * clarify the parameters * deprecate `WindowStore#put()`. This variant is confusing. It's almost certainly not the right thing to use for anyone, since it still inserts the record at a timestamp, and it's (currently) undefined what the timestamp will be. In practice, this is always the record timestamp, which is again, unlikely to be correct for time window stores. If that is the intent, callers can easily supply the record timestamp themselves.  ### Committer Checklist (excluded from commit message) - [ ] Verify design and implementation  - [ ] Verify test coverage and CI build status - [ ] Verify documentation (including upgrade notes)","closed","","vvcephei","2018-07-12T15:33:17Z","2018-08-06T17:32:21Z"
"","4873","Minor: Log the exception thrown by Selector.poll","The error merits careful logging.  ### Committer Checklist (excluded from commit message) - [ ] Verify design and implementation  - [ ] Verify test coverage and CI build status - [ ] Verify documentation (including upgrade notes)","closed","","chia7712","2018-04-14T08:17:33Z","2018-04-16T20:43:54Z"
"","5296","MINOR: avoid ambiguous scala import error in Eclipse","the Eclipse scala compiler complained about FetchRequest being ambiguosly imported  *More detailed description of your change, if necessary. The PR title and PR message become the squashed commit message, so use a separate comment to ping reviewers.*  *Summary of testing strategy (including rationale) for the feature or bug fix. Unit and/or integration tests are expected for any behaviour change and system tests should be considered for larger changes.*  ### Committer Checklist (excluded from commit message) - [ ] Verify design and implementation  - [ ] Verify test coverage and CI build status - [ ] Verify documentation (including upgrade notes)","closed","","edoardocomar","2018-06-26T13:55:05Z","2018-06-26T17:44:11Z"
"","5361","MINOR: Updated Quickstart to mention log.dirs","The default server.properties file now contains the log.dirs setting and not log.dir anymore.  Co-authored-by: Mickael Maison  Co-authored-by: Katherine Farmer   ### Committer Checklist (excluded from commit message) - [ ] Verify design and implementation  - [ ] Verify test coverage and CI build status - [ ] Verify documentation (including upgrade notes)","closed","","mimaison","2018-07-12T18:05:24Z","2018-07-18T11:29:39Z"
"","5460","KAFKA-7247: Update a link to Apache BookKeeper project","The current URL is old and invalid.  ### Committer Checklist (excluded from commit message) - [ ] Verify design and implementation  - [ ] Verify test coverage and CI build status - [ ] Verify documentation (including upgrade notes)","closed","","okumin","2018-08-04T14:31:18Z","2018-08-19T04:23:14Z"
"","4946","KAFKA-6836: Upgrade metrics library","The current metrics library which Kafka is using is pretty old (version 2.2.0 from Yammer and now we have 4.X from Dropwizard).  In the latest versions of the Dropwizard library (which comes from Yammer and this is deprecated), there are a lot of bugfixes and new features included which could be interesting for the metrics (ie: Reservoris, support JDK9, etc).  This patch includes the upgrade to this new version of the library so that we could add new features in Kafka metrics.  All tests metrics-related in the project have been updated.  Notice that: * ``yammer-metrics-count`` metric in ``KafkaServer`` and ``ZookeeperConsumerConnector`` has been renamed to ``dropwizard-metrics-count``. * All meters have SECONDS as a rate-unit. Previously, all meters in Kafka had the rate unit in seconds except the meter ``RequestHandlerAvgIdlePercent`` (in ``KafkaRequestHandlerPool``) which now is in seconds as well (before it was in nanosecs). * The property ``eventType`` in JMXReporter MBean doesn't exist anymore. So, all meters don't have this mbean property. * I've done a refactor in the metrics trying to encapsulate a little bit the metrics inside the ``kafka.metrics`` package. * The current metrics library version used is 3.2.6. When dependency with JDK7 is removed, we'll be able to upgrade to version 4.X.  Maybe this needs a KIP?  ### Committer Checklist (excluded from commit message) - [ ] Verify design and implementation  - [ ] Verify test coverage and CI build status - [ ] Verify documentation (including upgrade notes)","closed","","mmolimar","2018-04-29T16:56:42Z","2019-07-26T23:33:54Z"
"","4884","MINOR: refactor AdminClient ListConsumerGroups API","The current Iterator-based ListConsumerGroups API is synchronous.  The API should be asynchronous to fit in with the other AdminClient APIs.  Also fix some error handling corner cases.","closed","","cmccabe","2018-04-17T00:34:49Z","2019-05-20T18:55:56Z"
"","4512","KAFKA-6513: Corrected how Converters and HeaderConverters are instantiated and configured","The commits for KIP-145 (KAFKA-5142) changed how the Connect workers instantiate and configure the Converters, and also added the ability to do the same for the new HeaderConverters. However, the last few commits removed the default value for the `converter.type` property for Converters and HeaderConverters, and this broke how the internal converters were being created.  This change corrects the behavior so that the `converter.type` property is always set by the worker (or by the Plugins class), which means the existing Converter implementations will not have to do this. The built-in JsonConverter, ByteArrayConverter, and StringConverter also implement HeaderConverter which implements Configurable, but the Worker and Plugins methods do not yet use the `Configurable.configure(Map)` method and instead still use the `Converter.configure(Map,boolean)`.  Several tests were modified, and a new PluginsTest was added to verify the new behavior in Plugins for instantiating and configuring the Converter and HeaderConverter instances.  ### Committer Checklist (excluded from commit message) - [ ] Verify design and implementation  - [ ] Verify test coverage and CI build status - [ ] Verify documentation (including upgrade notes)","closed","connect,","rhauch","2018-02-01T23:46:29Z","2020-10-16T06:05:16Z"
"","4932","Fix small issue in comment","The comment seems not correct when I try to figure out how TimingWheel works  *More detailed description of your change, if necessary. The PR title and PR message become the squashed commit message, so use a separate comment to ping reviewers.*  *Summary of testing strategy (including rationale) for the feature or bug fix. Unit and/or integration tests are expected for any behaviour change and system tests should be considered for larger changes.*  ### Committer Checklist (excluded from commit message) - [ ] Verify design and implementation  - [ ] Verify test coverage and CI build status - [ ] Verify documentation (including upgrade notes)","open","","QuantumBear","2018-04-26T06:01:01Z","2018-04-26T06:01:01Z"
"","5383","KAFKA-6123: Give client MetricsReporter auto-generated client.id","The client's `MetricsReporter` class currently receives the `client.id` field only if the user has configured it. The auto-generated `client.id` is not passed to the `MetricsReporter`.  - Give auto generated `client.id` as a config override to `MetricsReporter` (same way [KAFKA-4756](https://issues.apache.org/jira/browse/KAFKA-4756) handles it)  ### Committer Checklist (excluded from commit message) - [ ] Verify design and implementation  - [ ] Verify test coverage and CI build status - [ ] Verify documentation (including upgrade notes)","closed","","KevinLiLu","2018-07-18T01:37:16Z","2018-10-04T02:47:21Z"
"","4482","HOTFIX: ambiguity issue calling putAll() in scala compilation against JAVA 9","The cause for compilation error in JDK 9.0 was an ambiguity issue in scalac: ``` both method putAll in class Properties of type (x$1: java.util.Map[_, _])Unit and  method putAll in class Hashtable of type (x$1: java.util.Map[_ <: Object, _ <: Object])Unit match argument types (java.util.Properties)       newProps.putAll(props) ``` This pull request fixes this error by avoiding the call to``` putAll ```and instead uses the ```put ```method directly.","closed","","ConcurrencyPractitioner","2018-01-28T03:23:32Z","2018-01-28T13:31:34Z"
"","4613","MINOR: Fix javadoc for consumer offsets lookup APIs which do not block indefinitely","The blocking time for these APIs is bounded by the request timeout.  ### Committer Checklist (excluded from commit message) - [ ] Verify design and implementation  - [ ] Verify test coverage and CI build status - [ ] Verify documentation (including upgrade notes)","closed","","hachikuji","2018-02-22T16:37:44Z","2018-02-22T17:47:13Z"
"","5299","MINOR: Reduce time windows for flaky test","The `StreamStreamJoinIntegrationTest` is a bit flaky.  The failures seem to occur with caching turned off.  With join windows of 10 seconds, it's possible that if one stream experiences some latency there may be values present from the other stream for a join when not expected by the test.  Tested by running streams tests and running the `StreamStreamJoinIntegrationTest` test 25 times.  ### Committer Checklist (excluded from commit message) - [ ] Verify design and implementation  - [ ] Verify test coverage and CI build status - [ ] Verify documentation (including upgrade notes)","closed","streams,","bbejeck","2018-06-26T22:43:40Z","2018-07-28T14:59:26Z"
"","4495","KAFKA-6487: ChangeLoggingKeyValueBytesStore does not propagate delete","The `ChangeLoggingKeyValueBytesStore` used to write null to its underlying store instead of propagating the delete, which has two drawbacks: - an iterator will see null values - unbounded memory growth of the underlying in-memory keyvalue store  The fix will just propagate the delete instead of performing put(key, null).   The changes to the tests: - extra test whether the key is really gone after delete by calling the `approximateEntries` on the underlying store. This number is exact because we know the underlying store in the test is of type `InMemoryKeyValueStore` - extra test to check a delete is logged as   (the existing test would also succeed if the key is just absent)  While also updating the corresponding tests of the `ChangeLoggingKeyValueStore` I noticed the class is nowhere used anymore so I removed it from the source code for clarity.","closed","","bartdevylder","2018-01-31T13:29:19Z","2018-02-02T08:19:40Z"
"","4743","MINOR: fix flaky TestUtils functions","TestUtils#produceMessages should always close the KafkaProducer, even when there is an exception.  Otherwise, the test will leak threads when there is an error.  TestUtils#createNewProducer should create a producer with a requestTimeoutMs of 30 seconds by default, not around 10 seconds. This should avoid tests that flake when the load on Jenkins climbs.  Fix two cases where a very short timeout of 2 seconds was getting set.","closed","","cmccabe","2018-03-20T22:07:56Z","2019-05-20T19:06:51Z"
