"#","No","Issue Title","Issue Details","State","Labels","User name","created","Updated"
"","5469","MINOR: Add connector configs to site-docs","In AK's documentation, the config props for connectors are not listed (https://kafka.apache.org/documentation/#connectconfigs). This PR adds these sink and source connector configs to the html site-docs.   Signed-off-by: Arjun Satish   ### Committer Checklist (excluded from commit message) - [ ] Verify design and implementation  - [ ] Verify test coverage and CI build status - [ ] Verify documentation (including upgrade notes)","closed","","wicknicks","2018-08-06T23:30:09Z","2018-08-07T22:09:24Z"
"","5148","MINOR: Upgrade Gradle to 4.8 and bug fix updates for other deps","In addition to Gradle, updated snappy, owasp-dependency-check, apache directory service api.  Gradle 4.8 fixes a fatal issue when building with Java 11, but full support is coming in 4.9 or later.  Manually tested that `jarAll` and importing into IntelliJ works, relying on PR build for the rest.  ### Committer Checklist (excluded from commit message) - [ ] Verify design and implementation  - [ ] Verify test coverage and CI build status - [ ] Verify documentation (including upgrade notes)","closed","","ijuma","2018-06-06T11:37:36Z","2018-06-07T07:28:12Z"
"","5066","KAFKA-6936: Implicit Materialized for aggregates","In #4919 we propagate the SerDes for each of these aggregation operators.  As @guozhangwang mentioned in that PR: > reduce: inherit the key and value serdes from the parent XXImpl class. > count: inherit the key serdes, enforce setting the Serdes.Long() for value serdes. > aggregate: inherit the key serdes, **do not set for value serdes internally**.  Although it's all good for `reduce` and `count`, it is quiet unsafe to have `aggregate` without `Materialized` given. In fact I don't see why we would not give a `Materialized` for the `aggregate` since the result type will always be different (otherwise use `reduce`) and also the value Serde is simply not propagated.  This has been discussed previously in a broader PR before but I believe for `aggregate` we could pass implicitly a `Materialized` the same way we pass a `Joined`, just to avoid the stupid case. Then if the user wants to specialize, he can give his own `Materialized`.  @guozhangwang @debasishg @seglo Let me know your thoughts.  ### Committer Checklist (excluded from commit message) - [ ] Verify design and implementation  - [ ] Verify test coverage and CI build status - [ ] Verify documentation (including upgrade notes)","closed","","joan38","2018-05-22T20:48:04Z","2018-08-13T23:38:54Z"
"","5206","KAFKA-7051: Improve the efficiency of ReplicaManager","Improve the efficiency of the ReplicaManager when there are many partitions.  The 'fetchInfo' argument to ReplicaManager#fetchMessages can be an iterator rather than a sequence.  This avoids the need to materialize a new collection in some cases.  Reduce the number of times we loop over the read results obtained from 'readFromLog'.  Fix a case where we were performing an O(N^2) operation to join the set of partitions we wanted info about, and the set of partitions we obtained information about.","closed","performance,","cmccabe","2018-06-12T22:59:56Z","2019-05-20T18:54:46Z"
"","4519","KAFKA-6454: Allow timestamp manipulation in Processor API","implements KIP-251","closed","streams,","mjsax","2018-02-03T00:34:19Z","2018-03-16T23:02:18Z"
"","4882","KAFKA-6361: Fix log divergence between leader and follower after fast leader fail over","Implementation of KIP-279 as described here: https://cwiki.apache.org/confluence/display/KAFKA/KIP-279%3A+Fix+log+divergence+between+leader+and+follower+after+fast+leader+fail+over  In summary: - Added leader_epoch to OFFSET_FOR_LEADER_EPOCH_RESPONSE - Leader replies with the pair( largest epoch less than or equal to the requested epoch, the end offset of this epoch) - If Follower does not know about the leader epoch that leader replies with, it truncates to the end offset of largest leader epoch less than leader epoch that leader replied with, and sends another OffsetForLeaderEpoch request. That request contains the largest leader epoch less than leader epoch that leader replied with.  Added integration test EpochDrivenReplicationProtocolAcceptanceTest.logsShouldNotDivergeOnUncleanLeaderElections that does 3 fast leader changes where unclean leader election is enabled and min isr is 1. The test failed before the fix was implemented.  ### Committer Checklist (excluded from commit message) - [ ] Verify design and implementation  - [ ] Verify test coverage and CI build status - [ ] Verify documentation (including upgrade notes)","closed","","apovzner","2018-04-16T20:06:59Z","2018-05-11T02:58:43Z"
"","5437","KAFKA-7027: Add overloaded build method to StreamsBuilder","Implementation of [KIP-312](https://cwiki.apache.org/confluence/display/KAFKA/KIP-312%3A+Add+Overloaded+StreamsBuilder+Build+Method+to+Accept+java.util.Properties) required for enabling the use of the optimization framework.    This PR is required to allow for a 4th PR following on from https://github.com/apache/kafka/pull/5201 to enable optimizations.  The existing streams tests were used for testing.  ### Committer Checklist (excluded from commit message) - [ ] Verify design and implementation  - [ ] Verify test coverage and CI build status - [ ] Verify documentation (including upgrade notes)","closed","","bbejeck","2018-07-31T15:17:51Z","2018-07-31T16:24:14Z"
"","4693","KAFKA-5540: Deprecate internal converter configs","Implementation of [KIP-174](https://cwiki.apache.org/confluence/display/KAFKA/KIP-174+-+Deprecate+and+remove+internal+converter+configs+in+WorkerConfig)  Configuration properties 'internal.key.converter' and 'internal.value.converter' are deprecated, and default to org.apache.kafka.connect.json.JsonConverter.  Warnings are logged if values are specified for either, or if properties that appear to configure instances of internal converters (i.e., ones prefixed with either 'internal.key.converter.' or 'internal.value.converter.') are given.  The property 'schemas.enable' is also defaulted to false for internal JsonConverter instances (both for keys and values) if it isn't specified.  Documentation and code have also been updated with deprecation notices and annotations, respectively.  Unit tests have been updated in `PluginsTest` to account for the new defaults for `schemas.enable` for internal key/value converters, and to ensure that (for the time being), internal key/value converters are still configurable despite being deprecated.  ### Committer Checklist (excluded from commit message) - [ ] Verify design and implementation  - [ ] Verify test coverage and CI build status - [ ] Verify documentation (including upgrade notes)","closed","connect,","C0urante","2018-03-12T22:07:23Z","2020-10-16T06:24:16Z"
"","4871","KAFKA-6927: Message down-conversion causes Out Of Memory on broker","Implementation for lazy down-conversion in a chunked manner for efficient memory usage during down-conversion. This pull request is mainly to get initial feedback on the direction of the patch. The patch includes all the main components from KIP-283.  ### Committer Checklist (excluded from commit message) - [ ] Verify design and implementation  - [ ] Verify test coverage and CI build status - [ ] Verify documentation (including upgrade notes)","closed","","dhruvilshah3","2018-04-13T20:38:21Z","2018-06-07T17:09:53Z"
"","4766","MINOR: Ignoring tests using old versions of Streams until KIP-268 is merged","Ignoring tests in `streams_upgrade_test.py` and `streams_multiple_rolling_upgrade_test.py` until KIP-268 is merged.  Kicked off system test build of all streams tests - https://jenkins.confluent.io/job/system-test-kafka-branch-builder/1581/  ### Committer Checklist (excluded from commit message) - [ ] Verify design and implementation  - [ ] Verify test coverage and CI build status - [ ] Verify documentation (including upgrade notes)","closed","","bbejeck","2018-03-23T19:18:38Z","2018-03-29T00:41:08Z"
"","4891","KAFKA-6802: Improved logging for missing topics during task assignment","If users don't create all topics before starting a streams application, they could get unexpected results.  For example, sharing a state store between sub-topologies where one input topic is not created ahead time results in log message that that ""Partition X is not assigned to any tasks"" does not give any clues as to how this could have occurred.  Also, this PR changes the log level from `INFO` to `WARN` when metadata does not have partitions for a given topic.   ### Committer Checklist (excluded from commit message) - [ ] Verify design and implementation  - [ ] Verify test coverage and CI build status - [ ] Verify documentation (including upgrade notes)","closed","","bbejeck","2018-04-18T18:42:17Z","2018-04-18T22:35:11Z"
"","4704","KAFKA-6653: Complete delayed operations even when there is lock contention","If there is lock contention while multiple threads check if a delayed operation may be completed (e.g. a produce request with acks=-1), the threads perform completion only if the lock is free, to avoid deadlocks. This leaves a timing window when an operation becomes ready to complete after another thread has acquired the lock and performed the check for completion, but not yet released the lock. The PR adds an additional flag to ensure that the operation is completed in this case.  ### Committer Checklist (excluded from commit message) - [ ] Verify design and implementation  - [ ] Verify test coverage and CI build status - [ ] Verify documentation (including upgrade notes)","closed","","rajinisivaram","2018-03-13T22:32:02Z","2018-03-15T08:17:56Z"
"","4665","KAFKA-6560: [FOLLOW-UP] don't deserialize null byte array in window store fetch","If the result of a fetch from a Window Store results in a null byte array we should return null rather than passing it to the serde to deserialize.  ### Committer Checklist (excluded from commit message) - [ ] Verify design and implementation  - [ ] Verify test coverage and CI build status - [ ] Verify documentation (including upgrade notes)","closed","","dguy","2018-03-08T10:51:18Z","2018-03-08T21:24:23Z"
"","5159","KAFKA-7003: Set error context in message headers (KIP-298)","If the property `errors.deadletterqueue.context.headers.enable` is set to true, add a set of headers to the message describing the context under which the error took place.  A unit test is added to check the correctness of header creation.  Signed-off-by: Arjun Satish   ### Committer Checklist (excluded from commit message) - [ ] Verify design and implementation  - [ ] Verify test coverage and CI build status - [ ] Verify documentation (including upgrade notes)","closed","connect,","wicknicks","2018-06-07T07:23:42Z","2020-10-16T06:02:58Z"
"","5057","MINOR: AdminClient metadata manager should reset state on failure","If the internal metadata request fails, we must reset the state inside `AdminClientMetadataManager` or we will be stuck indefinitely in the `UPDATE_PENDING` state and have no way to fetch new metadata.  ### Committer Checklist (excluded from commit message) - [ ] Verify design and implementation  - [ ] Verify test coverage and CI build status - [ ] Verify documentation (including upgrade notes)","closed","","hachikuji","2018-05-21T23:39:09Z","2018-05-22T17:14:13Z"
"","5339","Minor: Fix the NPE happening in closing KafkaServer","If server fails to connect to zk, the kafkaScheduler will be null when closing the kafka server. The NPE won't hurt kafka since the exception is swallowed.  `kafka.zookeeper.ZooKeeperClientTimeoutException: Timed out waiting for connection while in state: CONNECTING 	at kafka.zookeeper.ZooKeeperClient.$anonfun$waitUntilConnected$3(ZooKeeperClient.scala:225) 	at scala.runtime.java8.JFunction0$mcV$sp.apply(JFunction0$mcV$sp.java:12) 	at kafka.utils.CoreUtils$.inLock(CoreUtils.scala:251) 	at kafka.zookeeper.ZooKeeperClient.waitUntilConnected(ZooKeeperClient.scala:221) 	at kafka.zookeeper.ZooKeeperClient.(ZooKeeperClient.scala:95) 	at kafka.zk.KafkaZkClient$.apply(KafkaZkClient.scala:1581) 	at kafka.server.KafkaServer.createZkClient$1(KafkaServer.scala:348) 	at kafka.server.KafkaServer.initZkClient(KafkaServer.scala:372) 	at kafka.server.KafkaServer.startup(KafkaServer.scala:202) 	at kafka.server.KafkaServerStartable.startup(KafkaServerStartable.scala:38) 	at kafka.Kafka$.main(Kafka.scala:75) 	at kafka.Kafka.main(Kafka.scala) [2018-07-06 05:51:27,036] INFO shutting down (kafka.server.KafkaServer) [2018-07-06 05:51:27,042] WARN  (kafka.utils.CoreUtils$) java.lang.NullPointerException 	at kafka.server.KafkaServer.$anonfun$shutdown$6(KafkaServer.scala:579) 	at kafka.utils.CoreUtils$.swallow(CoreUtils.scala:86) 	at kafka.server.KafkaServer.shutdown(KafkaServer.scala:579) 	at kafka.server.KafkaServer.startup(KafkaServer.scala:329) 	at kafka.server.KafkaServerStartable.startup(KafkaServerStartable.scala:38) 	at kafka.Kafka$.main(Kafka.scala:75) 	at kafka.Kafka.main(Kafka.scala) `  ### Committer Checklist (excluded from commit message) - [ ] Verify design and implementation  - [ ] Verify test coverage and CI build status - [ ] Verify documentation (including upgrade notes)","closed","","chia7712","2018-07-06T06:03:54Z","2018-08-29T23:01:17Z"
"","4937","MINOR: Pin pip to 9.0.3 as 10 is not compatible with system pip","If not pinned, the following error will happen: Traceback (most recent call last):   File ""/usr/bin/pip"", line 9, in      from pip import main ImportError: cannot import name main  Testing: Ran tests/docker/run_tests.sh and it works instead of getting above error.   ### Committer Checklist (excluded from commit message) - [ ] Verify design and implementation  - [ ] Verify test coverage and CI build status - [ ] Verify documentation (including upgrade notes)","closed","","maxzheng","2018-04-27T02:04:53Z","2018-04-27T04:01:27Z"
"","5342","MINOR: Use FetchRequest v8 and ListOffsetRequest v3 in ReplicaFetcherThread","If inter.broker.protocol.version is 2.0-IV1 or newer. Also fixed ListOffsetRequest so that v2 is used, if applicable.  Added a unit test that verifies that we use the latest version of the various requests by default. Included a few minor tweaks to make testing easier.  ### Committer Checklist (excluded from commit message) - [ ] Verify design and implementation  - [ ] Verify test coverage and CI build status - [ ] Verify documentation (including upgrade notes)","closed","","ijuma","2018-07-06T13:30:31Z","2018-07-06T21:35:31Z"
"","4517","KAFKA-6529: Stop file descriptor leak when client disconnects with staged receives","If an exception is encountered while sending data to a client connection, that connection is disconnected. If there are staged receives for that connection, it is tracked to process those records. However, if the exception was encountered during processing a `RequestChannel.Request`, the `KafkaChannel` for that connection is muted and won't be processed.  Add the channel to failed sends so the connection is cleaned up on those exceptions. This stops the leak of the memory for pending requests and the file descriptor of the TCP socket.  Only flag channel as failed send when an exception is encountered while actually attempting to send something. Other socket interactions don't count.  Test that a channel is closed when an exception is raised while writing to a socket that has been closed by the client. Since sending a response  requires acks != 0, allow specifying the required acks for test requests in SocketServerTest.scala.  ### Committer Checklist (excluded from commit message) - [ ] Verify design and implementation  - [ ] Verify test coverage and CI build status - [ ] Verify documentation (including upgrade notes)","closed","","parafiend","2018-02-02T23:03:43Z","2020-04-05T01:07:02Z"
"","5445","KAFKA-7225 - Pretransform validated props","If a property requires validation, it should be pretransformed if it is a variable reference, in order to have a value that will properly pass the validation.  ### Committer Checklist (excluded from commit message) - [ ] Verify design and implementation  - [ ] Verify test coverage and CI build status - [ ] Verify documentation (including upgrade notes)","closed","","rayokota","2018-08-02T03:17:00Z","2018-08-07T20:20:03Z"
"","4567","KAFKA-6559: Iterate record sets before calling Log.append","If a Produce request contains multiple record sets for a single topic-partition, it is better to iterate these before calling Log.append. This is because append will process all the sets together, and therefore will need to reassign offsets even if the offsets for an individual record set are properly formed. By iterating the record sets before calling append, each set can be considered on its own and potentially be appended without reassigning offsets.  3 tests added to cover this: - Append a single MemoryRecords that contains multiple batches - Append a single MemoryRecords that contains no batches - Append a single MemoryRecords that has an empty batch in the middle of valid batches  ### Committer Checklist (excluded from commit message) - [ ] Verify design and implementation  - [ ] Verify test coverage and CI build status - [ ] Verify documentation (including upgrade notes)","open","core,","toddpalino","2018-02-13T19:15:29Z","2018-03-02T19:31:13Z"
"","5320","KAFKA-6859: Do not send LeaderEpochRequest for undefined leader epochs","If a broker or topic has a message format < 0.11, he does not track leader epochs. LeaderEpochRequests for such will always return undefined, making the follower truncate to the highest watermark. Since there is no use to use the network for such cases, don't send a request.  ### Notes * I am not sure whether we should even check `brokerConfig.interBrokerProtocolVersion >= KAFKA_0_11_0_IV2`, since log message format is the only thing we care about and as far as I understand it is always defined * I am not fond of the subclassing in the tests for mocking the method (and also making it protected) but this was the cleanest solution I could come up with. Other ideas are welcome  The ticket also mentions  > Another example is a bootstrapping follower that does not have any leader epochs recorded,   but that is handled here: https://github.com/apache/kafka/blob/57320981bb98086a0b9f836a29df248b1c0378c3/core/src/main/scala/kafka/server/AbstractFetcherThread.scala#L127 as far as I can tell  ### Committer Checklist (excluded from commit message) - [ ] Verify design and implementation  - [ ] Verify test coverage and CI build status - [ ] Verify documentation (including upgrade notes)","closed","","stanislavkozlovski","2018-07-02T13:19:18Z","2018-08-31T08:08:07Z"
"","5144","HOTFIX: Use alternative state store changelog topic","I've tried multiple ways to add a upgrade path patch for users from StreamsBuilder users in 1.0 / 1.1 to 2.0 with source KTable topics reusing. The following approach has the smallest changes on code and hopefully have the least changes.  Note that I do not intentionally write a checkpoint file after the restoration is done, since it will cause the logic to become too complex with / without EOS. If we do not have this checkpoint file containing the offset of the source topic, then if there is a crash between starting the restoration and writing the first checkpoint file in task.commit during normal processing, upon resuming we will restore from the old changelog again and may have duplicates if EOS is not turned on. But both are existed today so we are not introducing any regressions.  Another note is that the changelog topic map now have three different code paths (it is not introduced by this PR, but just want to bring this up to attention):  1. From `InternalTopologyBuilder.topicGroups`, used by the partition assignor to create those changelog topics; for this case if a state store is not logging enabled it should not be in this map.  2. From `InternalTopologBuilder.build` that generates the `ProcessorTopology` and then later used in `ProcessorStateManager`. Here even if a store is not logging enabled, if it still need to be restored either in a standby task or as part of the restoration of an active task, it should still be in the storesToChangelogs map, but note that the changelog topic names may not always be `stateStore-changelog`.  3. In `StoreBuilder`, decide whether we should really wrap it with the logging layer, and if yes, which topic to write to. Here if logging is disabled we should never wrap the logging layer, otherwise we wrap logging with the normal `stateStore-changelog` topic name.  Right now these logic modules are handled by completely different code paths; it is a bit complex for future optimizations on the topology.  ### Committer Checklist (excluded from commit message) - [ ] Verify design and implementation  - [ ] Verify test coverage and CI build status - [ ] Verify documentation (including upgrade notes)","closed","","guozhangwang","2018-06-06T04:28:18Z","2018-06-07T16:12:48Z"
"","5000","KAFKA-6894: Improve err msg when explicitly connecting processor to global store","I've improved the error message when explicitly trying to connect a processor to a global store as in this example: ```       builder.globalTable(""supersteps"", Consumed.with(Serdes.Integer(), Serdes.Long()),                         Materialized.>as(""superstepStore"")                                 .withKeySerde(Serdes.Integer()).withValueSerde(Serdes.Long()));        stream.transform((TransformerSupplier>, KeyValue>)                         InitialTransformer::new, ""superstepStore""); ```","closed","streams,","rayokota","2018-05-10T19:18:25Z","2018-05-11T00:17:59Z"
"","4919","KAFKA-6813: Remove deprecated APIs in KIP-182, Part I","I'm breaking KAFKA-6813 into a couple of ""smaller"" PRs and this is the first one. It focused on:  1. Remove deprecated APIs in KStream, KTable, KGroupedStream, KGroupedTable, SessionWindowedKStream, TimeWindowedKStream.  2. Also found a couple of overlooked bugs while working on them:  2.a) In KTable.filter / mapValues without the additional parameter indicating the materialized stores, originally we will not materialize the store. After KIP-182 we mistakenly diverge the semantics: for KTable.mapValues it is still the case, for KTable.filter we will always materialize.  2.b) In XXStream/Table.reduce/count, we used to try to reuse the serdes since their types are pre-known (for `reduce` it is the same types for both key / value, for `count` it is the same types for key, and `Long` for value). This was somehow lost in the past refactoring.  2.c) We are enforcing to cast a `Serde` to `Serde` for XXStream / Table.aggregate, for which the returned value type is NOT known, such the enforced casting should not be applied and we should require users to provide us the value serde if they believe the default ones are not applicable.  2.d) Whenever we are creating a new `MaterializedInternal` we are effectively incrementing the suffix index for the store / processor-node names. However in some places this `MaterializedInternal` is only used for validation, so the resulted processor-node / store suffix is not monotonic.   ### Committer Checklist (excluded from commit message) - [ ] Verify design and implementation  - [ ] Verify test coverage and CI build status - [ ] Verify documentation (including upgrade notes)","closed","streams,","guozhangwang","2018-04-24T06:23:42Z","2020-04-24T23:57:12Z"
"","4533","MINOR: Bump version to 2.0.0-SNAPSHOT","I proposed last year that the June/July release should be 2.0.0 to allow us to: - Bump the minimum Java version to 8 - Remove the deprecated Scala clients  ### Committer Checklist (excluded from commit message) - [ ] Verify design and implementation  - [ ] Verify test coverage and CI build status - [ ] Verify documentation (including upgrade notes)","closed","","ijuma","2018-02-06T20:48:09Z","2018-02-06T20:51:17Z"
"","4804","MINOR: Bump version to 2.0.0-SNAPSHOT","I proposed last year that the June/July release should be 2.0.0 to allow us to:  * Bump the minimum Java version to 8 * Remove the deprecated Scala clients  ### Committer Checklist (excluded from commit message) - [ ] Verify design and implementation  - [ ] Verify test coverage and CI build status - [ ] Verify documentation (including upgrade notes)","closed","","ijuma","2018-03-31T02:58:28Z","2018-09-11T06:47:26Z"
"","4958","Minor: Empty list returned by poll() destroys the source task when assert is enabled","I noticed this issue when running the embedded connectors. There is a assert in SourceRecordWriteCounter. ```         public SourceRecordWriteCounter(int batchSize, SourceTaskMetricsGroup metricsGroup) {             assert batchSize > 0;   // this one             assert metricsGroup != null;             this.batchSize = batchSize;             counter = batchSize;             this.metricsGroup = metricsGroup;         } ``` Hence, the empty list will cease the source task. By contrast, empty list is not a issue in production since the assert is usually disabled in production. It seems to me making the behavior consistent is necessary. A simple fix is to remove the assert. Or empty list should be handled as null list. I prefer later since both of them mean ""no data can be processed"".  ### Committer Checklist (excluded from commit message) - [ ] Verify design and implementation  - [ ] Verify test coverage and CI build status - [ ] Verify documentation (including upgrade notes)","closed","connect,","chia7712","2018-05-02T16:12:35Z","2020-04-30T08:05:35Z"
