"#","No","Issue Title","Issue Details","State","Labels","User name","created","Updated"
"","9108","KAFKA-9273: Extract testShouldAutoShutdownOnIncompleteMetadata from S…","…treamTableJoinIntegrationTest into its own test  The main goal is to remove usage of embedded broker (EmbeddedKafkaCluster) in AbstractJoinIntegrationTest and its subclasses. This is because the tests under this class are no longer using the embedded broker, except for two. testShouldAutoShutdownOnIncompleteMetadata is one of such tests. Furthermore, this test does not actually perfom stream-table join; it is testing an edge case of joining with a non-existent topic, so it should be in a separate test.  Testing strategy: run existing unit and integration test  @bbejeck   ### Committer Checklist (excluded from commit message) - [ ] Verify design and implementation  - [ ] Verify test coverage and CI build status - [ ] Verify documentation (including upgrade notes)","closed","streams,","albert02lowis","2020-07-31T04:35:15Z","2020-08-16T06:06:21Z"
"","9236","MINOR: Log warn message with details when there's kerberos login issue","…though we will still retry  Currently, we just capture the exception and retry later, we can't figure out what happened at runtime, it would be helpful to log a warn message with details.  *Summary of testing strategy (including rationale) for the feature or bug fix. Unit and/or integration tests are expected for any behaviour change and system tests should be considered for larger changes.* Minor logging change, so no extra test is required.   ### Committer Checklist (excluded from commit message) - [ ] Verify design and implementation  - [ ] Verify test coverage and CI build status - [ ] Verify documentation (including upgrade notes)","closed","","cnZach","2020-09-01T07:41:53Z","2020-09-19T13:31:35Z"
"","9235","KAFKA-10449: Add some important parameter desc in connect-distributed.properties","…rties.  *More detailed description of your change, if necessary. The PR title and PR message become the squashed commit message, so use a separate comment to ping reviewers.*  *Summary of testing strategy (including rationale) for the feature or bug fix. Unit and/or integration tests are expected for any behaviour change and system tests should be considered for larger changes.*  ### Committer Checklist (excluded from commit message) - [ ] Verify design and implementation  - [ ] Verify test coverage and CI build status - [ ] Verify documentation (including upgrade notes)","closed","connect,","tinawenqiao","2020-08-31T21:56:01Z","2021-02-26T11:02:44Z"
"","8784","KAFKA-9788: Use distinct names for transaction and group load time se…","…nsors  Sensor objects are stored in the Kafka metrics registry and keyed by name. If a new sensor is created with the same name as an existing one, the existing one is returned rather than a new object being created. The partition load time sensors for the transaction and group coordinators used the same name, so data recorded to either was stored in the same object. This meant that the metrics values for both metrics were identical and consisted of the combined data. This patch changes the names to be distinct so that the data will be stored in separate Sensor objects.  *More detailed description of your change, if necessary. The PR title and PR message become the squashed commit message, so use a separate comment to ping reviewers.*  *Summary of testing strategy (including rationale) for the feature or bug fix. Unit and/or integration tests are expected for any behaviour change and system tests should be considered for larger changes.*  ### Committer Checklist (excluded from commit message) - [ ] Verify design and implementation  - [ ] Verify test coverage and CI build status - [ ] Verify documentation (including upgrade notes)","closed","","bob-barrett","2020-06-02T16:57:44Z","2020-06-04T00:53:31Z"
"","8543","[KAFKA-9826] Handle an unaligned first dirty offset during log cleani…","…ng. (#8469)  In KAFKA-9826, a log whose first dirty offset was past the start of the active segment and past the last cleaned point resulted in an endless cycle of picking the segment to clean and discarding it. Though this didn't interfere with cleaning other log segments, it kept the log cleaner thread continuously busy (potentially wasting CPU and impacting other running threads) and filled the logs with lots of extraneous messages.  This was determined to be because the active segment was getting mistakenly picked for cleaning, and because the logSegments code handles (start == end) cases only for (start, end) on a segment boundary: the intent is to return a null list, but if they're not on a segment boundary, the routine returns that segment.  This fix has two parts:  It changes logSegments to handle start==end by returning an empty List always.  It changes the definition of calculateCleanableBytes to not consider anything past the UncleanableOffset; previously, it would potentially shift the UncleanableOffset to match the firstDirtyOffset even if the firstDirtyOffset was past the firstUncleanableOffset. This has no real effect now in the context of the fix for (1) but it makes the code read more like the model that the code is attempting to follow.  These changes require modifications to a few test cases that handled this particular test case; they were introduced in the context of KAFKA-8764. Those situations are now handled elsewhere in code, but the tests themselves allowed a DirtyOffset in the active segment, and expected an active segment to be selected for cleaning.  Reviewer: Jun Rao   *More detailed description of your change, if necessary. The PR title and PR message become the squashed commit message, so use a separate comment to ping reviewers.*  *Summary of testing strategy (including rationale) for the feature or bug fix. Unit and/or integration tests are expected for any behaviour change and system tests should be considered for larger changes.*  ### Committer Checklist (excluded from commit message) - [ ] Verify design and implementation  - [ ] Verify test coverage and CI build status - [ ] Verify documentation (including upgrade notes)","closed","","steverod","2020-04-24T01:12:54Z","2020-04-29T18:10:13Z"
"","8542","[KAFKA-9826] Handle an unaligned first dirty offset during log cleani…","…ng. (#8469)  In KAFKA-9826, a log whose first dirty offset was past the start of the active segment and past the last cleaned point resulted in an endless cycle of picking the segment to clean and discarding it. Though this didn't interfere with cleaning other log segments, it kept the log cleaner thread continuously busy (potentially wasting CPU and impacting other running threads) and filled the logs with lots of extraneous messages.  This was determined to be because the active segment was getting mistakenly picked for cleaning, and because the logSegments code handles (start == end) cases only for (start, end) on a segment boundary: the intent is to return a null list, but if they're not on a segment boundary, the routine returns that segment.  This fix has two parts:  It changes logSegments to handle start==end by returning an empty List always.  It changes the definition of calculateCleanableBytes to not consider anything past the UncleanableOffset; previously, it would potentially shift the UncleanableOffset to match the firstDirtyOffset even if the firstDirtyOffset was past the firstUncleanableOffset. This has no real effect now in the context of the fix for (1) but it makes the code read more like the model that the code is attempting to follow.  These changes require modifications to a few test cases that handled this particular test case; they were introduced in the context of KAFKA-8764. Those situations are now handled elsewhere in code, but the tests themselves allowed a DirtyOffset in the active segment, and expected an active segment to be selected for cleaning.  Reviewer: Jun Rao   *More detailed description of your change, if necessary. The PR title and PR message become the squashed commit message, so use a separate comment to ping reviewers.*  *Summary of testing strategy (including rationale) for the feature or bug fix. Unit and/or integration tests are expected for any behaviour change and system tests should be considered for larger changes.*  ### Committer Checklist (excluded from commit message) - [ ] Verify design and implementation  - [ ] Verify test coverage and CI build status - [ ] Verify documentation (including upgrade notes)","closed","","steverod","2020-04-24T01:11:50Z","2020-04-29T22:15:58Z"
"","9306","KAFKA-10477: Enabling the same behavior of NULL JsonNodeType to MISSI…","…NG JsonNodeType in JsonConverter.  From v2.10.0 onwards, in jackson lib, ObjectMapper.readTree(input) started to return JsonNode of type MISSING for empty input, as mentioned in the issue: https://github.com/FasterXML/jackson-databind/issues/2211.  This caused to throw a `DataException[""Unknown schema type: null""]` when an empty message key was parsed to be converted to Connect format via JsonConverter. The `schemaType` for `MISSING` type of JsonNode was returned as null, which resulted in this exception.    As part of this PR, made changes in JsonParser to incorporate the Jackson's ObjectMapper treatment of empty input from v2.10.0 onwards. Treating MISSING JsonNodeType in a similar fashion as that of NULL JsonNodeType. Added a unit test for this.  Related Jira ticket captures further details: https://issues.apache.org/jira/browse/KAFKA-10477  All unit tests passed locally.   ### Committer Checklist (excluded from commit message) - [ ] Verify design and implementation  - [ ] Verify test coverage and CI build status - [ ] Verify documentation (including upgrade notes)","closed","connect,","shaikzakiriitm","2020-09-18T18:22:21Z","2020-10-02T14:21:12Z"
"","9122","KAFKA-10314: KafkaStorageException on reassignment when offline log d…","…irectories exist  Make sure that we set the isNew field in LeaderAndIsrRequest correctly for brokers that gets added to the replica set on reassignment.  This is tested by creating a variant of ControllerIntergationTest.testPartitionReassignment() that makes one of the log directories on the target broker offline before initiating the reassignment. Without the change to the way isNew is set, this fails after a timeout. With the change, it succeeds.  To facilitate calling causeLogDirFailure() both from ControllerIntegrationTest and LogDirFailureTest, the method was moved to TestUtils along with the other helper methods that deals with interacting with KafkaServer instances for test cases.  *More detailed description of your change, if necessary. The PR title and PR message become the squashed commit message, so use a separate comment to ping reviewers.*  *Summary of testing strategy (including rationale) for the feature or bug fix. Unit and/or integration tests are expected for any behaviour change and system tests should be considered for larger changes.*  ### Committer Checklist (excluded from commit message) - [ ] Verify design and implementation  - [ ] Verify test coverage and CI build status - [ ] Verify documentation (including upgrade notes)","closed","","nresare","2020-08-04T11:26:09Z","2020-09-04T15:34:32Z"
"","8753","KAFKA-10043:Some parameters will be overwritten which was configured …","…in consumer.config  *More detailed description of your change, if necessary. The PR title and PR message become the squashed commit message, so use a separate comment to ping reviewers.*  *Summary of testing strategy (including rationale) for the feature or bug fix. Unit and/or integration tests are expected for any behaviour change and system tests should be considered for larger changes.*  ### Committer Checklist (excluded from commit message) - [ ] Verify design and implementation  - [ ] Verify test coverage and CI build status - [ ] Verify documentation (including upgrade notes)","closed","","SweetMojito","2020-05-29T08:47:47Z","2020-12-28T05:38:23Z"
"","9057","KAFKA-10299: Implementing Kafka Connect Hash SMT to allow for hashing…","… of message key or value.  *More detailed description of your change, if necessary. The PR title and PR message become the squashed commit message, so use a separate comment to ping reviewers.*  *Summary of testing strategy (including rationale) for the feature or bug fix. Unit and/or integration tests are expected for any behaviour change and system tests should be considered for larger changes.*  ### Committer Checklist (excluded from commit message) - [ ] Verify design and implementation  - [ ] Verify test coverage and CI build status - [ ] Verify documentation (including upgrade notes)","open","kip,","brbrown25","2020-07-22T17:52:54Z","2020-11-05T12:45:55Z"
"","9188","break when dst is full so that unwrap isn't called when appreadbuffer…","… may have data  There are a couple of different situations which can result in BUFFER_OVERFLOW on read with the current implementation, due to the while loop structure (such as TLS compression with identical buffer sizes, or buffers sizes that differ to optimize modes where the cipher text is larger than the plain text.)  The JDK documentation indicates that a buffer of getApplicationBufferSize() bytes will be enough for a single unwrap operation, but the SslTransportLayer loop may call unwrap with an application buffer which isn't empty.  The current implementation will check dst for space and then move data from the application buffer.  It will then continue the loop and may try to unwrap() again without verifying that there are getApplicationBufferSize() bytes free in the application buffer. If, instead, the loop moves data into dst, and then breaks the loop if dst is full, then unwrap() should never be called with data in the application buffer.","open","","Spatterjaaay","2020-08-17T01:47:26Z","2022-07-07T19:49:11Z"
"","9018","Performance degradation while fetching a key from a single partition","WrappingStoreProvider does not take into account withPartition parameter and always return all existing stores, thus causing significant performance degradation to the caller, in case state store has many partitions.  https://issues.apache.org/jira/browse/KAFKA-10271","closed","","dima5rr","2020-07-14T14:48:10Z","2020-07-14T15:03:52Z"
"","8967","[WIP] KAFKA-6520: Add DISCONNECTED state to Kafka Streams","Work in progress,  appreciate any feedback on my initial approach.   Adding a disconnect status to Kafka streams. This is achieved by introducing by recording fetch disconnectedExceptions in Fetcher and then measuring them through 2 new metrics _fetchRequestSuccessPercent_ and _fetchRequestFailurePercent_. Currently when the percentage of failed fetches is above an arbitrary threshold we transition the streamThread to a disconnected state. Then when percentage of failed fetches dips below another arbitrary threshold we transition the streamThread to it's previous state.   If my approach is satisfactory, I'll start writing tests.    ### Committer Checklist (excluded from commit message) - [ ] Verify design and implementation  - [ ] Verify test coverage and CI build status - [ ] Verify documentation (including upgrade notes)","open","kip,","VinceMu","2020-07-01T14:46:56Z","2021-01-13T01:02:14Z"
"","8872","Fix log message for transition from standby to active","Without this fix the log message is  ```  task [0_2] Transitioning state manager for ACTIVE task 0_2 to ACTIVE  ``` but it should probably be  ``` task [0_2] Transitioning state manager for STANDBY task 0_2 to ACTIVE  ```  ### Committer Checklist (excluded from commit message) - [ ] Verify design and implementation  - [ ] Verify test coverage and CI build status - [ ] Verify documentation (including upgrade notes)","closed","","cadonna","2020-06-15T12:24:58Z","2020-07-29T08:03:25Z"
"","8983","KAFKA-8398: Prevent NPE in `forceUnmap`","Without this change, we would catch the NPE and log it. This was misleading and could cause excessive log volume.  The NPE can happen after `AlterReplicaLogDirs` completes successfully and when unmapping older regions. Example stacktrace:  ```text [2019-05-20 14:08:13,999] ERROR Error unmapping index /tmp/kafka-logs/test-0.567a0d8ff88b45ab95794020d0b2e66f-delete/00000000000000000000.index (kafka.log.OffsetIndex) java.lang.NullPointerException at org.apache.kafka.common.utils.MappedByteBuffers.unmap(MappedByteBuffers.java:73) at kafka.log.AbstractIndex.forceUnmap(AbstractIndex.scala:318) at kafka.log.AbstractIndex.safeForceUnmap(AbstractIndex.scala:308) at kafka.log.AbstractIndex.$anonfun$closeHandler$1(AbstractIndex.scala:257) at scala.runtime.java8.JFunction0$mcV$sp.apply(JFunction0$mcV$sp.java:23) at kafka.utils.CoreUtils$.inLock(CoreUtils.scala:251) at kafka.log.AbstractIndex.closeHandler(AbstractIndex.scala:257) at kafka.log.AbstractIndex.deleteIfExists(AbstractIndex.scala:226) at kafka.log.LogSegment.$anonfun$deleteIfExists$6(LogSegment.scala:597) at kafka.log.LogSegment.delete$1(LogSegment.scala:585) at kafka.log.LogSegment.$anonfun$deleteIfExists$5(LogSegment.scala:597) at kafka.utils.CoreUtils$.$anonfun$tryAll$1(CoreUtils.scala:115) at kafka.utils.CoreUtils$.$anonfun$tryAll$1$adapted(CoreUtils.scala:114) at scala.collection.immutable.List.foreach(List.scala:392) at kafka.utils.CoreUtils$.tryAll(CoreUtils.scala:114) at kafka.log.LogSegment.deleteIfExists(LogSegment.scala:599) at kafka.log.Log.$anonfun$delete$3(Log.scala:1762) at kafka.log.Log.$anonfun$delete$3$adapted(Log.scala:1762) at scala.collection.Iterator.foreach(Iterator.scala:941) at scala.collection.Iterator.foreach$(Iterator.scala:941) at scala.collection.AbstractIterator.foreach(Iterator.scala:1429) at scala.collection.IterableLike.foreach(IterableLike.scala:74) at scala.collection.IterableLike.foreach$(IterableLike.scala:73) at scala.collection.AbstractIterable.foreach(Iterable.scala:56) at kafka.log.Log.$anonfun$delete$2(Log.scala:1762) at scala.runtime.java8.JFunction0$mcV$sp.apply(JFunction0$mcV$sp.java:23) at kafka.log.Log.maybeHandleIOException(Log.scala:2013) at kafka.log.Log.delete(Log.scala:1759) at kafka.log.LogManager.deleteLogs(LogManager.scala:761) at kafka.log.LogManager.$anonfun$deleteLogs$6(LogManager.scala:775) at kafka.utils.KafkaScheduler.$anonfun$schedule$2(KafkaScheduler.scala:114) at kafka.utils.CoreUtils$$anon$1.run(CoreUtils.scala:63) at java.util.concurrent.Executors$RunnableAdapter.call(Executors.java:511) at java.util.concurrent.FutureTask.run(FutureTask.java:266) at java.util.concurrent.ScheduledThreadPoolExecutor$ScheduledFutureTask.access$201(ScheduledThreadPoolExecutor.java:180) at java.util.concurrent.ScheduledThreadPoolExecutor$ScheduledFutureTask.run(ScheduledThreadPoolExecutor.java:293) at java.util.concurrent.ThreadPoolExecutor.runWorker(ThreadPoolExecutor.java:1149) at java.util.concurrent.ThreadPoolExecutor$Worker.run(ThreadPoolExecutor.java:624) at java.lang.Thread.run(Thread.java:748) ```  ### Committer Checklist (excluded from commit message) - [ ] Verify design and implementation  - [ ] Verify test coverage and CI build status - [ ] Verify documentation (including upgrade notes)","closed","","ijuma","2020-07-06T00:57:31Z","2020-07-06T21:51:42Z"
"","8687","MINOR: updated MacOS compatibility statement for RocksDB","With https://issues.apache.org/jira/browse/KAFKA-9225 Kafka Streams 2.6.0 requires MacOS 10.15.","closed","docs,","mjsax","2020-05-18T17:25:59Z","2020-05-18T19:43:40Z"
"","9398","MINOR update comments and docs to be gender-neutral","While this is not technically part of KIP-629, I believe this makes our codebase more inclusive as well.  cc @gwenshap","closed","","xvrl","2020-10-08T23:16:54Z","2020-10-13T19:48:44Z"
"","9068","MINOR: INFO log4j when request re-join","While debugging a rebalance scenario I found that inside rejoinNeededOrPending when we trigger rebalance due to metadata or subscription changes it is not logged, and hence it's actually a bit tricky to find out the reason of the triggered rebalance. I'm adding two INFO log4j entries to fill in the gap.  Other requestRejoin() calls are already covered.  ### Committer Checklist (excluded from commit message) - [ ] Verify design and implementation  - [ ] Verify test coverage and CI build status - [ ] Verify documentation (including upgrade notes)","closed","","guozhangwang","2020-07-23T23:33:43Z","2020-07-26T23:45:17Z"
"","8994","KAFKA-10247: Correctly reset state when task is corrupted","When we detect a task as corrupted, we need to not only close, clean up, and recover the local store, but we also need to reset the consumer to the last committed position so that after recovery we can start processing from the correct position.  We also need to detect such repaired tasks in the StreamThread processing loop so they can be re-initialized and recovered, even when the thread is already in RUNNING.  Also, I fixed a bug in which we would incorrectly always consider a task as corrupted when it contains both persistent and in-memory stores.  ### Committer Checklist (excluded from commit message) - [ ] Verify design and implementation  - [ ] Verify test coverage and CI build status - [ ] Verify documentation (including upgrade notes)","closed","streams,","vvcephei","2020-07-08T17:43:12Z","2020-07-11T19:31:38Z"
"","9407","KAFKA-10611: Merge log error to avoid double error","When using an error tracking system, 2 errors means 2 different alerts. It's best to group the logs and have one error with all information.  For example when using with [Sentry](https://sentry.io/welcome/), this double line of log.error will create 2 different Issues. One can merge the issues but it will be simpler to have a single error log line  I feel this is a trivial change, so following [Contribution rules](https://cwiki.apache.org/confluence/display/KAFKA/Contributing+Code+Changes#ContributingCodeChanges-PullRequest) I didn't create a Jira ticket but simply open a pull request  If I'm wrong, please feel free to indicate me the correct process.","closed","connect,","bmaggi","2020-10-09T15:33:34Z","2020-10-16T05:38:12Z"
"","9123","MINOR: optimize fetchablePartitions check by performing cheap check first","When the consumer fetches a lot of partitions at once the isAvailable check can become expensive due to a high number of contains check. We might as well perform the isFetchable check first as this is clearly much cheaper.  This will help most with partitions that are paused or are otherwise not in a state where they are fetchable.","closed","","lbradstreet","2020-08-04T16:55:36Z","2020-08-07T17:55:41Z"
"","8536","KAFKA-9883: Add better error message when REST API forwards a request and leader is not known","When the Connect worker forwards a REST API request to the leader, it might get back a `RequestTargetException` that suggests the worker should forward the request to a different worker. This can happen when the leader changes, and the worker that receives the original request forwards the request to the worker that it thinks is the current leader, but that worker is not the current leader. In this case. In most cases, the worker that received the forwarded request includes the URL of the current leader, but it is possible (albeit rare) that the worker doesn’t know the current leader and will include a null leader URL in the resulting `RequestTargetException`.  When this rare case happens, the user gets a null pointer exception in their response and the NPE is logged. Instead, the worker should catch this condition and provide a more useful error message that is similar to other existing error messages that might occur.  Added a unit test that verifies this corner case is caught and this particular NPE does not occur.  I recommend this be backported a few branches, as is typical for bug fixes.  ### Committer Checklist (excluded from commit message) - [ ] Verify design and implementation  - [ ] Verify test coverage and CI build status - [ ] Verify documentation (including upgrade notes)","closed","connect,","rhauch","2020-04-22T19:54:20Z","2020-04-23T18:37:46Z"
"","9389","KAFKA-7334: Suggest changing config for state.dir in case of FileNotFoundException","When state.dir is left at default configuration, there is a chance that certain files under the state directory are cleaned by OS since the default dir starts with /tmp/kafka-streams.  I've added suggestion to change state.dir config in the exception message. (https://issues.apache.org/jira/browse/KAFKA-7334)","closed","","voffcheg109","2020-10-07T17:35:24Z","2020-10-07T17:41:46Z"
"","9380","KAFKA-7334: Suggest changing config for state.dir in case of FileNotF…","When state.dir is left at default configuration, there is a chance that certain files under the state directory are cleaned by OS since the default dir starts with /tmp/kafka-streams.  I've added suggestion to change state.dir config in the exception message. (https://issues.apache.org/jira/browse/KAFKA-7334)","closed","streams,","voffcheg109","2020-10-06T11:21:52Z","2020-10-09T07:26:34Z"
"","8675","KAFKA-10004: ConfigCommand fails to find default broker configs without ZK","When running `bin/kafka-configs.sh --describe --bootstrap-server localhost:9092 --entity-type brokers` the output will be: Dynamic configs for broker 0 are: .... Dynamic configs for broker  are: **The entity name for brokers must be a valid integer broker id, found: **  I found it's because we set the default entity name for broker as ``, which should be empty string """". Also add the missing tests for the describe broker without entity name case.  ### Committer Checklist (excluded from commit message) - [ ] Verify design and implementation  - [ ] Verify test coverage and CI build status - [ ] Verify documentation (including upgrade notes)","closed","","showuon","2020-05-15T14:03:22Z","2020-05-22T01:22:43Z"
