"#","No","Issue Title","Issue Details","State","Labels","User name","created","Updated"
"","4650","KAFKA-6611: PART I, Use JMXTool in SimpleBenchmark","1. Use JmxMixin for SimpleBenchmark (will remove the self reporting in #4744), only when loading phase is false (i.e. we are in fact starting the streams app).  2. Reported the full jmx reported metrics in log files, and in the returned data only return the max values: this is because we want to skip the warming up and cooling down periods that will have lower rate numbers, while max represents the actual rate at full speed.  3. Incorporates two other improves to JMXTool: https://github.com/apache/kafka/pull/1241 and https://github.com/apache/kafka/pull/2950   ### Committer Checklist (excluded from commit message) - [ ] Verify design and implementation  - [ ] Verify test coverage and CI build status - [ ] Verify documentation (including upgrade notes)","closed","","guozhangwang","2018-03-06T01:47:24Z","2020-04-24T23:57:00Z"
"","4854","KAFKA-6611, PART II: Improve Streams SimpleBenchmark","1. SimpleBenchmark:      1.a Do not rely on manual num.records / bytes collection on atomic integers.     1.b Rely on config files for num.threads, bootstrap.servers, etc.     1.c Add parameters for key skewness and value size.     1.d Refactor the tests for loading phase, adding tumbling-windowed count.     1.e For consumer / consumeproduce, collect metrics on consumer instead.     1.f Force stop the test after 3 minutes, this is based on empirical numbers of 10M records.  2. Other tests: use config for kafka bootstrap servers.  3. streams_simple_benchmark.py: only use scale 1 for system test, remove yahoo from benchmark tests.  Note that the JMX based metrics is more accurate than the manually collected metrics. For example:  ``` Module: kafkatest.benchmarks.streams.streams_simple_benchmark_test Class:  StreamsSimpleBenchmarkTest Method: test_simple_benchmark Arguments: {   ""scale"": 3,   ""test"": ""streamcount"" } ----  {   ""Streams Count Performance [records/latency/rec-sec/MB-sec counted]0"": "" 3691724/180042/20504.79332600171/20.64996886468678\n"",   ""Streams Count Performance [records/latency/rec-sec/MB-sec counted]1"": "" 3337273/180037/18536.595255419717/18.667835797999594\n"",   ""Streams Count Performance [records/latency/rec-sec/MB-sec counted]2"": "" 2971003/180029/16502.913419504635/16.61975533580484\n"",   ""jmx-avg0"": {     ""kafka.streams:type=stream-metrics,client-id=simple-benchmark-StreamThread-1:commit-latency-avg"": 473.9851851851854,     ""kafka.streams:type=stream-metrics,client-id=simple-benchmark-StreamThread-1:commit-rate"": 0.03802973633453574,     ""kafka.streams:type=stream-metrics,client-id=simple-benchmark-StreamThread-1:poll-latency-avg"": 1.6337178935425791,     ""kafka.streams:type=stream-metrics,client-id=simple-benchmark-StreamThread-1:poll-rate"": 41.49027662118575,     ""kafka.streams:type=stream-metrics,client-id=simple-benchmark-StreamThread-1:process-latency-avg"": 0.0021335594038200878,     ""kafka.streams:type=stream-metrics,client-id=simple-benchmark-StreamThread-1:process-rate"": 21042.80038005481   },   ""jmx-avg1"": {     ""kafka.streams:type=stream-metrics,client-id=simple-benchmark-StreamThread-1:commit-latency-avg"": 354.0805555555556,     ""kafka.streams:type=stream-metrics,client-id=simple-benchmark-StreamThread-1:commit-rate"": 0.030462783608341253,     ""kafka.streams:type=stream-metrics,client-id=simple-benchmark-StreamThread-1:poll-latency-avg"": 2.2233941132541286,     ""kafka.streams:type=stream-metrics,client-id=simple-benchmark-StreamThread-1:poll-rate"": 35.82136735561879,     ""kafka.streams:type=stream-metrics,client-id=simple-benchmark-StreamThread-1:process-latency-avg"": 0.002402570337120884,     ""kafka.streams:type=stream-metrics,client-id=simple-benchmark-StreamThread-1:process-rate"": 19100.53692641491   },   ""jmx-avg2"": {     ""kafka.streams:type=stream-metrics,client-id=simple-benchmark-StreamThread-1:commit-latency-avg"": 365.85555555555555,     ""kafka.streams:type=stream-metrics,client-id=simple-benchmark-StreamThread-1:commit-rate"": 0.03052173041795845,     ""kafka.streams:type=stream-metrics,client-id=simple-benchmark-StreamThread-1:poll-latency-avg"": 1.1700956516025365,     ""kafka.streams:type=stream-metrics,client-id=simple-benchmark-StreamThread-1:poll-rate"": 28.06739395694291,     ""kafka.streams:type=stream-metrics,client-id=simple-benchmark-StreamThread-1:process-latency-avg"": 0.0016847557478484937,     ""kafka.streams:type=stream-metrics,client-id=simple-benchmark-StreamThread-1:process-rate"": 15594.917035789254   },   ""jmx-max0"": {     ""kafka.streams:type=stream-metrics,client-id=simple-benchmark-StreamThread-1:commit-latency-avg"": 547.0,     ""kafka.streams:type=stream-metrics,client-id=simple-benchmark-StreamThread-1:commit-rate"": 0.06657567990413102,     ""kafka.streams:type=stream-metrics,client-id=simple-benchmark-StreamThread-1:poll-latency-avg"": 13.04,     ""kafka.streams:type=stream-metrics,client-id=simple-benchmark-StreamThread-1:poll-rate"": 196.4955857339561,     ""kafka.streams:type=stream-metrics,client-id=simple-benchmark-StreamThread-1:process-latency-avg"": 0.04672288495817908,     ""kafka.streams:type=stream-metrics,client-id=simple-benchmark-StreamThread-1:process-rate"": 99520.53241178217   },   ""jmx-max1"": {     ""kafka.streams:type=stream-metrics,client-id=simple-benchmark-StreamThread-1:commit-latency-avg"": 653.0,     ""kafka.streams:type=stream-metrics,client-id=simple-benchmark-StreamThread-1:commit-rate"": 0.065242211710977,     ""kafka.streams:type=stream-metrics,client-id=simple-benchmark-StreamThread-1:poll-latency-avg"": 13.909090909090908,     ""kafka.streams:type=stream-metrics,client-id=simple-benchmark-StreamThread-1:poll-rate"": 156.47243937161267,     ""kafka.streams:type=stream-metrics,client-id=simple-benchmark-StreamThread-1:process-latency-avg"": 0.08381330685203575,     ""kafka.streams:type=stream-metrics,client-id=simple-benchmark-StreamThread-1:process-rate"": 83263.21836209696   },   ""jmx-max2"": {     ""kafka.streams:type=stream-metrics,client-id=simple-benchmark-StreamThread-1:commit-latency-avg"": 632.0,     ""kafka.streams:type=stream-metrics,client-id=simple-benchmark-StreamThread-1:commit-rate"": 0.06459531038046638,     ""kafka.streams:type=stream-metrics,client-id=simple-benchmark-StreamThread-1:poll-latency-avg"": 8.25,     ""kafka.streams:type=stream-metrics,client-id=simple-benchmark-StreamThread-1:poll-rate"": 173.80159786950733,     ""kafka.streams:type=stream-metrics,client-id=simple-benchmark-StreamThread-1:process-latency-avg"": 0.07433900760593988,     ""kafka.streams:type=stream-metrics,client-id=simple-benchmark-StreamThread-1:process-rate"": 97828.82822902796   } }  ```   ### Committer Checklist (excluded from commit message) - [ ] Verify design and implementation  - [ ] Verify test coverage and CI build status - [ ] Verify documentation (including upgrade notes)","closed","","guozhangwang","2018-04-11T17:57:58Z","2020-04-24T23:51:29Z"
"","4744","KAFKA-6611, PART II: Improve Streams SimpleBenchmark","1. SimpleBenchmark:      1.a Do not rely on manual num.records / bytes collection on atomic integers.     1.b Rely on config files for num.threads, bootstrap.servers, etc.     1.c Add parameters for key skewness and value size.     1.d Refactor the tests for loading phase, adding tumbling-windowed count.     1.e For consumer / consumeproduce, collect metrics on consumer instead.     1.f Force stop the test after 3 minutes, this is based on empirical numbers of 10M records.  2. Other tests: use config for kafka bootstrap servers.  3. streams_simple_benchmark.py: only use scale 1 for system test, remove yahoo from benchmark tests.  Note that the JMX based metrics is more accurate than the manually collected metrics. For example:  ``` Module: kafkatest.benchmarks.streams.streams_simple_benchmark_test Class:  StreamsSimpleBenchmarkTest Method: test_simple_benchmark Arguments: {   ""scale"": 3,   ""test"": ""streamcount"" } ----  {   ""Streams Count Performance [records/latency/rec-sec/MB-sec counted]0"": "" 3691724/180042/20504.79332600171/20.64996886468678\n"",   ""Streams Count Performance [records/latency/rec-sec/MB-sec counted]1"": "" 3337273/180037/18536.595255419717/18.667835797999594\n"",   ""Streams Count Performance [records/latency/rec-sec/MB-sec counted]2"": "" 2971003/180029/16502.913419504635/16.61975533580484\n"",   ""jmx-avg0"": {     ""kafka.streams:type=stream-metrics,client-id=simple-benchmark-StreamThread-1:commit-latency-avg"": 473.9851851851854,     ""kafka.streams:type=stream-metrics,client-id=simple-benchmark-StreamThread-1:commit-rate"": 0.03802973633453574,     ""kafka.streams:type=stream-metrics,client-id=simple-benchmark-StreamThread-1:poll-latency-avg"": 1.6337178935425791,     ""kafka.streams:type=stream-metrics,client-id=simple-benchmark-StreamThread-1:poll-rate"": 41.49027662118575,     ""kafka.streams:type=stream-metrics,client-id=simple-benchmark-StreamThread-1:process-latency-avg"": 0.0021335594038200878,     ""kafka.streams:type=stream-metrics,client-id=simple-benchmark-StreamThread-1:process-rate"": 21042.80038005481   },   ""jmx-avg1"": {     ""kafka.streams:type=stream-metrics,client-id=simple-benchmark-StreamThread-1:commit-latency-avg"": 354.0805555555556,     ""kafka.streams:type=stream-metrics,client-id=simple-benchmark-StreamThread-1:commit-rate"": 0.030462783608341253,     ""kafka.streams:type=stream-metrics,client-id=simple-benchmark-StreamThread-1:poll-latency-avg"": 2.2233941132541286,     ""kafka.streams:type=stream-metrics,client-id=simple-benchmark-StreamThread-1:poll-rate"": 35.82136735561879,     ""kafka.streams:type=stream-metrics,client-id=simple-benchmark-StreamThread-1:process-latency-avg"": 0.002402570337120884,     ""kafka.streams:type=stream-metrics,client-id=simple-benchmark-StreamThread-1:process-rate"": 19100.53692641491   },   ""jmx-avg2"": {     ""kafka.streams:type=stream-metrics,client-id=simple-benchmark-StreamThread-1:commit-latency-avg"": 365.85555555555555,     ""kafka.streams:type=stream-metrics,client-id=simple-benchmark-StreamThread-1:commit-rate"": 0.03052173041795845,     ""kafka.streams:type=stream-metrics,client-id=simple-benchmark-StreamThread-1:poll-latency-avg"": 1.1700956516025365,     ""kafka.streams:type=stream-metrics,client-id=simple-benchmark-StreamThread-1:poll-rate"": 28.06739395694291,     ""kafka.streams:type=stream-metrics,client-id=simple-benchmark-StreamThread-1:process-latency-avg"": 0.0016847557478484937,     ""kafka.streams:type=stream-metrics,client-id=simple-benchmark-StreamThread-1:process-rate"": 15594.917035789254   },   ""jmx-max0"": {     ""kafka.streams:type=stream-metrics,client-id=simple-benchmark-StreamThread-1:commit-latency-avg"": 547.0,     ""kafka.streams:type=stream-metrics,client-id=simple-benchmark-StreamThread-1:commit-rate"": 0.06657567990413102,     ""kafka.streams:type=stream-metrics,client-id=simple-benchmark-StreamThread-1:poll-latency-avg"": 13.04,     ""kafka.streams:type=stream-metrics,client-id=simple-benchmark-StreamThread-1:poll-rate"": 196.4955857339561,     ""kafka.streams:type=stream-metrics,client-id=simple-benchmark-StreamThread-1:process-latency-avg"": 0.04672288495817908,     ""kafka.streams:type=stream-metrics,client-id=simple-benchmark-StreamThread-1:process-rate"": 99520.53241178217   },   ""jmx-max1"": {     ""kafka.streams:type=stream-metrics,client-id=simple-benchmark-StreamThread-1:commit-latency-avg"": 653.0,     ""kafka.streams:type=stream-metrics,client-id=simple-benchmark-StreamThread-1:commit-rate"": 0.065242211710977,     ""kafka.streams:type=stream-metrics,client-id=simple-benchmark-StreamThread-1:poll-latency-avg"": 13.909090909090908,     ""kafka.streams:type=stream-metrics,client-id=simple-benchmark-StreamThread-1:poll-rate"": 156.47243937161267,     ""kafka.streams:type=stream-metrics,client-id=simple-benchmark-StreamThread-1:process-latency-avg"": 0.08381330685203575,     ""kafka.streams:type=stream-metrics,client-id=simple-benchmark-StreamThread-1:process-rate"": 83263.21836209696   },   ""jmx-max2"": {     ""kafka.streams:type=stream-metrics,client-id=simple-benchmark-StreamThread-1:commit-latency-avg"": 632.0,     ""kafka.streams:type=stream-metrics,client-id=simple-benchmark-StreamThread-1:commit-rate"": 0.06459531038046638,     ""kafka.streams:type=stream-metrics,client-id=simple-benchmark-StreamThread-1:poll-latency-avg"": 8.25,     ""kafka.streams:type=stream-metrics,client-id=simple-benchmark-StreamThread-1:poll-rate"": 173.80159786950733,     ""kafka.streams:type=stream-metrics,client-id=simple-benchmark-StreamThread-1:process-latency-avg"": 0.07433900760593988,     ""kafka.streams:type=stream-metrics,client-id=simple-benchmark-StreamThread-1:process-rate"": 97828.82822902796   } }  ```   ### Committer Checklist (excluded from commit message) - [ ] Verify design and implementation  - [ ] Verify test coverage and CI build status - [ ] Verify documentation (including upgrade notes)","closed","","guozhangwang","2018-03-21T00:11:40Z","2018-04-11T17:58:35Z"
"","5290","MINOR: Store metrics scope, total metrics","1. Rename metrics scope of rocksDB window and session stores; also modify the store metrics accordingly with guidance on its correlations to `metricsScope`.  2. Add the missing `total` metrics for per-thread, per-task, per-node and per-store sensors.  ### Committer Checklist (excluded from commit message) - [ ] Verify design and implementation  - [ ] Verify test coverage and CI build status - [ ] Verify documentation (including upgrade notes)","closed","streams,","guozhangwang","2018-06-25T22:06:39Z","2018-06-28T21:32:43Z"
"","4486","MINOR: Code refacotring in KTable-KTable Join","1. Rename KTableKTableJoin to KTableKTableInnerJoin. Also removed `abstract` from other joins. 2. Merge KTableKTableJoinValueGetter.java into KTableKTableInnerJoin. 3. Use set instead of arrays in the stores function, to avoid duplicate stores to be connected to processors.  ### Committer Checklist (excluded from commit message) - [ ] Verify design and implementation  - [ ] Verify test coverage and CI build status - [ ] Verify documentation (including upgrade notes)","closed","","guozhangwang","2018-01-29T19:41:18Z","2020-04-24T23:47:28Z"
"","4991","KAFKA-6813: Remove deprecated APIs in KIP-182, Part III","1. Remove TopologyBuilder, TopologyBuilderException, KStreamBuilder,  2. Completed the leftover work of https://issues.apache.org/jira/browse/KAFKA-5660, when we remove TopologyBuilderException.  3. Added MockStoreBuilder to replace MockStateStoreSupplier, remove all XXStoreSupplier except StateStoreSupplier as it is still referenced in the logical streams graph.  4. Minor: rename KStreamsFineGrainedAutoResetIntegrationTest.java to FineGrainedAutoResetIntegrationTest.java.  ### Committer Checklist (excluded from commit message) - [ ] Verify design and implementation  - [ ] Verify test coverage and CI build status - [ ] Verify documentation (including upgrade notes)","closed","streams,","guozhangwang","2018-05-09T23:33:11Z","2020-04-24T23:57:17Z"
"","4976","KAFKA-6813: Remove deprecated APIs in KIP-182, Part II","1. Remove the deprecated StateStoreSuppliers, and the corresponding Stores.create() functions and factories: only the base StateStoreSupplier and MockStoreSupplier were still preserved as they are needed by the deprecated TopologyBuilder and KStreamBuilder. Will remove them in a follow-up PR.  2. Add TopologyWrapper.java as the original InternalTopologyBuilderAccessor was removed, but I realized it is still needed as of now.  3. Minor: removed StateStoreTestUtils.java and inline its logic in its callers since now with StoreBuilder it is just a one-liner.  ### Committer Checklist (excluded from commit message) - [ ] Verify design and implementation  - [ ] Verify test coverage and CI build status - [ ] Verify documentation (including upgrade notes)","closed","streams,","guozhangwang","2018-05-08T00:42:06Z","2020-04-24T23:57:16Z"
"","5382","KAFKA-3514: Remove min timestamp tracker","1. Remove MinTimestampTracker and its TimestampTracker interface. 2. In RecordQueue, keep track of the head record (deserialized) while put the rest raw bytes records in the fifo queue, the head record as well as the partition timestamp will be updated accordingly.  ### Committer Checklist (excluded from commit message) - [ ] Verify design and implementation  - [ ] Verify test coverage and CI build status - [ ] Verify documentation (including upgrade notes)","closed","","guozhangwang","2018-07-18T00:27:40Z","2018-07-19T15:06:30Z"
"","5428","KAFKA-3514: Part III, Refactor StreamThread main loop","1. Refactor the StreamThread main loop, in the following:  * Fetch from consumer and enqueue data to tasks. * Check if any tasks should be enforced process. * Loop over processable tasks and process them for N iterations, and then check for 1) commit, 2) punctuate, 3) need to call consumer.poll * Even if there is not data to process in this iteration, still need to check if commit / punctuate is needed * Finally, try update standby tasks.  2. Add an optimization to only commit when it is needed (i.e. at least some process() or punctuate() was triggered since last commit).  3. Found and fixed a ProducerFencedException scenario: producer.send() call would never throw a ProducerFencedException directly, but it may throw a KafkaException whose ""cause"" is a ProducerFencedException.  ### Committer Checklist (excluded from commit message) - [ ] Verify design and implementation  - [ ] Verify test coverage and CI build status - [ ] Verify documentation (including upgrade notes)","closed","streams,","guozhangwang","2018-07-26T23:22:45Z","2018-09-12T00:54:03Z"
"","5110","KAFKA-6562: (follow-up) Publish ""jackson-databind"" lib as provided scope dependency in clients maven artifact","1. jackson-databind library is mapped as a provided library by using maven plugin configuration-to-scope mapping feature. https://docs.gradle.org/current/javadoc/org/gradle/api/artifacts/maven/Conf2ScopeMappingContainer.html 2. Clients using default implementation of SASL/OAUTHBEARER mechanism must provide jackson-databind library to Kafka client runtime.   ### Committer Checklist (excluded from commit message) - [ ] Verify design and implementation  - [ ] Verify test coverage and CI build status - [ ] Verify documentation (including upgrade notes)","closed","","omkreddy","2018-05-31T19:35:39Z","2018-06-12T08:58:59Z"
"","5017","KAFKA-6729: Reuse source topics for source KTable's materialized store's changelog","1. In InternalTopologyBuilder#topicGroups, which is used in StreamsPartitionAssignor, look for book-kept `storeToChangelogTopic` map before creating a new internal changelog topics. In this way if the source KTable is created, its source topic stored in `storeToChangelogTopic` will be used.  2. Added unit test (confirmed that without 1) it will fail).  3. MINOR: removed TODOs that are related to removed KStreamBuilder.  4. MINOR: removed TODOs in StreamsBuilderTest util functions and replaced with TopologyWrapper.  5. MINOR: removed `StreamsBuilderTest#testFrom` as it is already covered by `TopologyTest#shouldNotAllowToAddSourcesWithSameName`, plus it requires `KStreamImpl.SOURCE_NAME` which should be a package private field of the `KStreamImpl`.  ### Committer Checklist (excluded from commit message) - [ ] Verify design and implementation  - [ ] Verify test coverage and CI build status - [ ] Verify documentation (including upgrade notes)","closed","","guozhangwang","2018-05-15T04:57:11Z","2020-04-24T23:57:22Z"
"","5398","KAFKA-3514: Part II, Choose tasks with data on all partitions to process","1. In each iteration, decide if a task is processable if all of its partitions contains data, so it can decide which record to process next.  1.a Add one exception that, if the task indeed have data on some but not all of its partitions, we only consider as not processable for some finite round of iterations.  1.b Add a task-level metric to record whenever we are forced to process a task that is only ""partially data available"", since it may leads to non-determinism.  2. Break the main loop on put-raw-data and process-them. Since now not all data put into the queue would be processed completely within a single iteration.  NOTE that within an iteration, if a task has exhausted one of its queue it will still be processed, since we only update `processable` list once in each iteration, I'm improving on this on the follow-up part III PR.  3. Found and fixed a bug in metrics recording: the taskName and sensorName parameters were exchanged.  4. Optimized task stream time computation again since our current partition stream time reasoning has been simplified.  5. Added unit tests.  ### Committer Checklist (excluded from commit message) - [ ] Verify design and implementation  - [ ] Verify test coverage and CI build status - [ ] Verify documentation (including upgrade notes)","closed","","guozhangwang","2018-07-19T22:12:32Z","2018-08-10T17:25:09Z"
"","4539","KAFKA-6501: Dynamic broker config tests updates and metrics fix","1. Handle listener-not-found in MetadataCache since this can occur when listeners are being updated. To avoid breaking clients, this is handled in the same way as broker-not-available so that clients retry 2. Set retries=1000 for listener reconfiguration tests to avoid transient failures when metadata cache has not been updated  3. Remove IdlePercent metric when Processor is deleted, add test 4. Reduce log segment size used during reconfiguration to avoid timeout while waiting for log rolling 5.Test markPartitionsForTruncation after fetcher thread resize  ### Committer Checklist (excluded from commit message) - [ ] Verify design and implementation  - [ ] Verify test coverage and CI build status - [ ] Verify documentation (including upgrade notes)","closed","","rajinisivaram","2018-02-07T14:51:38Z","2018-02-09T00:22:52Z"
"","4491","HOTFIX: Fix reset integration test hangs on busy wait","1. Found two root causes of the failure: a) appID is not set at constructor time and hence causing the condition method to fail, 2) class static properties are only populated once and hence when SSL tests are executed before non-SSL tests, the later will fail.  2. A bunch of log4j improvements along the debugging experience.  ### Committer Checklist (excluded from commit message) - [ ] Verify design and implementation  - [ ] Verify test coverage and CI build status - [ ] Verify documentation (including upgrade notes)","closed","","guozhangwang","2018-01-30T23:11:42Z","2020-04-24T23:47:52Z"
"","5136","KAFKA-6993: Fix defective documentations for KStream/KTable methods","1. Fix the documentation of following methods, e.g., making more detailed description for the overloaded methods:  	- KStream#join 	- KStream#leftJoin 	- KStream#outerJoin 	- KTable#filter 	- KTable#filterNot 	- KTable#mapValues 	- KTable#transformValues 	- KTable#join 	- KTable#leftJoin 	- KTable#outerJoin  2. (trivial) with possible new type -> with possibly new type.","closed","streams,","dongjinleekr","2018-06-05T07:44:33Z","2018-06-06T21:07:19Z"
"","4858","Bug Hotfix: consumer poll blocked & FetchResponse cast error","1. fix bug: consumer poll(timeout) blocked infinitely when no available bootstrap server 2. fix bug: FindCoordinatorResponse cannot be cast to FetchResponse","closed","","koqizhao","2018-04-12T06:58:59Z","2018-04-12T15:26:41Z"
"","5298","KAFKA-7101: Consider session store for windowed store default configs","1. extend `isWindowStore` to consider session store as well. 2. extend the existing unit test accordingly.  ### Committer Checklist (excluded from commit message) - [ ] Verify design and implementation  - [ ] Verify test coverage and CI build status - [ ] Verify documentation (including upgrade notes)","closed","streams,","guozhangwang","2018-06-26T21:32:19Z","2018-07-03T05:00:28Z"
"","5322","KAFKA-5037 Infinite loop if all input topics are unknown at startup","1. At the beginning of assign, we first check that all the non-repartition source topics are included in the metadata. If not, we log an error at the leader and set an error in the Assignment userData bytes, indicating that leader cannot complete assignment and the error code would indicate the root cause of it.  2. Upon receiving the assignment, if the error is not NONE the streams will shutdown itself with a log entry re-stating the root cause interpreted from the error code.  ### Committer Checklist (excluded from commit message) - [ ] Verify design and implementation  - [ ] Verify test coverage and CI build status - [ ] Verify documentation (including upgrade notes)","closed","","tedyu","2018-07-03T07:05:22Z","2018-07-20T00:00:17Z"
"","4684","KAFKA-6634: Delay starting new transaction in task.initializeTopology","1. As titled, not starting new transaction since during restoration producer would have not activity and hence may cause txn expiration. 1.a. Also delay starting new txn in resuming until initializing topology.  2. Fixed a minor bug, that when resuming process hits a migration exception, we should remove that task from the running list if possible.  ### Committer Checklist (excluded from commit message) - [ ] Verify design and implementation  - [ ] Verify test coverage and CI build status - [ ] Verify documentation (including upgrade notes)","closed","streams,","guozhangwang","2018-03-11T18:28:45Z","2020-04-24T23:49:04Z"
