"#","No","Issue Title","Issue Details","State","Labels","User name","created","Updated"
"","8927","KAFKA-10200: Fix testability of PAPI with windowed stores","It's currently not possible to unit-test custom processors that use windowed stores, because the provided windowed store implementations cast the context to InternalProcessorContext.  This change adds a public API example using windowed stores, and fixes the casts internally that would make that example fail previously.  ### Committer Checklist (excluded from commit message) - [ ] Verify design and implementation  - [ ] Verify test coverage and CI build status - [ ] Verify documentation (including upgrade notes)","closed","streams,","vvcephei","2020-06-25T16:34:26Z","2020-06-30T16:59:48Z"
"","8906","KAFKA-10190: To set replication throttling configs at broker entity-default","It looks to be a bug that Kafka broker's dynamic configs for replication, like follower.replication.throttled.rate, leader.replication.throttled.rate and replica.alter.log.dirs.io.max.bytes.per.second can only be set at specific broker id,  it doesn't take effect when they are set under entity-default via kafka-config command.","open","","jianjianjiao","2020-06-20T04:16:29Z","2021-08-04T13:34:18Z"
"","8506","Minor: avoid duplicate unwrapping when end of stream has been reached","It is impossible to complete handshake successfully when end of stream has been reached. We should catch the EOFException and then throw exception directly to save a bit cost of unwrapping.  ### Committer Checklist (excluded from commit message) - [ ] Verify design and implementation  - [ ] Verify test coverage and CI build status - [ ] Verify documentation (including upgrade notes)","closed","","chia7712","2020-04-17T09:05:38Z","2020-04-20T13:09:05Z"
"","8766","MINOR: Update zstd to 1.4.5","It improves decompression speed:  >For x64 cpus, expect a speed bump of at least +5%, and up to +10% in favorable cases. >ARM cpus receive more benefit, with speed improvements ranging from +15% vicinity, >and up to +50% for certain SoCs and scenarios (ARM‘s situation is more complex due >to larger differences in SoC designs).  See https://github.com/facebook/zstd/releases/tag/v1.4.5 for more details.  ### Committer Checklist (excluded from commit message) - [ ] Verify design and implementation  - [ ] Verify test coverage and CI build status - [ ] Verify documentation (including upgrade notes)","closed","","ijuma","2020-05-31T16:07:56Z","2020-05-31T21:58:34Z"
"","8674","KAFKA-9996: Upgrade zookeeper to 3.5.8","It fixes 30 issues, including third party CVE fixes, several leader-election related fixes and a compatibility issue with applications built against earlier 3.5 client libraries (by restoring a few non public APIs).  See ZooKeeper 3.5.8 Release Notes for details: https://zookeeper.apache.org/doc/r3.5.8/releasenotes.html  ### Committer Checklist (excluded from commit message) - [ ] Verify design and implementation  - [ ] Verify test coverage and CI build status - [ ] Verify documentation (including upgrade notes)","closed","","ijuma","2020-05-15T13:26:25Z","2020-05-15T16:01:45Z"
"","9401","KAFKA-9628 Replace Produce request/response with automated protocol","issue: https://issues.apache.org/jira/browse/KAFKA-9628   ### Benchmark  1. loop **30** times 1. calculate average  #### kafkatest.benchmarks.core.benchmark_test.Benchmark.test_producer_throughput  > @cluster(num_nodes=5) > @parametrize(acks=-1, topic=TOPIC_REP_THREE)  - +0.3144915325 % - 28.08766667 ->  28.1715625 (mb_per_sec)  > @cluster(num_nodes=5) > @matrix(acks=[1], topic=[TOPIC_REP_THREE], message_size=[100000],compression_type=[""none""], security_protocol=['PLAINTEXT'])  - +4.220730323 % - 157.145 -> 163.7776667 (mb_per_sec)  > @cluster(num_nodes=7) > @parametrize(acks=1, topic=TOPIC_REP_THREE, num_producers=3)  - +5.996241145% - 57.64166667 -> 61.098 (mb_per_sec)  > @cluster(num_nodes=5) > @parametrize(acks=1, topic=TOPIC_REP_THREE)  - +0.3979572536% - 44.05833333 -> 44.23366667 (mb_per_sec)  > @cluster(num_nodes=5) > @parametrize(acks=1, topic= TOPIC_REP_ONE)  - +2.228235226% - 69.23266667 -> 70.77533333 (mb_per_sec)  ### JMH results  In short, most ops performance are regression since we have to convert data to protocol data. The cost is inevitable (like other request/response) before we use protocol data directly.  ### JMH for ProduceRequest  1. construction regression:     - 281.474 -> 454.935 ns/op     - 296.000 -> 1888.000 B/op 1. toErrorResponse regression:     - 41.942 -> 107.528 ns/op     - 1216.000 -> 1616.000 B/op 1. toStruct improvement:     - 255.185 -> 90.728 ns/op     - 864.000 -> 304.000 B/op  **BEFORE** ``` Benchmark                                                                        Mode  Cnt     Score    Error   Units ProducerRequestBenchmark.constructorErrorResponse                                avgt   15    41.942 ±  0.036   ns/op ProducerRequestBenchmark.constructorErrorResponse:·gc.alloc.rate                 avgt   15  6409.263 ±  5.478  MB/sec ProducerRequestBenchmark.constructorErrorResponse:·gc.alloc.rate.norm            avgt   15   296.000 ±  0.001    B/op ProducerRequestBenchmark.constructorErrorResponse:·gc.churn.G1_Eden_Space        avgt   15  6416.420 ± 76.071  MB/sec ProducerRequestBenchmark.constructorErrorResponse:·gc.churn.G1_Eden_Space.norm   avgt   15   296.331 ±  3.539    B/op ProducerRequestBenchmark.constructorErrorResponse:·gc.churn.G1_Old_Gen           avgt   15     0.002 ±  0.002  MB/sec ProducerRequestBenchmark.constructorErrorResponse:·gc.churn.G1_Old_Gen.norm      avgt   15    ≈ 10⁻⁴             B/op ProducerRequestBenchmark.constructorErrorResponse:·gc.count                      avgt   15   698.000           counts ProducerRequestBenchmark.constructorErrorResponse:·gc.time                       avgt   15   378.000               ms ProducerRequestBenchmark.constructorProduceRequest                               avgt   15   281.474 ±  3.286   ns/op ProducerRequestBenchmark.constructorProduceRequest:·gc.alloc.rate                avgt   15  3923.868 ± 46.303  MB/sec ProducerRequestBenchmark.constructorProduceRequest:·gc.alloc.rate.norm           avgt   15  1216.000 ±  0.001    B/op ProducerRequestBenchmark.constructorProduceRequest:·gc.churn.G1_Eden_Space       avgt   15  3923.375 ± 59.568  MB/sec ProducerRequestBenchmark.constructorProduceRequest:·gc.churn.G1_Eden_Space.norm  avgt   15  1215.844 ± 11.184    B/op ProducerRequestBenchmark.constructorProduceRequest:·gc.churn.G1_Old_Gen          avgt   15     0.004 ±  0.001  MB/sec ProducerRequestBenchmark.constructorProduceRequest:·gc.churn.G1_Old_Gen.norm     avgt   15     0.001 ±  0.001    B/op ProducerRequestBenchmark.constructorProduceRequest:·gc.count                     avgt   15   515.000           counts ProducerRequestBenchmark.constructorProduceRequest:·gc.time                      avgt   15   279.000               ms ProducerRequestBenchmark.constructorStruct                                       avgt   15   255.185 ±  0.069   ns/op ProducerRequestBenchmark.constructorStruct:·gc.alloc.rate                        avgt   15  3074.889 ±  0.823  MB/sec ProducerRequestBenchmark.constructorStruct:·gc.alloc.rate.norm                   avgt   15   864.000 ±  0.001    B/op ProducerRequestBenchmark.constructorStruct:·gc.churn.G1_Eden_Space               avgt   15  3077.737 ± 31.537  MB/sec ProducerRequestBenchmark.constructorStruct:·gc.churn.G1_Eden_Space.norm          avgt   15   864.800 ±  8.823    B/op ProducerRequestBenchmark.constructorStruct:·gc.churn.G1_Old_Gen                  avgt   15     0.003 ±  0.001  MB/sec ProducerRequestBenchmark.constructorStruct:·gc.churn.G1_Old_Gen.norm             avgt   15     0.001 ±  0.001    B/op ProducerRequestBenchmark.constructorStruct:·gc.count                             avgt   15   404.000           counts ProducerRequestBenchmark.constructorStruct:·gc.time                              avgt   15   214.000               ms ```  **AFTER** ``` Benchmark                                                                        Mode  Cnt     Score    Error   Units ProducerRequestBenchmark.constructorErrorResponse                                avgt   15   107.528 ±  0.270   ns/op ProducerRequestBenchmark.constructorErrorResponse:·gc.alloc.rate                 avgt   15  4864.899 ± 12.132  MB/sec ProducerRequestBenchmark.constructorErrorResponse:·gc.alloc.rate.norm            avgt   15   576.000 ±  0.001    B/op ProducerRequestBenchmark.constructorErrorResponse:·gc.churn.G1_Eden_Space        avgt   15  4868.023 ± 61.943  MB/sec ProducerRequestBenchmark.constructorErrorResponse:·gc.churn.G1_Eden_Space.norm   avgt   15   576.371 ±  7.331    B/op ProducerRequestBenchmark.constructorErrorResponse:·gc.churn.G1_Old_Gen           avgt   15     0.005 ±  0.001  MB/sec ProducerRequestBenchmark.constructorErrorResponse:·gc.churn.G1_Old_Gen.norm      avgt   15     0.001 ±  0.001    B/op ProducerRequestBenchmark.constructorErrorResponse:·gc.count                      avgt   15   639.000           counts ProducerRequestBenchmark.constructorErrorResponse:·gc.time                       avgt   15   339.000               ms ProducerRequestBenchmark.constructorProduceRequest                               avgt   15   454.935 ±  0.332   ns/op ProducerRequestBenchmark.constructorProduceRequest:·gc.alloc.rate                avgt   15  3769.014 ±  2.767  MB/sec ProducerRequestBenchmark.constructorProduceRequest:·gc.alloc.rate.norm           avgt   15  1888.000 ±  0.001    B/op ProducerRequestBenchmark.constructorProduceRequest:·gc.churn.G1_Eden_Space       avgt   15  3763.407 ± 31.530  MB/sec ProducerRequestBenchmark.constructorProduceRequest:·gc.churn.G1_Eden_Space.norm  avgt   15  1885.190 ± 15.594    B/op ProducerRequestBenchmark.constructorProduceRequest:·gc.churn.G1_Old_Gen          avgt   15     0.004 ±  0.001  MB/sec ProducerRequestBenchmark.constructorProduceRequest:·gc.churn.G1_Old_Gen.norm     avgt   15     0.002 ±  0.001    B/op ProducerRequestBenchmark.constructorProduceRequest:·gc.count                     avgt   15   494.000           counts ProducerRequestBenchmark.constructorProduceRequest:·gc.time                      avgt   15   264.000               ms ProducerRequestBenchmark.constructorStruct                                       avgt   15    90.728 ±  0.695   ns/op ProducerRequestBenchmark.constructorStruct:·gc.alloc.rate                        avgt   15  3043.140 ± 23.246  MB/sec ProducerRequestBenchmark.constructorStruct:·gc.alloc.rate.norm                   avgt   15   304.000 ±  0.001    B/op ProducerRequestBenchmark.constructorStruct:·gc.churn.G1_Eden_Space               avgt   15  3047.251 ± 59.638  MB/sec ProducerRequestBenchmark.constructorStruct:·gc.churn.G1_Eden_Space.norm          avgt   15   304.404 ±  5.034    B/op ProducerRequestBenchmark.constructorStruct:·gc.churn.G1_Old_Gen                  avgt   15     0.003 ±  0.001  MB/sec ProducerRequestBenchmark.constructorStruct:·gc.churn.G1_Old_Gen.norm             avgt   15    ≈ 10⁻⁴             B/op ProducerRequestBenchmark.constructorStruct:·gc.count                             avgt   15   400.000           counts ProducerRequestBenchmark.constructorStruct:·gc.time                              avgt   15   205.000               ms ``` ### JMH for ProduceResponse  1. construction regression:     - 3.293 -> 303.226 ns/op     - 24.000 -> 1848.000 B/op 1. toStruct improvement:     - 825.889 -> 311.725 ns/op     - 2208.000 -> 896.000 B/op  **BEFORE**  ``` Benchmark                                                                          Mode  Cnt     Score    Error   Units ProducerResponseBenchmark.constructorProduceResponse                               avgt   15     3.293 ±  0.004   ns/op ProducerResponseBenchmark.constructorProduceResponse:·gc.alloc.rate                avgt   15  6619.731 ±  9.075  MB/sec ProducerResponseBenchmark.constructorProduceResponse:·gc.alloc.rate.norm           avgt   15    24.000 ±  0.001    B/op ProducerResponseBenchmark.constructorProduceResponse:·gc.churn.G1_Eden_Space       avgt   15  6618.648 ±  0.153  MB/sec ProducerResponseBenchmark.constructorProduceResponse:·gc.churn.G1_Eden_Space.norm  avgt   15    23.996 ±  0.033    B/op ProducerResponseBenchmark.constructorProduceResponse:·gc.churn.G1_Old_Gen          avgt   15     0.003 ±  0.002  MB/sec ProducerResponseBenchmark.constructorProduceResponse:·gc.churn.G1_Old_Gen.norm     avgt   15    ≈ 10⁻⁵             B/op ProducerResponseBenchmark.constructorProduceResponse:·gc.count                     avgt   15   720.000           counts ProducerResponseBenchmark.constructorProduceResponse:·gc.time                      avgt   15   383.000               ms ProducerResponseBenchmark.constructorStruct                                        avgt   15   825.889 ±  0.638   ns/op ProducerResponseBenchmark.constructorStruct:·gc.alloc.rate                         avgt   15  2428.000 ±  1.899  MB/sec ProducerResponseBenchmark.constructorStruct:·gc.alloc.rate.norm                    avgt   15  2208.000 ±  0.001    B/op ProducerResponseBenchmark.constructorStruct:·gc.churn.G1_Eden_Space                avgt   15  2430.196 ± 55.894  MB/sec ProducerResponseBenchmark.constructorStruct:·gc.churn.G1_Eden_Space.norm           avgt   15  2210.001 ± 51.009    B/op ProducerResponseBenchmark.constructorStruct:·gc.churn.G1_Old_Gen                   avgt   15     0.003 ±  0.001  MB/sec ProducerResponseBenchmark.constructorStruct:·gc.churn.G1_Old_Gen.norm              avgt   15     0.002 ±  0.001    B/op ProducerResponseBenchmark.constructorStruct:·gc.count                              avgt   15   319.000           counts ProducerResponseBenchmark.constructorStruct:·gc.time                               avgt   15   166.000               ms ```  **AFTER**  ``` Benchmark                                                                          Mode  Cnt     Score    Error   Units ProducerResponseBenchmark.constructorProduceResponse                               avgt   15   303.226 ±  0.517   ns/op ProducerResponseBenchmark.constructorProduceResponse:·gc.alloc.rate                avgt   15  5534.940 ±  9.439  MB/sec ProducerResponseBenchmark.constructorProduceResponse:·gc.alloc.rate.norm           avgt   15  1848.000 ±  0.001    B/op ProducerResponseBenchmark.constructorProduceResponse:·gc.churn.G1_Eden_Space       avgt   15  5534.046 ± 51.849  MB/sec ProducerResponseBenchmark.constructorProduceResponse:·gc.churn.G1_Eden_Space.norm  avgt   15  1847.710 ± 18.105    B/op ProducerResponseBenchmark.constructorProduceResponse:·gc.churn.G1_Old_Gen          avgt   15     0.007 ±  0.001  MB/sec ProducerResponseBenchmark.constructorProduceResponse:·gc.churn.G1_Old_Gen.norm     avgt   15     0.002 ±  0.001    B/op ProducerResponseBenchmark.constructorProduceResponse:·gc.count                     avgt   15   602.000           counts ProducerResponseBenchmark.constructorProduceResponse:·gc.time                      avgt   15   318.000               ms ProducerResponseBenchmark.constructorStruct                                        avgt   15   311.725 ±  3.132   ns/op ProducerResponseBenchmark.constructorStruct:·gc.alloc.rate                         avgt   15  2610.602 ± 25.964  MB/sec ProducerResponseBenchmark.constructorStruct:·gc.alloc.rate.norm                    avgt   15   896.000 ±  0.001    B/op ProducerResponseBenchmark.constructorStruct:·gc.churn.G1_Eden_Space                avgt   15  2613.021 ± 42.965  MB/sec ProducerResponseBenchmark.constructorStruct:·gc.churn.G1_Eden_Space.norm           avgt   15   896.824 ± 11.331    B/op ProducerResponseBenchmark.constructorStruct:·gc.churn.G1_Old_Gen                   avgt   15     0.003 ±  0.001  MB/sec ProducerResponseBenchmark.constructorStruct:·gc.churn.G1_Old_Gen.norm              avgt   15     0.001 ±  0.001    B/op ProducerResponseBenchmark.constructorStruct:·gc.count                              avgt   15   343.000           counts ProducerResponseBenchmark.constructorStruct:·gc.time                               avgt   15   194.000               ms ```  ### Committer Checklist (excluded from commit message) - [ ] Verify design and implementation  - [ ] Verify test coverage and CI build status - [ ] Verify documentation (including upgrade notes)","closed","","chia7712","2020-10-09T05:58:00Z","2020-11-18T21:44:23Z"
"","9423","KAFKA-9263 The new hw is added to incorrect log when ReplicaAlterLogD…","issue: https://issues.apache.org/jira/browse/KAFKA-9263  The following actions results in this issue.  1. handle_1 gets the current log 2. ReplicaAlterLogDirsThread replaces current log by future log 3. handle_1 adds the new hw to “current” log but the log is actually invalid  The solution is that the action 1 and 3 must be executed within same read lock of leaderIsrUpdateLock to avoid adding new hw to invalid log (which is replaced by ReplicaAlterLogDirsThread)   **Test Plan**  Relying on ```PlaintextAdminIntegrationTest.testAlterReplicaLogDirs```. I have looped the test with this patch 100 times. all pass  ### Committer Checklist (excluded from commit message) - [ ] Verify design and implementation  - [ ] Verify test coverage and CI build status - [ ] Verify documentation (including upgrade notes)","closed","","chia7712","2020-10-13T15:21:06Z","2020-12-02T03:21:28Z"
"","9128","KAFKA-7540 reduce session timeout to evict dead member in time and so…","issue: https://issues.apache.org/jira/browse/KAFKA-7540  In short, the LEAVE_GROUP is sent to a shutdown broker so the dead member which is left in the group obstructs broker from completing rebalance.  The test case creates two consumers (with different group) and then shutdown their coordinator (broker). After first coordinator is shutdown, the heartbeat thread of first consumer gets timeout so it sends LEAVE_GROUP request to “next” coordinator. Unfortunately, the LEAVE_GROUP request can’t be processed successfully if the ”next” coordinator is the coordinator of second consumer (yep, it is shutdown also).   The simple approach is that we can reduce the session timeout so coordinator can evict dead member in time.  ### Committer Checklist (excluded from commit message) - [ ] Verify design and implementation  - [ ] Verify test coverage and CI build status - [ ] Verify documentation (including upgrade notes)","closed","","chia7712","2020-08-05T07:04:11Z","2021-03-02T16:29:25Z"
"","9318","KAFKA-10497 Convert group coordinator metadata schemas to use generat…","issue: https://issues.apache.org/jira/browse/KAFKA-10497  ### Committer Checklist (excluded from commit message) - [ ] Verify design and implementation  - [ ] Verify test coverage and CI build status - [ ] Verify documentation (including upgrade notes)","closed","","chia7712","2020-09-22T10:54:05Z","2020-11-18T06:49:05Z"
"","9257","KAFKA-10463 the necessary utilities in Dockerfile should include git","issue: https://issues.apache.org/jira/browse/KAFKA-10463  the default image of Dockerfile is ```openjdk:8``` and it pre-installed git so it is fine that necessary utilities does not include git. However, the later version of openjdk image does not include git by default and error message ""git: command not found"" ensues.  ### Committer Checklist (excluded from commit message) - [ ] Verify design and implementation  - [ ] Verify test coverage and CI build status - [ ] Verify documentation (including upgrade notes)","closed","","chia7712","2020-09-07T10:04:25Z","2020-09-14T22:22:01Z"
"","9230","KAFKA-10446 add lz4 and zstd to compression type of benchmark_test.py","issue: https://issues.apache.org/jira/browse/KAFKA-10446  Both ""lz4"" and ""zstd"" are popular and important compressions supported by kafka. They are worth being benchmark.  ### Committer Checklist (excluded from commit message) - [ ] Verify design and implementation  - [ ] Verify test coverage and CI build status - [ ] Verify documentation (including upgrade notes)","closed","","chia7712","2020-08-30T15:48:59Z","2020-09-26T07:53:57Z"
"","9223","KAFKA-10438 Lazy initialization of record header to reduce memory usa…","issue: https://issues.apache.org/jira/browse/KAFKA-10438  There is no checks for header key so instantiating key (bytes to string) is unnecessary. The risk of this PR is the exception of converting byte[] to string can't be discovered quickly (the conversion error is rare so it should be fine).  **JMH RESULT**  1. ops: +12% 1. The optimization of memory usage is very small as the cost of creating extra ```ByteBuffer``` is almost same to byte array copy (used to construct ```String```). Using large key results in better improvement but I don't think large key is common case.   **BEFORE** ``` Benchmark                                                                     (bufferSupplierStr)  (bytes)  (compressionType)  (headerKeySize)  (maxBatchSize)  (maxHeaderSize)  (messageSize)  (messageVersion)   Mode  Cnt        Score      Error   Units RecordBatchIterationBenchmark.measureValidation                                        NO_CACHING   RANDOM               NONE               10             200                5           1000                 2  thrpt   15  2035938.174 ± 1653.566   ops/s RecordBatchIterationBenchmark.measureValidation:·gc.alloc.rate.norm                    NO_CACHING   RANDOM               NONE               10             200                5           1000                 2  thrpt   15     2040.000 ±    0.001    B/op ```  ``` Benchmark                                                                     (bufferSupplierStr)  (bytes)  (compressionType)  (headerKeySize)  (maxBatchSize)  (maxHeaderSize)  (messageSize)  (messageVersion)   Mode  Cnt        Score      Error   Units RecordBatchIterationBenchmark.measureValidation                                        NO_CACHING   RANDOM               NONE               30             200                5           1000                 2  thrpt   15  1979193.376 ± 1239.286   ops/s RecordBatchIterationBenchmark.measureValidation:·gc.alloc.rate.norm                    NO_CACHING   RANDOM               NONE               30             200                5           1000                 2  thrpt   15     2120.000 ±    0.001    B/op ```   **AFTER**  ``` Benchmark                                                                     (bufferSupplierStr)  (bytes)  (compressionType)  (headerKeySize)  (maxBatchSize)  (maxHeaderSize)  (messageSize)  (messageVersion)   Mode  Cnt        Score      Error   Units RecordBatchIterationBenchmark.measureValidation                                        NO_CACHING   RANDOM               NONE               10             200                5           1000                 2  thrpt   15  2289115.973 ± 2661.856   ops/s RecordBatchIterationBenchmark.measureValidation:·gc.alloc.rate.norm                    NO_CACHING   RANDOM               NONE               10             200                5           1000                 2  thrpt   15     2032.000 ±    0.001    B/op ```  ``` Benchmark                                                                     (bufferSupplierStr)  (bytes)  (compressionType)  (headerKeySize)  (maxBatchSize)  (maxHeaderSize)  (messageSize)  (messageVersion)   Mode  Cnt        Score     Error   Units RecordBatchIterationBenchmark.measureValidation                                        NO_CACHING   RANDOM               NONE               30             200                5           1000                 2  thrpt   15  2222625.706 ± 908.358   ops/s RecordBatchIterationBenchmark.measureValidation:·gc.alloc.rate.norm                    NO_CACHING   RANDOM               NONE               30             200                5           1000                 2  thrpt   15     2040.000 ±   0.001    B/op  ```  ### Committer Checklist (excluded from commit message) - [ ] Verify design and implementation  - [ ] Verify test coverage and CI build status - [ ] Verify documentation (including upgrade notes)","closed","","chia7712","2020-08-26T10:09:35Z","2020-09-21T15:03:50Z"
"","9220","KAFKA-10433 Reuse the ByteBuffer in validating compressed records","issue: https://issues.apache.org/jira/browse/KAFKA-10433  It is hot method so reusing the ByteBuffer can reduce a bunch of memory usage if the compression type supports BufferSupplier.  **experiment** - duration: 1 minute - compression: LZ4 - workload: 10 producers -> 1 broker  - memory usage of byte array allocation: 4.52 GB -> 0.68 GB  ### Committer Checklist (excluded from commit message) - [ ] Verify design and implementation  - [ ] Verify test coverage and CI build status - [ ] Verify documentation (including upgrade notes)","closed","","chia7712","2020-08-25T17:49:02Z","2020-08-30T09:55:56Z"
"","9182","KAFKA-10403 Replace scala collection by java collection in generating…","issue: https://issues.apache.org/jira/browse/KAFKA-10403  It seems to me the metrics is a ""kind"" of public interface so users should be able to access metrics of kafka server without scala library.  ### Committer Checklist (excluded from commit message) - [ ] Verify design and implementation  - [ ] Verify test coverage and CI build status - [ ] Verify documentation (including upgrade notes)","closed","","chia7712","2020-08-14T16:10:01Z","2020-09-09T14:44:04Z"
