"#","No","Issue Title","Issue Details","State","Labels","User name","created","Updated"
"","9214","[DO NOT MERGE] POC: unify all jvm cache pools","Currently, users of Suppress in strict mode must either not configure a memory bound or consider a per-operator, per-partition bound. The former would result in the application crashing ungracefully if it needs too much memory, which is sub-optimal for some deployment strategies. The latter is nice for determinism, but is difficult to configure in practice.  In addition to suppress buffers, Streams has a record cache configuration. Currently, we make the assumption that all threads would probably use a uniform amount of cache space, but this assumption is clearly wrong in some cases.  Finally, there are some applications that want to run multiple Streams instances in the same JVM, probably for running different Streams topologies.  In aggregate, there are quite a few ""pools"" of heap space that users need to configure if they want to avoid an OOME, and the more threads, applications, and Suppress operators there are, the more granular these pools become. Of course, the more granular the pools are, the lower utilization of the available memory we will see. Plus, especially for Suppression, very granular pool configuration means a higher likelihood that the operator will run out of space and shut the app down.  This POC demonstrates the feasibility of unifying all these pools with one logical bound on total memory usage for all caches and suppression buffers, across all operators/tasks and all threads, and even across all Streams instances in the JVM.  Most of the tests pass right now, but not all of them. I also need to clean up a few more things before really starting a discussion.  ### Committer Checklist (excluded from commit message) - [ ] Verify design and implementation  - [ ] Verify test coverage and CI build status - [ ] Verify documentation (including upgrade notes)","open","streams,","vvcephei","2020-08-24T19:41:29Z","2020-08-24T19:41:38Z"
"","8505","MINOR: Switch order of sections on tumbling and hopping windows in streams doc","Currently, tumbling windows are defined as ""a special case of hopping time windows"" in the streams docs, but hopping windows are only explained in a subsequent section. I think it would make sense to switch the order of these paragraphs around. To me this also makes more sense semantically.  Testing Built the site and checked that everything looks ok and html is valid (or at least didn't contain any new warnings that were caused by this change).  ### Committer Checklist (excluded from commit message) - [ ] Verify design and implementation  - [ ] Verify test coverage and CI build status - [ ] Verify documentation (including upgrade notes)","closed","docs,","soenkeliebau","2020-04-17T09:02:29Z","2020-04-17T17:57:57Z"
"","9261","MINOR: Update source link in interactive query page","Currently, the source reference are all pointing to the 1.0 version codes, which is obviously wrong. Update to the current `dotVersion`. (ref: https://github.com/apache/kafka/blob/trunk/docs/streams/developer-guide/datatypes.html#L173)  ### Committer Checklist (excluded from commit message) - [ ] Verify design and implementation  - [ ] Verify test coverage and CI build status - [ ] Verify documentation (including upgrade notes)","closed","streams,","showuon","2020-09-08T06:35:31Z","2020-09-14T15:11:04Z"
"","8829","KAFKA-10115: Incorporate errors.tolerance with the Errant Record Reporter","Currently, the errant record reporter doesn't take into account the value of `errors.tolerance.` Added a check if the reporter is within the tolerance limits; if not, then a `ConnectException` is thrown. This is essentially what is done across other parts of the `RetryAndToleranceOperator`.","closed","connect,","aakashnshah","2020-06-07T22:57:58Z","2020-06-11T05:38:00Z"
"","9078","KAFKA-10132: Return correct value types for MBean attributes","Currently, JMX outputs all metrics as having type `double`, even if they are strings or other types of numbers. This PR gets the type from the metric's value if possible, using `double` as a fallback if the type can't be determined.","open","","rgroothuijsen","2020-07-25T13:17:37Z","2021-02-07T17:05:48Z"
"","9262","MINOR: Fix log message when tasks directory is cleaned manually","Currently when a task directory is cleaned manually the message for the state dir cleaner is logged instead of the message for the manual cleanup. This is because the code checks the elapsed time since the last update before it checks whether the cleanup is a manual call. This commit changes the order of the checks.   ### Committer Checklist (excluded from commit message) - [ ] Verify design and implementation  - [ ] Verify test coverage and CI build status - [ ] Verify documentation (including upgrade notes)","closed","","cadonna","2020-09-08T10:10:50Z","2020-10-05T20:23:13Z"
"","8625","MINOR: Only add 'Data' suffix for generated request/response/header types","Currently we add ""Data"" to all generated classnames in order to avoid naming collisions with existing Request/Response objects. Generated classes for other persistent schema definitions (such as those used in `GroupCoordinator` and `TransactionCoordinator`) will not necessarily have the same problem, so it would be nice if the generated types could use the name defined in the schema directly.  ### Committer Checklist (excluded from commit message) - [ ] Verify design and implementation  - [ ] Verify test coverage and CI build status - [ ] Verify documentation (including upgrade notes)","closed","","hachikuji","2020-05-06T19:09:24Z","2020-05-06T22:30:14Z"
"","9143","MINOR: Fix the way total consumed is calculated for verifiable consumer","Currently the way we calculate the number of total consumed messages for the verifiable consumer overcounts the number of actually consumed messages. This PR is to fix that to ensure we count the number of consumed messages correctly.  ### Committer Checklist (excluded from commit message) - [ ] Verify design and implementation  - [ ] Verify test coverage and CI build status - [ ] Verify documentation (including upgrade notes)","closed","","skaundinya15","2020-08-07T19:30:44Z","2020-08-17T05:26:39Z"
"","9313","[mm2] Fix consumer/producer properties override","Currently the producer/consumer properties override for the MirrorSourceTask and OffsetSyncStore do not work. This is due the props stored into MirrorConnectorConfig have a `target.cluster` or `source.cluster` prefix. For example: ``` source.cluster.producer.bootstrap.servers -> localhost:9092 target.cluster.consumer.max.poll.interval.ms -> 120000 target.cluster.consumer.auto.offset.reset -> latest source.cluster.admin.bootstrap.servers -> localhost:9092 ```  The [sourceConsumerConfig](https://github.com/apache/kafka/blob/aa0cd667bcd5c4025e84097192030b59165ac9d0/connect/mirror/src/main/java/org/apache/kafka/connect/mirror/MirrorConnectorConfig.java#L240) will strip this prefix and store all props as:  ``` producer.bootstrap.servers -> localhost:9092 consumer.auto.offset.reset -> latest consumer.max.poll.interval.ms -> 120000 alias -> A bootstrap.servers -> localhost:9092 admin.bootstrap.servers -> localhost:9092 consumer.bootstrap.servers -> localhost:9092 ```  The next line `props.keySet().retainAll(MirrorClientConfig.CLIENT_CONFIG_DEF.names());` will strip all the props not defined in this common CLIENT_CONFIG_DEF definition. Not relevant but can be confusing if you think the next line will filter on the current values in props.  Finally, the `props.putAll(originalsWithPrefix(CONSUMER_CLIENT_PREFIX));` is based on the on the `originals` variable that have the `target.cluster` or `source.cluster` prefix. There's no single property with the ""consumer."" prefix. This patterns repeats with the producer config.  This PR also allows to override the hardcoded `auto.offset.reset` value.  ### Committer Checklist (excluded from commit message) - [ ] Verify design and implementation  - [ ] Verify test coverage and CI build status - [ ] Verify documentation (including upgrade notes)","closed","","scanterog","2020-09-21T14:59:34Z","2020-10-16T16:17:04Z"
"","8878","MINOR: Generator config-specific HTML ids","Currently the docs have HTML ids for each config key. That doesn't work correctly for config keys like bootstrap.servers which occur across producer, consumer, admin configs: We generate duplicate ids. So arrange for each config to prefix the ids it generates with the HTML id of its section heading.","closed","","tombentley","2020-06-16T13:38:14Z","2020-09-19T11:35:14Z"
"","9079","KAFKA-10308 fix flaky core/round_trip_fault_test.py","Creating a topic may fail (due to timeout) in running system tests. However, ```RoundTripWorker``` does not ignore ```TopicExistsException``` which makes ```round_trip_fault_test.py``` be a flaky one.  More specifically, a network exception can cause the CreateTopics request to reach Kafka but Trogdor retry it and hit a TopicAlreadyExists exception on the retry, failing the test.  ### Committer Checklist (excluded from commit message) - [ ] Verify design and implementation  - [ ] Verify test coverage and CI build status - [ ] Verify documentation (including upgrade notes)","closed","","chia7712","2020-07-25T16:01:09Z","2020-08-06T15:16:45Z"
"","9180","MINOR: corrected unit tests in AbstractConfigTest.java- fixed invalid assertions","Corrected unit tests.","closed","","sanketfajage","2020-08-14T10:18:26Z","2020-11-03T06:48:37Z"
"","8616","KAFKA-9127: don't create StreamThreads for global-only topology (2.4)","Copy of [pull/8540](https://github.com/apache/kafka/pull/8540) targeted at 2.4","closed","","ableegoldman","2020-05-05T01:32:57Z","2020-05-08T19:31:15Z"
"","9221","KAFKA-10436: Implement KIP-478 Topology changes","Converts `Topology#addProcessor` and `#addGlobalStore` Also, convert some of the internals in support of `addProcessor`  ### Committer Checklist (excluded from commit message) - [ ] Verify design and implementation  - [ ] Verify test coverage and CI build status - [ ] Verify documentation (including upgrade notes)","closed","kip,","vvcephei","2020-08-26T01:25:52Z","2021-01-08T02:04:39Z"
"","8845","KAFKA-10126:Add a warning message for ConsumerPerformance","ConsumerPerformance has not implemented options numThreadsOpt and numFetchersOpt as so far. This patch adds a warning message when used these options according to comments from https://issues.apache.org/jira/browse/KAFKA-10126 . Once these two options are implemented, this warning message should be removed.  Change-Id: Iae34b11210a361373eda42274ebfc153b636a989 Signed-off-by: Jiamei Xie   *More detailed description of your change, if necessary. The PR title and PR message become the squashed commit message, so use a separate comment to ping reviewers.*  *Summary of testing strategy (including rationale) for the feature or bug fix. Unit and/or integration tests are expected for any behaviour change and system tests should be considered for larger changes.*  ### Committer Checklist (excluded from commit message) - [ ] Verify design and implementation  - [ ] Verify test coverage and CI build status - [ ] Verify documentation (including upgrade notes)","closed","","jiameixie","2020-06-10T09:57:30Z","2020-06-24T01:23:02Z"
"","8814","KAFKA-10111: Make SinkTaskContext.errantRecordReporter() a default method","Connector projects may have their own mock or testing implementations of the `SinkTaskContext`, and this newly-added method should be a default method to prevent breaking those projects. Changing this to a default method that returns null also makes sense w/r/t the method semantics, since the method is already defined to return null if the reporter has not been configured.  This should be backported to `2.6`, since that's when [KIP-610](https://cwiki.apache.org/confluence/display/KAFKA/KIP-610%3A+Error+Reporting+in+Sink+Connectors) was introduced.  ### Committer Checklist (excluded from commit message) - [ ] Verify design and implementation  - [ ] Verify test coverage and CI build status - [ ] Verify documentation (including upgrade notes)","closed","connect,","rhauch","2020-06-05T16:44:40Z","2020-06-05T20:20:26Z"
"","8565","KAFKA-9798: Send one round synchronously before starting the async producer","Comparing all other test cases, the `shouldAllowConcurrentAccesses` starts an async producer sending records throughout the test other than just synchronously sent and acked a few records before we start the streams application. Right after the streams app is started, we check that at least one record is sent to the output topic (i.e. completed processing). However since only this test starts the producer async and did not wait for it to complete, it is possible that the async producer gets too longer to produce some records and causing it to fail.  To follow what other tests did, I let this test to first send one round of records synchronously before starting the async producing.  Also encountered some new scala warnings that I fixed along with this PR.  ### Committer Checklist (excluded from commit message) - [ ] Verify design and implementation  - [ ] Verify test coverage and CI build status - [ ] Verify documentation (including upgrade notes)","closed","tests,","guozhangwang","2020-04-27T21:22:31Z","2020-05-04T01:39:49Z"
"","8520","Add explicit grace period to tumbling window example","Comments also discuss current default grace period value, and the fact that it may change with the next major release.  ### Committer Checklist (excluded from commit message) - [n/a] Verify design and implementation  - [n/a] Verify test coverage and CI build status - [X] Verify documentation (including upgrade notes)","closed","docs,","LiamClarkeNZ","2020-04-20T04:56:38Z","2020-05-02T01:48:05Z"
"","9012","KAFKA-10270: A broker to controller channel manager","Co-authored-by: Viktor Somogyi viktorsomogyi@gmail.com Co-authored-by: Boyang Chen boyang@confluent.io  Add a broker to controller channel manager for use cases from KIP-590 and KIP-497. Kudos to Viktor, the code template is from https://github.com/apache/kafka/pull/7716/  ### Committer Checklist (excluded from commit message) - [ ] Verify design and implementation  - [ ] Verify test coverage and CI build status - [ ] Verify documentation (including upgrade notes)","closed","","abbccdda","2020-07-13T05:53:20Z","2020-07-29T18:40:15Z"
"","9294","MINOR: Fix now that kafka.apache.org resolves to 3 IP addresses","ClusterConnectStatesTest and ClientUtilsTest were failing because they expected kafka.apache.org to resolve to 2 IP addresses. This updates the tests so they reflect that DNS resolves to 3 addresses.","closed","","jolshan","2020-09-16T21:14:36Z","2020-09-30T22:38:04Z"
"","8655","failed","close request","closed","","qq619618919","2020-05-12T15:36:57Z","2020-05-12T16:33:21Z"
"","9105","MINOR: closable object Memory leak prevention","closable object Memory leak prevention  ### Committer Checklist (excluded from commit message) - [ ] Verify design and implementation  - [ ] Verify test coverage and CI build status - [ ] Verify documentation (including upgrade notes)","closed","streams,","highluck","2020-07-30T17:19:31Z","2020-11-21T14:32:56Z"
"","8559","KAFKA-9922:Update examples README","Class kafka.examples.SimpleConsumerDemo was removed. But the java-simple-consumer-demo.sh was not removed and README was not updated.  Change-Id: Iff057ce91454b493859ace6c6959e674048e9678 Signed-off-by: Jiamei Xie   *More detailed description of your change, if necessary. The PR title and PR message become the squashed commit message, so use a separate comment to ping reviewers.*  *Summary of testing strategy (including rationale) for the feature or bug fix. Unit and/or integration tests are expected for any behaviour change and system tests should be considered for larger changes.*  ### Committer Checklist (excluded from commit message) - [ ] Verify design and implementation  - [ ] Verify test coverage and CI build status - [ ] Verify documentation (including upgrade notes)","closed","","jiameixie","2020-04-27T08:58:37Z","2020-04-30T03:18:21Z"
"","9316","MINOR: clarify variables for skipping idempotent source updates","Clarify some confusing variable and method names.  ### Committer Checklist (excluded from commit message) - [ ] Verify design and implementation  - [ ] Verify test coverage and CI build status - [ ] Verify documentation (including upgrade notes)","closed","streams,","vvcephei","2020-09-21T20:29:40Z","2020-09-24T14:25:40Z"
"","9468","KAFKA-10454 / (2.6) Update copartitionSourceGroups when optimization algorithm is triggered","cherry-picking https://github.com/apache/kafka/pull/9237 on 2.6 branch  ### Committer Checklist (excluded from commit message) - [ ] Verify design and implementation  - [ ] Verify test coverage and CI build status - [ ] Verify documentation (including upgrade notes)","closed","","lkokhreidze","2020-10-21T06:52:13Z","2020-11-02T17:15:40Z"
"","8785","KAFKA-10084: Fix EosTestDriver end offset","Check the uncommitted end offset after the committed end offset, so we can be sure never to miss a pending end-transaction marker.  ### Committer Checklist (excluded from commit message) - [ ] Verify design and implementation  - [ ] Verify test coverage and CI build status - [ ] Verify documentation (including upgrade notes)","closed","streams,","vvcephei","2020-06-02T19:12:40Z","2020-06-03T16:36:35Z"
"","9199","KAFKA-10418: alter topic configs via kafka-topics error text","Changing a topic config with the `kafka-topics` command while connecting to Kafka via `--bootstrap-server` (rather than connecting to ZooKeeper via `--zookeeper`) is not supported. The desired functionality is available elsewhere, though: it is possible to change a topic config while connecting to Kafka rather than ZooKeeper via the `kafka-configs` command instead. However, neither the `kafka-topics` error message received nor the `kafka-topics` help information itself indicates this other possibility. For example:  ``` $ kafka-topics.sh --bootstrap-server localhost:9092 --alter --topic test --config flush.messages=12345 Option combination ""[bootstrap-server],[config]"" can't be used with option ""[alter]"" ```  ``` $ kafka-topics.sh ... --config  A topic configuration override for the topic being created or altered...It is supported only in combination with – create if --bootstrap-server option is used. ```  Rather than simply saying that what you want to do isn't available, it would be better to say also that you can do it with the `kafka-configs` command.","closed","","rondagostino","2020-08-18T21:30:37Z","2020-08-21T06:28:23Z"
"","8730","KAFKA-10048: Possible data gap for a consumer after a failover when u…","Changed the MM2 checkpoint mirror task to ensure it replicates consumer offsets even when they are equal to zero to avoid issues with consumers after failovers.  Modified the test case to cover the possible scenario of consumer gap, as described on KAFKA-10048.   ### Committer Checklist (excluded from commit message) - [x] Verify design and implementation  - [x] Verify test coverage and CI build status - [x] Verify documentation (including upgrade notes)","closed","","asdaraujo","2020-05-27T06:58:08Z","2020-10-02T16:39:00Z"
"","9159","KAFKA-10378: change jacksonDatabind as compile dependency for clients project","change `jacksonDatabind` as `compile` dependency for clients project  ### Committer Checklist (excluded from commit message) - [ ] Verify design and implementation  - [ ] Verify test coverage and CI build status - [ ] Verify documentation (including upgrade notes)","closed","","showuon","2020-08-11T06:09:21Z","2020-09-28T02:41:16Z"
"","8813","MINOR: fix backwards incompatibility in JmxReporter introduced by KIP-606","cc @omkreddy this should also get backported to 2.6.x","closed","","xvrl","2020-06-05T16:38:00Z","2020-06-05T20:02:06Z"
"","9405","MINOR internal KIP-629 changes to methods and variables","cc @gwenshap","closed","","xvrl","2020-10-09T06:51:35Z","2020-10-14T23:48:05Z"
"","8507","KAFKA-9818: Fix flaky test in RecordCollectorTest","Call for review @vvcephei. Follow up of #8488 (own ticket number)","closed","tests,","mjsax","2020-04-17T16:17:59Z","2020-04-18T00:25:22Z"
"","9217","MINOR: fix JavaDoc","Call for review @vvcephei","closed","streams,","mjsax","2020-08-25T01:07:31Z","2020-08-26T17:31:21Z"
"","9061","MINOR: removed incorrect deprecation annotations","Call for review @vvcephei","closed","streams,","mjsax","2020-07-23T04:07:24Z","2020-07-24T23:22:15Z"
"","8759","KAFKA-10066: TestOutputTopic should pass record headers into deserializers","Call for review @vvcephei","closed","streams,","mjsax","2020-05-29T23:18:26Z","2020-06-04T23:30:29Z"
"","8819","MINOR: improve code encapsulation between StreamThread and TaskManager","Call for review @guozhangwang @vvcephei","closed","streams,","mjsax","2020-06-05T22:48:10Z","2020-06-06T03:42:43Z"
"","9126","MINOR: Code cleanup in StreamsResetter","Call for review @guozhangwang @abbccdda","closed","tools,","mjsax","2020-08-04T22:17:35Z","2020-08-05T20:38:39Z"
"","8823","MINOR: fix HTML markup","Call for review @bbejeck","closed","docs,","mjsax","2020-06-06T21:14:42Z","2020-06-08T23:12:15Z"
"","8619","MINOR: Improve TopologyTestDriver JavaDocs","Call for review @bbejeck","closed","streams,","mjsax","2020-05-05T19:19:24Z","2020-05-05T22:56:27Z"
"","8488","KAFKA-9819: Fix flaky test in StoreChangelogReaderTest","Call for review @ableegoldman @vvcephei   The test failed with some log message from `AdminClient` however, we don't use any admin client in this test. Thus, we should not get the JVM shared root logger, but only the logger for the test class.","closed","tests,","mjsax","2020-04-15T01:57:02Z","2020-04-17T14:51:22Z"
"","9127","MINOR: fix HTML","Call for review @abbccdda @guozhangwang   This should go to 2.6 and I will also do a PR for kafka-site if necessary","closed","docs,","mjsax","2020-08-04T22:31:52Z","2020-08-06T18:24:15Z"
"","8621","KAFKA-9466: Update Kafka Streams docs for KIP-447","Call for review @abbccdda @guozhangwang","closed","docs,","mjsax","2020-05-06T02:01:05Z","2020-05-12T02:12:02Z"
"","8496","KAFKA-9748: Add Streams eos-beta integration test","Call for review @abbccdda @guozhangwang","closed","kip,","mjsax","2020-04-16T03:52:52Z","2020-06-12T23:10:41Z"
"","9425","KAFKA-10600: Connect should not add error to connector validation values for properties not in connector’s ConfigDef","By default the `Connector.validate(...)` will only include configuration values that are defined in the connector's `ConfigDef`, and validation is handled via `ConfigDef.Validator` objects. However, a connector can override the `Connector.validate(...)`, including in the output any configuration values whether or not they are not defined in the connector's `ConfigDef`.  Before this change, Connect always added an error to any configuration value that did not have a corresponding key defined in the connector's `ConfigDef`. Also, any errors on configuration values that did not have a corresponding key defined in the connector's `ConfigDef` was not counted in the total # of errors in the validation result.  This change removes the addition of those errors, so that only the errors returned by the connector's validation are included in the output, and all errors returned by the connector's validation output are counted in the total # of errors.  ### Committer Checklist (excluded from commit message) - [ ] Verify design and implementation  - [ ] Verify test coverage and CI build status - [ ] Verify documentation (including upgrade notes)","closed","connect,","rhauch","2020-10-13T17:53:26Z","2020-10-16T14:14:43Z"
"","8727","KAFKA-8120 Getting NegativeArraySizeException when using Kafka Connect","Bug fix only, [JIRA]( https://issues.apache.org/jira/browse/KAFKA-8120) 1. The Outer loop Issue, at Original line 134 of FileStreamSourceTask.java  	while (readerCopy.ready()) {  Since the buffer is used cross multiple poll. This condition missed a case that file has reached EOF, but buffer has un-parsed data.   To fix it, change the while loop to if statement, and move the file reading logic to extractLine         if (offset < buffer.length && reader.ready()) {  Test case: FileStreamSourceTaskTest.testSmallFile  2. The Expanding Buffer Issue, at Original line 140 of FileStreamSourceTask.java     if (offset == buffer.length) {         char[] newbuf = new char[buffer.length * 2];         System.arraycopy(buffer, 0, newbuf, 0, buffer.length);         buffer = newbuf;     }  For large file, this condition will be always true even expanding buffer is not needed, so every read will trigger expand buffer which will causes Java heap error or NegativeArraySizeException if buffer.length * 2 overflows.   To fix it, move the expanding buffer logic to the end of extractLine     if (offset == buffer.length &&  buffer.length  < maxBufferSize) {        needExtendBuffer = true;    }  Test case: FileStreamSourceTaskTest.testLargeFile  *Summary of testing strategy (including rationale) for the feature or bug fix. Unit and/or integration tests are expected for any behaviour change and system tests should be considered for larger changes.*  ### Committer Checklist (excluded from commit message) - [ ] Verify design and implementation  - [ ] Verify test coverage and CI build status - [ ] Verify documentation (including upgrade notes)","open","connect,","wj1918","2020-05-26T14:26:35Z","2020-05-27T05:15:26Z"
