"#","No","Issue Title","Issue Details","State","Labels","User name","created","Updated"
"","309","skywalking-3.1-2017追踪web工程日志,使用tomcat8遇到了log4j pattern解析异常，不能解析[%T]","Please answer these questions before submitting your issue.  ### What version of sky-walking are you using? 3.1-2017追  ### What version of your OS? x86_64 GNU/Linux  ### What version of your JRE? 1.8.0_131  ### What company or project? java web  ### What did you do? If possible, provide a way for reproducing the error. e.g. demo application, component version. tomcat 版本:apache-tomcat-8.0.39 apache-tomcat-8.5.9 jdk: 1.8.0_131 web 工程: web.xml version=""3.1"" web 工程 log4j: ...layout=org.skywalking.apm.toolkit.log.log4j.v1.x.TraceIdPatternLayout ....ConversionPattern=%d{yyyy-MM-dd HH:mm:ss SSS} %-5p [%T] [%x] [%t]%C{1}.%M(%L) - %m%n 工程 lib目录下引入: sky-walking.config skywalking-agent.jar apm-toolkit-log4j-1.x-3.1-2017.jar apm-toolkit-opentracing-3.1-2017.jar tomcat: catalina.sh 下增加 CATALINA_OPTS=""$CATALINA_OPTS -javaagent:/home/username/tool/data/gatewayMicroShop/WEB-INF/lib/skywalking-agent.jar""; export CATALINA_OPTS 启动 tomcat : 异常栈信息 21-Jul-2017 11:42:23.014 信息 [main] org.apache.catalina.core.StandardEngine.startInternal Starting Servlet Engine: Apache Tomcat/8.0.39 21-Jul-2017 11:42:30.027 信息 [localhost-startStop-1] org.apache.jasper.servlet.TldScanner.scanJars At least one JAR was scanned for TLDs yet contained no TLDs. Enable debug logging for this logger for a complete list of JARs that were scanned but no TLDs were found in them. Skipping unneeded JARs during scanning can improve startup time and JSP compilation time. log4j:WARN Failed to set property [conversionPattern] to value ""%d{yyyy-MM-dd HH:mm:ss SSS} %-5p [%T] [%x] [%t]%C{1}.%M(%L) - %m%n"". java.lang.reflect.InvocationTargetException at sun.reflect.NativeMethodAccessorImpl.invoke0(Native Method) at sun.reflect.NativeMethodAccessorImpl.invoke(NativeMethodAccessorImpl.java:62) at sun.reflect.DelegatingMethodAccessorImpl.invoke(DelegatingMethodAccessorImpl.java:43) at java.lang.reflect.Method.invoke(Method.java:498) at org.apache.log4j.config.PropertySetter.setProperty(PropertySetter.java:245) at org.apache.log4j.config.PropertySetter.setProperty(PropertySetter.java:204) at org.apache.log4j.config.PropertySetter.setProperties(PropertySetter.java:169) at org.apache.log4j.config.PropertySetter.setProperties(PropertySetter.java:104) at org.apache.log4j.PropertyConfigurator.parseAppender(PropertyConfigurator.java:805) at org.apache.log4j.PropertyConfigurator.parseCategory(PropertyConfigurator.java:768) at org.apache.log4j.PropertyConfigurator.configureRootCategory(PropertyConfigurator.java:648) at org.apache.log4j.PropertyConfigurator.doConfigure(PropertyConfigurator.java:514) at org.apache.log4j.PropertyConfigurator.doConfigure(PropertyConfigurator.java:580) at org.apache.log4j.helpers.OptionConverter.selectAndConfigure(OptionConverter.java:526) at org.apache.log4j.LogManager.(LogManager.java:127) at org.apache.log4j.Logger.getLogger(Logger.java:104) at org.apache.commons.logging.impl.Log4JLogger.getLogger(Log4JLogger.java:289) at org.apache.commons.logging.impl.Log4JLogger.(Log4JLogger.java:109) at sun.reflect.NativeConstructorAccessorImpl.newInstance0(Native Method) at sun.reflect.NativeConstructorAccessorImpl.newInstance(NativeConstructorAccessorImpl.java:62) at sun.reflect.DelegatingConstructorAccessorImpl.newInstance(DelegatingConstructorAccessorImpl.java:45) at java.lang.reflect.Constructor.newInstance(Constructor.java:423) at org.apache.commons.logging.impl.LogFactoryImpl.createLogFromClass(LogFactoryImpl.java:1116) at org.apache.commons.logging.impl.LogFactoryImpl.discoverLogImplementation(LogFactoryImpl.java:914) at org.apache.commons.logging.impl.LogFactoryImpl.newInstance(LogFactoryImpl.java:604) at org.apache.commons.logging.impl.LogFactoryImpl.getInstance(LogFactoryImpl.java:336) at org.apache.commons.logging.impl.LogFactoryImpl.getInstance(LogFactoryImpl.java:310) at org.apache.commons.logging.LogFactory.getLog(LogFactory.java:685) at org.springframework.beans.CachedIntrospectionResults.(CachedIntrospectionResults.java:62) at org.springframework.web.util.IntrospectorCleanupListener.contextInitialized(IntrospectorCleanupListener.java:75) at org.apache.catalina.core.StandardContext.listenerStart(StandardContext.java:4853) at org.apache.catalina.core.StandardContext.startInternal(StandardContext.java:5314) at org.apache.catalina.util.LifecycleBase.start(LifecycleBase.java:145) at org.apache.catalina.core.ContainerBase$StartChild.call(ContainerBase.java:1408) at org.apache.catalina.core.ContainerBase$StartChild.call(ContainerBase.java:1398) at java.util.concurrent.FutureTask.run(FutureTask.java:266) at java.util.concurrent.ThreadPoolExecutor.runWorker(ThreadPoolExecutor.java:1142) at java.util.concurrent.ThreadPoolExecutor$Worker.run(ThreadPoolExecutor.java:617) at java.lang.Thread.run(Thread.java:748) Caused by: java.lang.ExceptionInInitializerError at org.skywalking.apm.toolkit.log.log4j.v1.x.TraceIdPatternParser.finalizeConverter(TraceIdPatternParser.java:18) at org.apache.log4j.helpers.PatternParser.parse(PatternParser.java:186) at org.apache.log4j.PatternLayout.setConversionPattern(PatternLayout.java:450) ... 39 more Caused by: java.lang.reflect.InvocationTargetException at sun.reflect.NativeMethodAccessorImpl.invoke0(Native Method) at sun.reflect.NativeMethodAccessorImpl.invoke(NativeMethodAccessorImpl.java:62) at sun.reflect.DelegatingMethodAccessorImpl.invoke(DelegatingMethodAccessorImpl.java:43) at java.lang.reflect.Method.invoke(Method.java:498) at org.skywalking.apm.toolkit.log.log4j.v1.x.TraceIdPatternConverter.(TraceIdPatternConverter.java) ... 42 more Caused by: java.lang.reflect.InvocationTargetException at sun.reflect.NativeMethodAccessorImpl.invoke0(Native Method) at sun.reflect.NativeMethodAccessorImpl.invoke(NativeMethodAccessorImpl.java:62) at sun.reflect.DelegatingMethodAccessorImpl.invoke(DelegatingMethodAccessorImpl.java:43) at java.lang.reflect.Method.invoke(Method.java:498) at org.skywalking.apm.dependencies.net.bytebuddy.dynamic.Nexus.initialize(Nexus.java:114) ... 47 more Caused by: java.lang.IllegalArgumentException: Can not set static org.skywalking.apm.agent.core.plugin.interceptor.enhance.ClassInstanceMethodsInterceptor field org.skywalking.apm.toolkit.log .log4j.v1.x.TraceIdPatternConverter.delegate$kmvn8e1 to org.skywalking.apm.agent.core.plugin.interceptor.enhance.ClassInstanceMethodsInterceptor at sun.reflect.UnsafeFieldAccessorImpl.throwSetIllegalArgumentException(UnsafeFieldAccessorImpl.java:167) at sun.reflect.UnsafeFieldAccessorImpl.throwSetIllegalArgumentException(UnsafeFieldAccessorImpl.java:171) at sun.reflect.UnsafeStaticObjectFieldAccessorImpl.set(UnsafeStaticObjectFieldAccessorImpl.java:79) at java.lang.reflect.Field.set(Field.java:764) at org.skywalking.apm.dependencies.net.bytebuddy.implementation.LoadedTypeInitializer$ForStaticField.onLoad(LoadedTypeInitializer.java:105) at org.skywalking.apm.dependencies.net.bytebuddy.implementation.LoadedTypeInitializer$Compound.onLoad(LoadedTypeInitializer.java:180) at org.skywalking.apm.dependencies.net.bytebuddy.implementation.LoadedTypeInitializer$Compound.onLoad(LoadedTypeInitializer.java:180) at org.skywalking.apm.dependencies.net.bytebuddy.agent.builder.AgentBuilder$InitializationStrategy$SelfInjection$Dispatcher$InjectingInitializer.onLoad(AgentBuilder.java:2430) ... 52 more log4j:WARN Failed to set property [conversionPattern] to value ""%d{yyyy-MM-dd HH:mm:ss SSS} %-5p [%T] [%x] [%t]%C{1}.%M(%L) - %m%n"". java.lang.reflect.InvocationTargetException at sun.reflect.NativeMethodAccessorImpl.invoke0(Native Method) at sun.reflect.NativeMethodAccessorImpl.invoke(NativeMethodAccessorImpl.java:62) at sun.reflect.DelegatingMethodAccessorImpl.invoke(DelegatingMethodAccessorImpl.java:43) at java.lang.reflect.Method.invoke(Method.java:498) at org.apache.log4j.config.PropertySetter.setProperty(PropertySetter.java:245) at org.apache.log4j.config.PropertySetter.setProperty(PropertySetter.java:204) at org.apache.log4j.config.PropertySetter.setProperties(PropertySetter.java:169) at org.apache.log4j.config.PropertySetter.setProperties(PropertySetter.java:104) at org.apache.log4j.PropertyConfigurator.parseAppender(PropertyConfigurator.java:805) at org.apache.log4j.PropertyConfigurator.parseCategory(PropertyConfigurator.java:768) at org.apache.log4j.PropertyConfigurator.configureRootCategory(PropertyConfigurator.java:648) at org.apache.log4j.PropertyConfigurator.doConfigure(PropertyConfigurator.java:514) at org.apache.log4j.PropertyConfigurator.doConfigure(PropertyConfigurator.java:580) at org.apache.log4j.helpers.OptionConverter.selectAndConfigure(OptionConverter.java:526) at org.apache.log4j.LogManager.(LogManager.java:127) at org.apache.log4j.Logger.getLogger(Logger.java:104) at org.apache.commons.logging.impl.Log4JLogger.getLogger(Log4JLogger.java:28  类比:使用 tomcat 6 和tomcat 7 没有问题，可以正常的使用 skywalking ,且生成traceId例如 Trace.1500605395032.-1092464309.23686.44.2 请大牛指点迷津，感激感谢！","closed","question,","guorj217","2017-07-21T04:26:28Z","2017-12-12T23:26:19Z"
"","357","建议：关于agent.application_code的自动获取","Please answer these questions before submitting your issue.  ### What version of sky-walking are you using? 3.1 ### 建议 agent.application_code没有配置的时候，建议尝试去获取一下spring boot项目的配置的spring.application.name的值","closed","","mmaxiaolei","2017-08-14T09:31:53Z","2018-11-20T09:42:32Z"
"","383","一个项目中同时使用mysql和oracle时，其中有一个数据源获取不到连接，报空指针的异常。","Please answer these questions before submitting your issue.  ### What version of sky-walking are you using? 3.1  ### What version of your OS? windows7，tomcat7.0.75  ### What version of your JRE? jdk1.8  ### What company or project? 通过探针技术获取三层关联信息。  ### What did you do? package est; import java.sql.Connection; package est; import java.sql.Connection; import java.sql.DriverManager; import java.sql.PreparedStatement; import java.sql.ResultSet;  public class MysqlService {         public static int exeSql() throws Exception{ 	     Class.forName(""com.mysql.jdbc.Driver""); 	     String url = ""jdbc:mysql://localhost:3306/test""; 	     String user = ""root""; 	     String password = ""root""; 	     Connection conn = DriverManager.getConnection(url, user, password); 	     PreparedStatement ps = conn.prepareStatement(""select count(*) as ct from user""); 	     ResultSet rs = ps.executeQuery(); 	     int cnt = 0; 	     if(rs.next()){ 		cnt = rs.getInt(""ct""); 	     } 	     rs.close(); 	    ps.close(); 	    conn.close(); 	    return cnt;         } }  package est;  import java.sql.Connection; import java.sql.DriverManager; import java.sql.PreparedStatement; import java.sql.ResultSet;  public class OracleService {  public static int exeSql() throws Exception{ 	Class.forName(""oracle.jdbc.driver.OracleDriver""); 	String url = ""jdbc:oracle:thin:@localhost:1521:xe""; 	String user = ""oracle""; 	String password = ""oracle""; 	Connection conn = DriverManager.getConnection(url, user, password); 	PreparedStatement ps = conn.prepareStatement(""select count(*) as ct from user""); 	ResultSet rs = ps.executeQuery(); 	int cnt = 0; 	if(rs.next()){ 		cnt = rs.getInt(""ct""); 	} 	rs.close(); 	ps.close(); 	conn.close(); 	return cnt; }  }  package est;  import java.io.IOException; import java.io.PrintWriter;  import javax.servlet.ServletException; import javax.servlet.http.HttpServlet; import javax.servlet.http.HttpServletRequest; import javax.servlet.http.HttpServletResponse;  public class HelloServlet extends HttpServlet {  public void doGet(HttpServletRequest request, HttpServletResponse response) 		throws ServletException, IOException {  	int cnt1 = 0, cnt2 = 0; 	 	try { 		cnt1 = MysqlService.exeSql(); 	} catch (Exception e) { 		e.printStackTrace(); 	} 	 	try { 		cnt2 = OracleService.exeSql(); 	} catch (Exception e) { 		e.printStackTrace(); 	}         // ------------省略------------","closed","bug,","yupd","2017-08-31T14:38:35Z","2017-12-12T23:26:21Z"
"","314","use example segments json post error","Please answer these questions before submitting your issue.  ### What version of sky-walking are you using? 3.1  ### What version of your OS? os x 10.12.5  ### What version of your JRE? 1.8.0_112-b16  ### What company or project? collector  ### What did you do? If possible, provide a way for reproducing the error. e.g. demo application, component version.   curl -H Content-Type: application/json ; charset=UTF-8 -XPOST http://localhost:12800/segments -d [     {         ""ts"": ""Segment.1490097253214.-866187727.57515.1.1"",         ""st"": 1490097253198,         ""et"": 0,         ""rs"": [             {                 ""ts"": ""parent_trace_0"",                 ""si"": 1,                 ""ac"": ""REMOTE_APP"",                 ""ph"": ""10.2.3.16:8080""             },             {                 ""ts"": ""parent_trace_1"",                 ""si"": 5,                 ""ac"": ""REMOTE_APP"",                 ""ph"": ""10.2.3.16:8080""             },             {                 ""ts"": ""parent_trace_2"",                 ""si"": 5,                 ""ac"": ""REMOTE_APP"",                 ""ph"": ""10.2.3.16:8080""             }         ],         ""ss"": [             {                 ""si"": 1,                 ""ps"": -1,                 ""st"": 1490097253228,                 ""et"": 0,                 ""on"": ""/serviceA"",                 ""ts"": {                     ""span.layer"": ""http""                 },                 ""tb"": {},                 ""ti"": {},                 ""lo"": []             },             {                 ""si"": 2,                 ""ps"": 1,                 ""st"": 1490097253230,                 ""et"": 0,                 ""on"": ""/db/sql"",                 ""ts"": {                     ""span.layer"": ""db""                 },                 ""tb"": {},                 ""ti"": {},                 ""lo"": [                     {                         ""tm"": 1490097253234,                         ""fi"": {                             ""stack"": ""java.lang.NullPointerException 	at com.a.eye.skywalking.trace.TraceSegmentTestCase.testSerialize(TraceSegmentTestCase.java:102) 	at sun.reflect.NativeMethodAccessorImpl.invoke0(Native Method) 	at sun.reflect.NativeMethodAccessorImpl.invoke(NativeMethodAccessorImpl.java:62) 	at sun.reflect.DelegatingMethodAccessorImpl.invoke(DelegatingMethodAccessorImpl.java:43) 	at java.lang.reflect.Method.invoke(Method.java:483) 	at org.junit.runners.model.FrameworkMethod$1.runReflectiveCall(FrameworkMethod.java:50) 	at org.junit.internal.runners.model.ReflectiveCallable.run(ReflectiveCallable.java:12) 	at org.junit.runners.model.FrameworkMethod.invokeExplosively(FrameworkMethod.java:47) 	at org.junit.internal.runners.statements.InvokeMethod.evaluate(InvokeMethod.java:17) 	at org.junit.runners.ParentRunner.runLeaf(ParentRunner.java:325) 	at org.junit.runners.BlockJUnit4ClassRunner.runChild(BlockJUnit4ClassRunner.java:78) 	at org.junit.runners.BlockJUnit4ClassRunner.runChild(BlockJUnit4ClassRunner.java:57) 	at org.junit.runners.ParentRunner$3.run(ParentRunner.java:290) 	at org.junit.runners.ParentRunner$1.schedule(ParentRunner.java:71) 	at org.junit.runners.ParentRunner.runChildren(ParentRunner.java:288) 	at org.junit.runners.ParentRunner.access$000(ParentRunner.java:58) 	at org.junit.runners.ParentRunner$2.evaluate(ParentRunner.java:268) 	at org.junit.runners.ParentRunner.run(ParentRunner.java:363) 	at org.junit.runner.JUnitCore.run(JUnitCore.java:137) 	at com.intellij.junit4.JUnit4IdeaTestRunner.startRunnerWithArgs(JUnit4IdeaTestRunner.java:68) 	at com.intellij.rt.execution.junit.IdeaTestRunner$Repeater.startRunnerWithArgs(IdeaTestRunner.java:51) 	at com.intellij.rt.execution.junit.JUnitStarter.prepareStreamsAndStart(JUnitStarter.java:237) 	at com.intellij.rt.execution.junit.JUnitStarter.main(JUnitStarter.java:70) 	at sun.reflect.NativeMethodAccessorImpl.invoke0(Native Method) 	at sun.reflect.NativeMethodAccessorImpl.invoke(NativeMethodAccessorImpl.java:62) 	at sun.reflect.DelegatingMethodAccessorImpl.invoke(DelegatingMethodAccessorImpl.java:43) 	at java.lang.reflect.Method.invoke(Method.java:483) 	at com.intellij.rt.execution.application.AppMain.main(AppMain.java:147) "",                             ""error.kind"": ""java.lang.NullPointerException"",                             ""event"": ""error""                         }                     }                 ]             }         ],         ""ac"": ""billing_app"",         ""gt"": [             ""Trace.1490097253227.-866187727.57515.1.2""         ]     } ] result: {""isSuccess"":false,""reason"":""For input string: \""[\n\""""}%","closed","question,","swift1911","2017-07-25T05:25:36Z","2017-07-25T07:53:02Z"
"","374","请求中调用的第三方接口被识别成2个链路","Please answer these questions before submitting your issue.  ### What version of sky-walking are you using? 3.1  ### What version of your OS? Linux ubuntu 17.04  ### What version of your JRE? 1.8.0_144  ### What company or project? 一个小demo  ### What did you do? 这是我请求中调用swagger接口的代码： ``` @ResponseBody 	@RequestMapping(""/user"") 	public List getAllUser(){ 		 //创建连接客户端         OkHttpClient client = new OkHttpClient();         //设置提交参数(post)         /*FormBody form = new FormBody.Builder()                 .add(""str"", ""test"")//添加参数的键值对                 .build();*/         Request request = new Request.Builder()                 .url(""http:192.168.1.5:8080/SpringSwagger/user/swagger?str=test"").get().build();         //创建""调用"" 对象         Call call = client.newCall(request);         try {             Response response = call.execute();//执行             if (response.isSuccessful()) {                 System.out.println(response.body().string());             }else{             	System.out.println(""================fail""+response.body().string());             }         } catch (IOException e) {             e.printStackTrace();         } 		return userRepos.findAll(); 	}  ``` 这是我swagger接口中的代码： ``` 	@ResponseBody 	@RequestMapping(value = ""/swagger"", method = RequestMethod.GET) 	public String test(@RequestParam String str) { 		return str; 	} ``` 当我请求/user时，在trace中/user和/swagger被分成了2个链路，/swagger并没有显示在/user的span中 这是为什么？ ![image](https://user-images.githubusercontent.com/23293169/29740121-d276c9b6-8a81-11e7-8cb2-0d816d3b39ed.png)","closed","","fddOs","2017-08-26T09:13:13Z","2017-12-12T23:26:21Z"
"","523","[Collector] provide sharding jdbc as storage","Please answer these questions before submitting your issue.  ### What version of sky-walking are you using? 3.1  ### What version of your OS? Linux  ### What version of your JRE? 1.8  ### What company or project? DangDang  **Provide sharding jdbc as storage**","closed","","oracle219","2017-10-17T03:15:40Z","2018-11-20T09:42:15Z"
"","315","Question about REST API Document","Please answer these questions before submitting your issue.  ### What version of sky-walking are you using? 3.1  ### What version of your OS? centos 6.7  ### What version of your JRE? 1.8.0_131  ### What company or project? collector  ### What did you do? If possible, provide a way for reproducing the error. e.g. demo application, component version.  https://github.com/wu-sheng/sky-walking/wiki/3.0-Collector-TraceSegment-in-JSON-format  哪些字段是必填字段，不能靠一个个猜吧……","closed","question,","swift1911","2017-07-26T12:46:27Z","2017-09-18T01:10:29Z"
"","200","sky-walking collector can't work properly, while using elasticsearch 5.4.0","Please answer these questions before submitting your issue.  ### What version of sky-walking are you using? 3.0.1-2017  ### What version of your OS? Ubuntu 16.04  ### What version of your JRE? 1.8.0_121  ### What did you do? If possible, provide a way for reproducing the error. e.g. demo application, component version.  The tracing data can't store to elasticsearch storage, the error info as follow:  [2017-05-23T16:28:23,403][DEBUG][o.e.a.b.TransportShardBulkAction] [node-2] [segment_idx][0] failed to execute bulk item (index) BulkShardRequest [[segment_idx][0]] containing [1968] requests org.elasticsearch.index.mapper.MapperParsingException: failed to parse  Caused by: com.fasterxml.jackson.core.JsonParseException: Illegal unquoted character ((CTRL-CHAR, code 10)): has to be escaped using backslash to be included in string value  Caused by: com.fasterxml.jackson.core.JsonParseException: Illegal unquoted character ((CTRL-CHAR, code 10)): has to be escaped using backslash to be included in string value  at [Source: org.elasticsearch.common.bytes.BytesReference$MarkSupportingStreamInputWrapper@3760f7a6; line: 1, column: 357]","closed","bug,","rzs840707","2017-05-23T10:33:01Z","2017-12-12T23:26:16Z"
"","304","compile failed","Please answer these questions before submitting your issue.  ### What version of sky-walking are you using?  3.1  ### What version of your OS?  mac  ### What version of your JRE?  JDK8  ### What company or project?  51  ### What did you do?  execute mvn -U package -DskipTests  and you will get an error like “Could not resolve dependencies for project org.skywalking:apm-resin-4.x-plugin:jar:3.1-2017: Could not find artifact com.caucho:resin:jar:3.0.26 ”","closed","question,","dumbdonkey","2017-07-19T09:24:22Z","2017-07-19T09:32:57Z"
"","531","can skywalking  support weblogic and ejb?","Please answer these questions before submitting your issue.  ### What version of sky-walking are you using?   ### What version of your OS? llinux  ### What version of your JRE? 1.8  ### What company or project? csair  ### What did you do?  can skywalking  support weblogic and ejb?","closed","question,","LifeFly","2017-10-20T00:47:55Z","2017-10-20T03:26:51Z"
"","568","[Collector] 能否支持es数据删除（让es中每种数据都按日期建立索引名称来存储，删除时按日期，逻辑上改动貌似不大）","Please answer these questions before submitting your issue.  ### What version of sky-walking are you using?   ### What version of your OS?   ### What version of your JRE?   ### What company or project?   ### What did you do? If possible, provide a way for reproducing the error. e.g. demo application, component version.","closed","","siyuan494","2017-11-02T10:00:04Z","2018-01-11T05:28:11Z"
"","500","webui能否支持用户名和密码登录 和 告警支持","Please answer these questions before submitting your issue.  ### What version of sky-walking are you using?   ### What version of your OS?   ### What version of your JRE?   ### What company or project?   ### What did you do? If possible, provide a way for reproducing the error. e.g. demo application, component version.","closed","duplicate,","xianleizheng","2017-10-11T07:21:04Z","2018-01-11T05:30:42Z"
"","397",".net 客户端在哪里","Please answer these questions before submitting your issue.  ### What version of sky-walking are you using?   ### What version of your OS?   ### What version of your JRE?   ### What company or project?   ### What did you do? If possible, provide a way for reproducing the error. e.g. demo application, component version.","closed","question,","brotherhorse","2017-09-05T08:38:08Z","2017-09-09T11:47:57Z"
"","556","AgentPackagePath can't find path in workspace?","org.skywalking.apm.agent.core.boot.AgentPackagePath.findPath()： line 71: String classLocation = urlString.substring(urlString.indexOf(""file:""), urlString.length() - classResourcePath.length());  **Because the value of ""classLocation"" is startwith ""file:"",is url type,and it can't pass follow unit test**  ----------this is unit test---------------------------------------------------- @Test     public void testGetPath() throws AgentPackageNotFoundException {         File file = AgentPackagePath.getPath();         Assert.assertTrue(file.exists());     }","closed","question,","neeuq","2017-10-27T10:39:07Z","2017-12-12T02:04:21Z"
"","272","Fix plug in logger info","Optimize the plug-in load hints","closed","","trey03","2017-07-07T07:20:29Z","2017-07-07T07:35:05Z"
"","392","Unify package out directory","Only unify agent package.","closed","","ascrutae","2017-09-04T12:07:15Z","2017-09-04T14:34:43Z"
"","197","add okhttp plugin(provide synchronous http calls )","OKhttp provide synchronous and asynchronous calls.  This is a okhttp plugin, just intercept synchronous calls.   OKhttp Plugin Contribution Link: /sky-walking/apm-sniffer/apm-sdk-plugin/http-plugin/okhttp-3.x-plugin/ Supported Version: okhttp-3.X.X I have tested based on version  okhttp-3.7.0，it can work.  ### trace DAG ![tracedag](https://sky-walking.github.io/page-resources/3.1/okhttp-plugin/tracedag.png)  ### trace stack ![tracestack](https://sky-walking.github.io/page-resources/3.1/okhttp-plugin/tracestack.png)  ### span infomation ![spaninfo](https://sky-walking.github.io/page-resources/3.1/okhttp-plugin/spaninfo.png)  #160","closed","","peng-yongsheng","2017-05-16T07:14:09Z","2017-05-31T01:45:12Z"
"","14","offset文件中的无用文件没有被删除","offset文件中的无用文件没有被删除，需要在启动服务的时候，与目录夹下的文件进行校验。","closed","bug,","ascrutae","2015-12-24T08:22:13Z","2015-12-24T09:45:10Z"
"","1","RegisterPersistenceThread没有合理的使用offset文件和offset.bak文件","offset.bak文件没有发挥备份作用。在offset或offset.bak写入失败后，没有做相应处理","closed","bug,","wu-sheng","2015-11-23T15:16:35Z","2017-12-12T23:26:10Z"
