"#","No","Issue Title","Issue Details","State","Labels","User name","created","Updated"
"","169","grcp using with skywalking-toolkit-opentracing","client 和server没有关联 拓补图上体现不出调用流程  client interceptor code ```java package cn.enncloud.ceres.core.interceptor;  import cn.enncloud.ceres.Constants; import io.grpc.*; import io.opentracing.Span; import io.opentracing.Tracer; import io.opentracing.contrib.ActiveSpanSource; import io.opentracing.contrib.OperationNameConstructor; import io.opentracing.propagation.Format; import io.opentracing.propagation.TextMap; import io.opentracing.tag.Tags;  import java.util.Iterator; import java.util.Map;  /**  * Created by Serious on 2017/4/25.  */ public class SWTraceClientInterceptor implements ClientInterceptor {      private final Tracer tracer;     private final OperationNameConstructor operationNameConstructor;     private final ActiveSpanSource activeSpanSource;      /**      * @param tracer to use to trace requests      */     public SWTraceClientInterceptor(Tracer tracer) {         this.tracer = tracer;         this.operationNameConstructor = OperationNameConstructor.DEFAULT;         this.activeSpanSource = ActiveSpanSource.GRPC_CONTEXT;     }       @Override     public  ClientCall interceptCall(MethodDescriptor method, CallOptions callOptions, Channel next) {         final String operationName = operationNameConstructor.constructOperationName(method);          Span activeSpan = this.activeSpanSource.getActiveSpan();         final Span span = createSpanFromParent(activeSpan, operationName);         Tags.COMPONENT.set(span, Constants.CERES);         Tags.SPAN_KIND.set(span, Tags.SPAN_KIND_CLIENT);         Tags.PEER_HOSTNAME.set(span,""127.0.0.1"");         Tags.PEER_PORT.set(span, (short) 1234);         return new ForwardingClientCall.SimpleForwardingClientCall(next.newCall(method, callOptions)) {             @Override             public void start(Listener responseListener, final Metadata headers) {                   tracer.inject(span.context(), Format.Builtin.HTTP_HEADERS, new TextMap() {                     @Override                     public void put(String key, String value) {                         Metadata.Key headerKey = Metadata.Key.of(key, Metadata.ASCII_STRING_MARSHALLER);                         headers.put(headerKey, value);                     }                      @Override                     public Iterator iterator() {                         throw new UnsupportedOperationException(                                 ""TextMapInjectAdapter should only be used with Tracer.inject()"");                     }                 });                  Listener tracingResponseListener = new ForwardingClientCallListener                         .SimpleForwardingClientCallListener(responseListener) {                      @Override                     public void onHeaders(Metadata headers) {                         delegate().onHeaders(headers);                     }                      @Override                     public void onMessage(RespT message) {                         delegate().onMessage(message);                     }                      @Override                     public void onClose(Status status, Metadata trailers) {                         span.log(""Call failed"", status.getDescription());                         span.finish();                         delegate().onClose(status, trailers);                     }                 };                  delegate().start(tracingResponseListener, headers);             }          }                  ;     }       private Span createSpanFromParent(Span parentSpan, String operationName) {         if (parentSpan == null) {             return tracer.buildSpan(operationName).start();         } else {             return tracer.buildSpan(operationName).asChildOf(parentSpan).start();         }     }  } ```  server interceptor code ```java package cn.enncloud.ceres.core.interceptor;  import cn.enncloud.ceres.Constants; import io.grpc.*; import io.opentracing.Span; import io.opentracing.SpanContext; import io.opentracing.Tracer; import io.opentracing.contrib.OpenTracingContextKey; import io.opentracing.propagation.Format; import io.opentracing.propagation.TextMapExtractAdapter; import io.opentracing.tag.Tags; import org.slf4j.Logger; import org.slf4j.LoggerFactory;  import java.util.HashMap; import java.util.HashSet; import java.util.Map; import java.util.Set;  /**  * Created by Serious on 2017/4/25.  */ public class SWServerTracingInterceptor implements ServerInterceptor {     private static final Logger logger = LoggerFactory.getLogger(SWServerTracingInterceptor.class);     private final Tracer tracer;     private final Set tracedAttributes;      /**      * @param tracer used to trace requests      */     public SWServerTracingInterceptor(Tracer tracer) {         this.tracer = tracer;         this.tracedAttributes = new HashSet();     }      public enum ServerRequestAttribute {         HEADERS,         METHOD_TYPE,         METHOD_NAME,         CALL_ATTRIBUTES     }       @Override     public  ServerCall.Listener interceptCall(ServerCall call, Metadata headers, ServerCallHandler next) {         Map headerMap = new HashMap();         for (String key : headers.keys()) {             if (!key.endsWith(Metadata.BINARY_HEADER_SUFFIX)) {                 String value = headers.get(Metadata.Key.of(key, Metadata.ASCII_STRING_MARSHALLER));                 headerMap.put(key, value);             }          }          final String operationName = call.getMethodDescriptor().getFullMethodName();         final Span span = getSpanFromHeaders(headerMap, operationName);         Tags.COMPONENT.set(span, Constants.CERES);         Tags.SPAN_KIND.set(span, Tags.SPAN_KIND_SERVER);         Tags.PEER_HOSTNAME.set(span, ""127.0.0.1"");         Tags.PEER_PORT.set(span, (short) 4321);         for (ServerRequestAttribute attr : this.tracedAttributes) {             switch (attr) {                 case METHOD_TYPE:                     span.setTag(""grpc.method_type"", call.getMethodDescriptor().getType().toString());                     break;                 case METHOD_NAME:                     span.setTag(""grpc.method_name"", call.getMethodDescriptor().getFullMethodName());                     break;                 case CALL_ATTRIBUTES:                     span.setTag(""grpc.call_attributes"", call.getAttributes().toString());                     break;                 case HEADERS:                     span.setTag(""grpc.headers"", headers.toString());                     break;             }         }          Context ctxWithSpan = Context.current().withValue(OpenTracingContextKey.getKey(), span);         ServerCall.Listener listenerWithContext = Contexts.interceptCall(ctxWithSpan, call, headers, next);         logger.debug(""span :{}"", span);         span.finish();         return new ForwardingServerCallListener.SimpleForwardingServerCallListener(listenerWithContext) {              @Override             public void onMessage(ReqT message) {                 delegate().onMessage(message);             }              @Override             public void onHalfClose() {                 delegate().onHalfClose();             }              @Override             public void onCancel() {                 delegate().onCancel();             }              @Override             public void onComplete() {                 delegate().onComplete();             }         };     }      private Span getSpanFromHeaders(Map headers, String operationName) {         Span span;         try {             SpanContext parentSpanCtx = tracer.extract(Format.Builtin.HTTP_HEADERS,                     new TextMapExtractAdapter(headers));             if (parentSpanCtx == null) {                 span = tracer.buildSpan(operationName).start();             } else {                 span = tracer.buildSpan(operationName).asChildOf(parentSpanCtx).start();             }         } catch (IllegalArgumentException iae) {             span = tracer.buildSpan(operationName)                     .withTag(""Error"", ""Extract failed and an IllegalArgumentException was thrown"")                     .start();         }         return span;     } }  ``` ![image](https://cloud.githubusercontent.com/assets/464213/25373741/6a504d22-29cd-11e7-9029-cfbec3d2016a.png) ![Uploading image.png…]()","closed","bug,","SeriousMa","2017-04-25T07:41:12Z","2017-12-12T23:26:14Z"
"","99","Collector client just listening receiver worker","Client will listening all workers in cluster. It's not a good idea.  We will change it that client just listening receiver workers.","closed","bug,","peng-yongsheng","2017-03-05T15:03:44Z","2017-04-28T02:44:28Z"
"","349","Refactor the interceptor method parameter list for SpringMVC plugin.","cc @ascrutae @pengys5 @hanahmily","closed","","wu-sheng","2017-08-10T09:55:37Z","2017-08-10T11:59:32Z"
"","225","Create CODE_OF_CONDUCT.md","cc @ascrutae @pengys5 @bai-yang","closed","","wu-sheng","2017-06-15T02:11:45Z","2017-06-15T02:23:24Z"
"","324","Add option to start/stop collecting http get/post parameter","cc @ascrutae @pengys5   I want to add this feature, after we have config downstream mechanism.","closed","plugin,","wu-sheng","2017-07-29T01:37:06Z","2020-01-03T01:04:35Z"
"","323","Add option to start/stop collecting sql parameter","cc @ascrutae @pengys5   I want to add this feature, after we have config downstream mechanism.","closed","plugin,","wu-sheng","2017-07-29T01:36:29Z","2019-07-02T14:52:22Z"
"","340","Support Jetty and Jetty Client plugin","BTW Jetty client has higher priority. Whether support in 3.2, depends on the dead line.","closed","","wu-sheng","2017-08-07T09:30:56Z","2017-12-12T23:26:20Z"
"","471","fixed #469","because of remove the collection item action inside of collection for each action.","closed","","peng-yongsheng","2017-09-27T10:03:22Z","2017-09-27T10:45:23Z"
"","415","Fixed the bug that application calls sum incorrect.","Because of merge method return a non merged value .","closed","","peng-yongsheng","2017-09-13T16:15:20Z","2017-09-13T22:46:31Z"
"","386","Performance evaluation test result:","Because of laptop just have 100M network card and sata disk, so 100 million segment process by collector used 255 second, but cpu just used 28%","closed","","peng-yongsheng","2017-09-03T08:20:22Z","2017-09-03T13:21:03Z"
"","219","Fix OutofMemory of Span.ThrowableTransformer.convert2String","Based on the community feedback, `Span.ThrowableTransformer.convert2String` has risk of triggering OOM.  So, I recommend to adjuct this method: 1. Restrict message/stack length should be in the `while` loop, to avoid too long stack, even loop cause. 1. Add `catch` for this method, to avoid exception. In some case, the application framework forbid you to get the stack.","closed","bug,","wu-sheng","2017-06-08T03:12:40Z","2017-12-12T23:26:16Z"
"","318","Fix the wrong operationName of PreparedStatement#execute(String)","Based on @aliluyahoho 's report","closed","bug,","wu-sheng","2017-07-28T03:08:27Z","2017-07-28T06:24:57Z"
"","249","Refactor RabbitMQ plugin for better performance","Based on #241","closed","","wu-sheng","2017-06-27T01:24:20Z","2017-12-12T23:26:17Z"
"","248","Refactor the jdbc plugin for better performance","Based on #241","closed","wontfix,","wu-sheng","2017-06-27T01:23:49Z","2017-12-12T23:26:17Z"
"","68","Provide multi interceptor point to enhance a single class","Avoid using string.equal, instanceof, if stmt in interuptors, in order to judge the method.  Support intecuptors to target particular methods in a class, and provide multi interceptors to enhance whole class.","closed","","wu-sheng","2016-11-28T22:47:05Z","2017-12-12T23:26:11Z"
"","527","[Agent] Keep the max size of segment","Avoid too many active/finished span, too many tags and logs of each span. Make sure the max size of segment is nearly predictable.  FYI @OpenSkywalking/pmc","closed","agent,","wu-sheng","2017-10-18T15:08:08Z","2018-02-08T06:53:07Z"
"","162","Push collector docker image when sky-walking tagged","Auto push collector docker image when sky-walking tagged","closed","","ascrutae","2017-04-24T09:34:17Z","2017-04-26T14:40:25Z"
"","24","atominteger的运用会导致sdk和server的部分问题","atominteger的使用，在自增触及到interger上限时，会转到负数(整数越界) 1.api端造成缓存的span在临界值附近被快速铺盖，造成数据丢失。长期运行的程序易发疲劳周期性问题 2.server端在临界值附近造成写入堵塞，突发性降低性能","closed","duplicate,","wu-sheng","2016-01-25T14:34:10Z","2017-12-12T23:26:10Z"
"","310","Support Spring Web RestTemplete","At least matches the version of Spring MVC, maybe 4.x .","closed","","wu-sheng","2017-07-21T08:42:05Z","2017-12-12T23:26:19Z"
"","149","Add checkstyle","As we have more contributors, `code-style` becomes more and more important, as I comment in MongoDB pr: https://github.com/wu-sheng/sky-walking/pull/148#discussion_r111752259.  So, I will add files to support this.  cc @ascrutae @pengys5","closed","","wu-sheng","2017-04-18T01:52:49Z","2017-04-20T04:54:03Z"
"","151","Response for ""Add checkstyle""","As I requested at #149 , this pr responses for that.  @pengys5 @ascrutae I passed all test cases. But I assume those are not enough. So you two, please run your integration tests on your local with brach `feature/149`, and make sure everything is still good.","closed","","wu-sheng","2017-04-18T05:31:26Z","2017-04-20T04:54:07Z"
"","206","Update the byte-buddy","As byte-buddy released several versions, we should catch up.  I will do the updates recently","closed","","wu-sheng","2017-06-04T05:07:15Z","2017-07-08T12:58:02Z"
"","457","RemoteCommonServiceGrpc can not find in branch master","apm-collector/apm-collector-remote/src/main/proto/RemoteCommonService.proto    this proto file can not find  RemoteCommonServiceGrpc","closed","question,","reesechou2014","2017-09-24T03:09:07Z","2018-10-19T02:41:14Z"
"","563","Distruptor queue exits unexpectedly, collector hangs up.","An unknown exception occurs in event handler, the disruptor event handler exits, so the collector exchange mechanism stopped.  we should 1. Add an error handler for disruptor. 1. Keep our eyes on the exception, and try to find out why.","closed","bug,","wu-sheng","2017-11-01T01:07:52Z","2017-12-12T23:26:26Z"
"","276","support agent core testcase","agent core : 68% classes, 57% lines covered","closed","","ascrutae","2017-07-08T08:06:38Z","2020-09-28T05:45:50Z"
"","282","Support SpringMVC Controller with annotation plugin","After we have #281 , we can support `@Controller` and `@RequestMapping` in Spring MVC.   In doing this, please remember these: 1. Support empty operationName when creating span. 1. Tomcat plugin set operationName in `afterMethod`.","closed","","wu-sheng","2017-07-12T01:55:17Z","2017-12-12T23:26:18Z"
"","237","Performance Test of javaagent for 3.2","After 3.3, sky-walking released almost all important feature for a distributed tracing system. So we should build a demo based on Spring Cloud, like `A -->  B  ---> DB`  Test case should base on 1000 tps, with or without sampling, then, we can focus on how to improving the performance.   @ascrutae , you can ask @pengys5 for machine to do this.","closed","","wu-sheng","2017-06-21T07:56:24Z","2017-12-12T23:26:17Z"
"","190","skywalking agent config support dynamic effective","Adding a config watcher and a notifier to support the config effective dynamically","closed","wontfix,","ascrutae","2017-05-03T01:56:14Z","2019-04-03T17:47:14Z"
"","293","Feature/266","add worker framework and compile successful","closed","","peng-yongsheng","2017-07-17T14:35:06Z","2017-07-17T15:02:03Z"
"","163","Push the collector docker image when sky-walking is tagged","Add the following variables and the corresponding values into `Environment Variables` of corresponding project in Travis CI ``` DOCKER_PASSWORD: the password of docker user  DOCKER_USERNAME: username of docker ```","closed","","ascrutae","2017-04-24T09:38:50Z","2017-04-26T06:47:10Z"
"","491","add rest mapping such as GetMapping","add rest mapping such as GetMapping, PostMapping....","closed","","clevertension","2017-10-08T10:31:03Z","2017-10-08T11:11:03Z"
"","187","add resin plugin","add resin plugin #184","closed","","bai-yang","2017-04-30T13:55:27Z","2017-05-10T11:33:30Z"
"","185","add resin plugin","add resin plugin #184","closed","","bai-yang","2017-04-30T12:12:18Z","2017-04-30T12:22:53Z"
"","341","Modify TraceSegmentReference proto in TraceSegmentService","add entryApplicationInstanceId attribute that let collector known the entry service which application instance send.","closed","","peng-yongsheng","2017-08-07T14:53:36Z","2017-08-08T01:51:30Z"
"","154","Update README.md","add contributors","closed","","bai-yang","2017-04-20T12:37:24Z","2017-04-20T13:23:36Z"
"","435","Add calendar for every page","Add calendar to select any time point.","closed","","wu-sheng","2017-09-18T08:44:13Z","2017-12-12T23:26:22Z"
"","449","add auto local jar file installation before compile","add auto local jar file installation before compile","closed","","clevertension","2017-09-20T06:06:09Z","2017-09-20T07:25:05Z"
"","447","add auto local jar file installation before compile","add auto local jar file installation before compile","closed","","clevertension","2017-09-20T04:41:26Z","2017-10-11T11:09:48Z"
"","485","[UI] Make span more clearly in Trace Stack Page","Add an icon (e.g. red-X) in the Trace Stack Page to identify this span exits with expcetion log.","closed","feature,","wu-sheng","2017-09-30T02:46:37Z","2019-01-11T02:13:04Z"
"","78","Add comments","Add all necessary comments to sky-walking project.  @ascrutae , don't miss them again.","closed","","wu-sheng","2017-01-03T13:28:03Z","2017-02-26T02:19:18Z"
"","401","Support query error trace","Add a new condition for trace query.","closed","","wu-sheng","2017-09-08T02:51:01Z","2017-12-12T23:26:21Z"
"","579","Add  MongoDB Java Driver 2.13.x-2.14.x enhance plugin","Add  MongoDB 2.x enhance plugin.  ![default](https://user-images.githubusercontent.com/8610107/32542150-ae7b96bc-c4ac-11e7-938d-4ffc481344bc.PNG)","closed","","lytscu","2017-11-08T09:30:02Z","2017-11-20T09:40:58Z"
"","320","why doesn't sky-walking support run-time agent?","According [oracle document ](https://docs.oracle.com/javase/8/docs/api/java/lang/instrument/package-summary.html) which says one can start agents after vm startup.   Also, I've checked [btrace](https://github.com/btraceio/btrace) which has implemented this.  Should we also support this?","closed","question,","dumbdonkey","2017-07-28T05:02:26Z","2020-08-12T09:22:02Z"
"","474","Merge pull request #1 from wu-sheng/master","Access to the latest data","closed","","IluckySi","2017-09-28T06:43:27Z","2017-09-28T06:55:20Z"
"","258","Failed to access Injectable class","`org.skywalking.apm.plugin.dubbo.DubboInterceptor$1` is anonymous inner class for `Injectable`. Is that byte-buddy support access anonymous inner class in the interceptor method ? Here is the error log ``` java.lang.IllegalAccessError: tried to access class org.skywalking.apm.plugin.dubbo.DubboInterceptor$1 from class org.skywalking.apm.plugin.dubbo.DubboInterceptor 	at org.skywalking.apm.plugin.dubbo.DubboInterceptor.beforeMethod(DubboInterceptor.java:60) 	at org.skywalking.apm.agent.core.plugin.interceptor.enhance.InstMethodsInter.intercept(InstMethodsInter.java:62) 	at com.alibaba.dubbo.monitor.support.MonitorFilter.invoke(MonitorFilter.java) 	at com.alibaba.dubbo.rpc.protocol.ProtocolFilterWrapper$1.invoke(ProtocolFilterWrapper.java:91) 	at com.alibaba.dubbo.rpc.protocol.dubbo.filter.FutureFilter.invoke(FutureFilter.java:53) 	at com.alibaba.dubbo.rpc.protocol.ProtocolFilterWrapper$1.invoke(ProtocolFilterWrapper.java:91) 	at com.alibaba.dubbo.rpc.filter.ConsumerContextFilter.invoke(ConsumerContextFilter.java:48) ```","closed","bug,","ascrutae","2017-07-01T17:27:17Z","2017-07-02T13:58:12Z"
"","241","Remove EnhancedClassInstanceContext, and left an Object type field ( default null ) for Intercepter.","`EnhancedClassInstanceContext` contain a Map type field, which will cost memory and gc if the intercepted classes are created in high frequency, also set operation costs more time than an explicit type.  So I will change it, the interceptor determine whether need this field, which type shoud it be, how to initialize it, and how to use it. The plugin framework only injects this field for giving the interceptor the opportunity.","closed","","wu-sheng","2017-06-24T01:51:46Z","2017-07-08T12:23:50Z"
"","114","[Collector] Provide package ability for collector-module","`collector-module` must start up by `Java Main`. So we should provide a package ability to archive a **collector.tar** after `mvn package`.","closed","","wu-sheng","2017-03-24T07:34:58Z","2017-12-12T23:26:13Z"
"","387","Move apm-toolkit-trace-context into apm-toolkit-trace","`apm-toolkit-trace-context` has too little feature, please move it into `apm-toolkit-trace`. From 3.2, all features about manual tracing by skywalking API , should all be included in this repository.  cc @pengys5","closed","","wu-sheng","2017-09-04T01:28:47Z","2017-12-12T23:26:21Z"
"","189","Witness class mechanism fails, when its classloader is not the default(BootupClassLoader)","`AbstractClassEnhancePluginDefine.classTypePool` is initialized by `TypePool classTypePool = TypePool.Default.ofClassPath();`.  IMO, this has a potential bug, when the witness class can't be loaded by default ClassLoader, witness class resolution will not be resolved.  cc @sky-walking","closed","bug,","wu-sheng","2017-05-02T21:43:59Z","2017-12-12T23:26:15Z"
"","381","Add Sharding-JDBC plugin.  Provided by dangdang.com","[Sharding-JDBC](http://shardingjdbc.io) is an open source distributed database middleware, as a JDBC driver extension, migrate legacy code almost zero costs. Sharding-JDBC is considered as a micro-service-oriented and cloud-native java library, which provides sharding databases and tables, read/write splitting, and distributed sequence features, also provides the B.A.S.E transaction.  The plugin will extract trace data from the router layer of Sharding-JDBC to sky-walking collectors.","closed","","hanahmily","2017-08-31T07:21:33Z","2017-10-13T06:55:03Z"
"","379","Add linkerd plugin. Provided by dangdang.com","[Linkerd](https://linkerd.io) is a transparent service mesh, designed to make modern applications safe and sane by transparently adding service discovery, load balancing, failure handling, instrumentation, and routing to all inter-service communication.  The plugin is designed to extract  trace data from linkerd internal to the sky-walking collectors.","closed","wontfix,","hanahmily","2017-08-31T06:28:59Z","2017-12-01T00:58:37Z"
"","73","support trace Hprose-java","[Hprose](https://github.com/andot/hprose) (High Performance Remote Object Service Engine）,  support multi-platforms, sky-walking choose to support its java-edition.  @andot","closed","","wu-sheng","2016-12-15T09:43:26Z","2017-12-12T23:26:12Z"
"","403","fix issue that cpu metric data is incorrect","@wu-sheng  @pengys5","closed","","ascrutae","2017-09-09T09:25:14Z","2017-09-09T11:48:22Z"
"","408","fix package issue","@wu-sheng","closed","","ascrutae","2017-09-10T08:23:33Z","2017-09-10T08:37:00Z"
"","232","Support application JVM info, based on instance discovery","@pengys5 We have to decide how and when support this. I am afraid the instance discovery mechanism can't be ready in short time.  cc @ascrutae","closed","","wu-sheng","2017-06-18T11:57:12Z","2017-12-12T23:26:17Z"
"","424","Support H2 storage modules at Collector Side","@pengys5 has already provided the H2 modules, but didn't provide the dao to access(read/write) data.   After we have this, we can start up collector without es, and of course, don't support cluster mode.","closed","","wu-sheng","2017-09-15T11:27:42Z","2017-10-23T12:10:09Z"
"","398","fix time bucket issue and fix issue  that check style failed","@pengys5","closed","","ascrutae","2017-09-05T11:55:54Z","2017-09-07T03:25:00Z"
